NAME,WEEK,DATE,EVENT_TYPE,ISO3,COUNTRY,EVENT_NAME,GRADE,DATE_NOTIFY,DATE_START,DATE_END,CASES_TOTAL,CASES_CONFIRMED,DEATHS,CFR,DESCRIPTION
OEW11-1117032024,11,11 - 17 Mar 2024,Ongoing,NGA,Nigeria,Dengue,Grade 3,2023-11-01,2023-01-01,2023-12-19,72.0,14.0,,0.00%,"Currently, there is an ongoing outbreak of Dengue fever in Sokoto state, Nigeria, with 72 cases, including 14 laboratory-confirmed cases and zero deaths. Males represent 53% of all cases and the age group between 31 to 40 years old is more affected (43%)..Nigeria"
OEW11-1117032024,11,11 - 17 Mar 2024,Ongoing,,"Between week 19 of 2022 and week 6 of 2024, a total of 27 078 suspected cases of diphtheria were reported from 36 states in Nigeria. Among these cases, 16 603 were confirmed, comprising 365 laboratory-confirmed, 483 epidemiologically linked, and 15 755 clinically compatible cases.","Between week 19 of 2022 and week 6 of 2024, a total of 27 078 suspected cases of diphtheria were reported from 36 states in Nigeria. Among these cases, 16 603 were confirmed, comprising 365 laboratory-confirmed, 483 epidemiologically linked, and 15 755 clinically compatible cases.","Between week 19 of 2022 and week 6 of 2024, a total of 27 078 suspected cases of diphtheria were reported from 36 states in Nigeria. Among these cases, 16 603 were confirmed, comprising 365 laboratory-confirmed, 483 epidemiologically linked, and 15 755 clinically compatible cases.",,,,,,,"Between week 19 of 2022 and week 6 of 2024, a total of 27 078 suspected cases of diphtheria were reported from 36 states in Nigeria. Among these cases, 16 603 were confirmed, comprising 365 laboratory-confirmed, 483 epidemiologically linked, and 15 755 clinically compatible cases.",
OEW11-1117032024,11,11 - 17 Mar 2024,Ongoing,NGA,Nigeria,Lassa Fever,Ungraded,2023-01-08,2024-01-01,2024-01-21,892.0,211.0,43.0,4.80%,"As of week 3 of 2024, 892 suspected cases, including 211 laboratory-confirmed cases, were reported, with 43 reported deaths among confirmed cases, resulting in a CFR of 20.4%. Confirmed cases, including four HCWs, were reported from 17 states and 54 LGAs, with the highest number of cases (91.5%) reported from Ondo (53 cases, five"
OEW11-1117032024,11,11 - 17 Mar 2024,Ongoing,NGA,Nigeria,Meningitis,Ungraded,2024-01-29,2023-10-08,2024-01-28,281.0,26.0,40.0,14.20%,"An increase in meningitis cases has been reported in Nigeria since October 2023. From W40, 2023 (ending 8 Oct 2023) to W4, 2024 (ending 28 Jan 2024), a total of 281 cases including 40 deaths (CFR 14%) were reported from 47 LGAs in 19 states. Cumulatively, twenty-six cases were laboratory confirmed, of which over 80% tested positive for Neisseria Meningitidis C. Children aged less than 15 years old are the most affected. The ICG request for meningococcal vaccines is under finalization."
OEW11-1117032024,11,11 - 17 Mar 2024,Ongoing,NGA,Nigeria,Mpox,Protracted 2,2022-01-31,2022-01-01,2023-12-31,3771.0,1086.0,17.0,0.50%,"Overall, since the re-emergence of Mpox in September 2017, 3771 suspected cases have been reported from 36 States and FCTs in the country. Of these 3771 suspected cases, 1086 (28.7%) were confirmed (with males predominantly affected) from 34 States and FCT. seventeen (17) deaths have been recorded since the re-emergence in 2017."
OEW11-1117032024,11,11 - 17 Mar 2024,Ongoing,NGA,Nigeria,Poliomyelitis (cVDPV2),Grade 2,2018-06-01,2022-01-01,2024-01-31,74.0,67.0,,-,No cVDPV2 case was reported this week. There have been 26 cVDPV2 cases reported this year and 48 cases in 2022.
OEW11-1117032024,11,11 - 17 Mar 2024,Ongoing,SEN,Senegal,Chikungunya,Ungraded,2023-06-08,2024-01-01,2024-03-17,6.0,6.0,,0.00%,"From 1 January to 17 March 2024, six confirmed cases of Chikungunya were reported from the regions of Dakar (1), Kolda (1), Matam (2), and Tambacounda (2) in Senegal. In 2023, the total number of confirmed cases was 344."
OEW11-1117032024,11,11 - 17 Mar 2024,Ongoing,SEN,Senegal,Dengue,Grade 3,2022-11-14,2023-01-31,2024-02-17,6.0,6.0,,0.00%,"Confirmed cases of dengue continue to be reported in Senegal in 2024. From 1 January to 17 March 17 2024, a total of 22 confirmed cases were reported in the regions of Dakar (14), Louga (4), Saint-Louis (2), Matam (1), and Thiès (1). Among these cases, 12 (55%) are in the 15-35 age group, followed by 8 (36%) in the 35-50 age group, and 2 in the 50+ age group. In 2023."
OEW11-1117032024,11,11 - 17 Mar 2024,Ongoing,SEN,Senegal,Measles,Ungraded,2022-07-04,2024-01-01,2024-03-17,150.0,150.0,,0.00%,"Depuis le déburt de l'année jusqu'au 17 mars 2024, 150 cas confirmés de rougeole ont été rapportés dans 11 régions du Sénégal. Les régions les plus touchées étant les régions de Louge (46), Matam (26), Kaffrine (23), Diourbel (16), Kaka (13), Saint-Louis (13)."
OEW11-1117032024,11,11 - 17 Mar 2024,Ongoing,SEN,Senegal,West Nile fever,Ungraded,2024-02-07,2024-01-23,2024-02-07,1.0,1.0,0.0,0.00%,"On 7 February 2024, the Ministry of Health of Senegal was informed by Institut Pasteur of Dakar of a confirmed West Nile virus case in Matam region. The case is a 23-year-old male residing in Thilogne commune, Matam department, who had onset of symptoms of fever, headache and myalgia on 23 January 2024. On 26 January 2024, he presented at a health facility where he tested negative for malaria. A symptomatic treatment was initiated. A blood sample was sent to Institut Pasteur of Dakar on 02 February 2024 for further testing. The sample tested IgM positive for West Nile virus on 07 February 2024. No additional case was reported. Further investigations are ongoing."
OEW11-1117032024,11,11 - 17 Mar 2024,Ongoing,SEN,Senegal,Zika,Ungraded,2023-12-11,2023-11-14,2024-03-24,2.0,2.0,,0.00%,"In week 49, Senegal health authorities reported the confirmation of two cases of Zika virus disease in the districts of Sédhiou and Sokone through Polymerase Chain Reaction (PCR) testing. Details regarding the age of the women in Sokone remain unspecified, and their pregnancy status has not been disclosed. There is a potential risk for adverse outcomes including microcephaly, other congenital malformations in infants, and possibilities of premature birth or miscarriage. Investigation reports are forthcoming. No new updates on cases and deaths since October 2023"
OEW11-1117032024,11,11 - 17 Mar 2024,Ongoing,ZAF,South Africa,Cholera,Grade 3,2024-01-20,,2024-03-24,,,47.0,3.40%,"The cholera outbreak has been ongoing in South Africa since December 4, 2023. It started with imported cases linked to ongoing outbreaks in Southern Africa and two locally cases from Limpopo in of February 2024, 1 395 cases and 47 deaths have been reported."
OEW11-1117032024,11,11 - 17 Mar 2024,Ongoing,ZAF,South Africa,Measles,Ungraded,2022-10-17,2022-10-13,2023-12-26,,1338.0,,0.00%,"From 8 October 2022 to 21 December 2023, a total of 1 338 laboratory-confirmed cases were reported from eight provinces. Limpopo had reported the most number of cases (533), followed by Gauteng (265), North West (226) and Western Cape (56)."
OEW11-1117032024,11,11 - 17 Mar 2024,Ongoing,SSD,South Sudan,Food insecurity (Horn of Africa crisis),Grade 3,2020-12-18,2021-04-05,2024-03-20,,,,-,"The latest data shows that 5.83 million people (46 %of the population) are experiencing high levels of acute food insecurity classified as IPC Phase 3 or above (Crisis or worse), with 1.64 million people in IPC Phase 4 (Emergency). An estimated 35,000 people are classified in IPC Phase 5 (Catastrophe) in the Duk (3 000) and Nyirol (3 000) counties of Jonglei State; and the Rubkona County (15,000) of Unity State. Between July 2023 and June 2024, an estimated 1.65 million children between 6-59 months are expected to suffer acute malnutrition including 480,000 million children expected to suffer Severe Acute Malnutrition (SAM) and 1.16 million expected to suffer Moderate Acute Malnutrition (MAM) , 870 000 pregnant or breastfeeding women are expected to suffer acute malnutrition in this period. South Sudan Humanitarian Protracted 3 15-Aug-16 15-Aug-16 20-Mar-24 - - - -"
OEW11-1117032024,11,11 - 17 Mar 2024,Ongoing,,"South Sudan continues to face a dire humanitarian crisis. Persistent insecurity and violence, regional and national economic instability compounded by global downturns, and the devastating effects of climate change continue to inflict severe hardships on millions of South Sudanese families, particularly in terms of their food and nutritional security.","South Sudan continues to face a dire humanitarian crisis. Persistent insecurity and violence, regional and national economic instability compounded by global downturns, and the devastating effects of climate change continue to inflict severe hardships on millions of South Sudanese families, particularly in terms of their food and nutritional security.","South Sudan continues to face a dire humanitarian crisis. Persistent insecurity and violence, regional and national economic instability compounded by global downturns, and the devastating effects of climate change continue to inflict severe hardships on millions of South Sudanese families, particularly in terms of their food and nutritional security.",,,,,,,"South Sudan continues to face a dire humanitarian crisis. Persistent insecurity and violence, regional and national economic instability compounded by global downturns, and the devastating effects of climate change continue to inflict severe hardships on millions of South Sudanese families, particularly in terms of their food and nutritional security.",
OEW11-1117032024,11,11 - 17 Mar 2024,Ongoing,SSD,South Sudan,Impact of Sudan crisis in South Sudan,Grade 3,2023-04-15,2023-05-01,2024-03-06,,,,,
OEW11-1117032024,11,11 - 17 Mar 2024,Ongoing,SSD,South Sudan,Hepatitis E,Ungraded,2018-01-03,2019-01-01,2023-12-19,4253.0,63.0,12.0,0.30%,"The current outbreak in Bentiu POC continues. As of 18 September 2023, a cumulative total of 63 cases with symptoms and signs consistent with HEV disease and 12 deaths (CFR 19%) were reported from Fangak. Most cases (36.5%) are from the village of Old Fangak. The median age group affected is 33 years (Interquartile range: 2 -59). Males are the most affected accounting for 58.7% of all reported cases."
OEW11-1117032024,11,11 - 17 Mar 2024,Ongoing,SSD,South Sudan,Measles,Ungraded,2022-02-23,2023-01-01,2023-12-24,7862.0,586.0,173.0,2.20%,"Measles outbreak is still active in South Sudan with new counties confirming outbreaks that include Magwi, Tonj East, Maridi, and Mundri East. As of week 50, 2023, 7 862 suspected measles cases were reported, with 586 (7.6%) lab-confirmed, 173 deaths with a case fatality ratio of 2.2%"
OEW11-1117032024,11,11 - 17 Mar 2024,Ongoing,SSD,South Sudan,Poliomyelitis (cVDPV2),,2024-02-26,2024-01-01,2024-03-13,2.0,2.0,0.0,0.00%,"No cVDPV2 case was reported this week. The number of cases for 2023 remains two from Yambio , in Western Equatoria and Juba in Central Equatoria."
OEW11-1117032024,11,11 - 17 Mar 2024,Ongoing,SSD,South Sudan,Yellow fever,Ungraded,2023-12-24,2023-12-24,2024-03-03,81.0,3.0,6.0,7.40%,"Yellow fever outbreak is still ongoing in South Sudan since it was officially declared by the health authorities on 6 January 2024. As of 5 March 2024, a total of 81 cases including 78 suspected and three confirmed cases have been reported. About six suspected deaths have been also reported. All cases were reported from six counties in Western Equatoria state: Yambio (45), Tambura (15), Nzara (10), Ezo (06), Ibba (04), and Maridi Counties (01) as of 3 March 2024"
OEW11-1117032024,11,11 - 17 Mar 2024,Ongoing,TZA,"Tanzania, United Republic of",Cholera,Grade 3,2023-10-03,2023-09-07,2023-12-12,,,46.0,1.80%,"As of 15 March 2024, since 5th September 2023 cholera outbreaks have been , seported in 18 regions (Mara, Arusha, Kilimanjaro, Kigoma, Kagera, Singida, Simiyu, Shinyanga, Tabora, Ruvuma, Mwanza, Geita, Rukwa, Dodoma, Manyara, Morogoro, Katavi and Dar es Salaam) in Tanzania Mainland, where a total of 2,549 cases and 46 deaths (CFR 1.8%) reported. Out of 18 regions, a Cholera outbreak was declared over in 6 regions (Geita, Mara, Arusha, Kilimanjaro, Ruvuma and Tabora)."
OEW11-1117032024,11,11 - 17 Mar 2024,Ongoing,TZA,"Tanzania, United Republic of",Poliomyelitis (cVDPV2),Grade 2,2023-07-19,2023-07-17,2024-03-13,2.0,2.0,,0.00%,"According to the Global Polio Eradication Initiative (GPEI), no cVDPV2 cases were reported this week. The total number of cases for 2023 remains two. The number was reviewed from three to two following verification"
OEW11-1117032024,11,11 - 17 Mar 2024,Ongoing,TGO,Togo,Poliomyelitis (cVDPV2),Grade 2,2019-10-18,2019-09-13,2023-10-26,19.0,19.0,,0.00%,"No cVDPV2 case was reported this week. There were two cases reported in 2022. No cases were reported in 2021. There were nine cases in 2020, while the total number of cVDPV2 cases reported in 2019 remains at eight."
OEW11-1117032024,11,11 - 17 Mar 2024,Ongoing,UGA,Uganda,Food insecurity (Horn of Africa crisis),Grade 3,2022-02-17,2022-01-01,2024-03-20,,,,-,"Uganda hosts slightly over 1.4 million refugees in 13 districts. The population analyzed includes 12 refugee host districts in which 6 are classified in IPC Phase 3 or above: Adjumani, Kiryandongo, Kyegegwa, Lamwo, Obongi and Yumbe. The food security situation is projected to gradually deteriorate during the projection period of February to June 2024, with the population in IPC Phase 3 or above increasing from 846 000 people (20 %of the analyzed population) to 963 000 people (23 %of the analyzed population)."
OEW11-1117032024,11,11 - 17 Mar 2024,Ongoing,UGA,Uganda,Anthrax,Grade 2,2023-11-27,2023-11-19,2024-01-07,88.0,22.0,11.0,12.50%,"Human anthrax outbreak which started in 2023 is still ongoing in Uganda. The following districts have been affected: Kyotera, Kween, Ibanda, Lwengo and Kazo . The later confirmed the outbreak on 5 January 2024. So far, since the start of the outbreak on 3 August 2023 through 5 January 2024, 88 cases have been reported including 22 confirmed and 11 deaths (CFR. 12.5%)"
OEW11-1117032024,11,11 - 17 Mar 2024,Ongoing,UGA,Uganda,Cholera,Grade 3,2024-02-04,2024-02-04,2024-03-03,32.0,5.0,1.0,3.10%,"On 4 February 2024, a new cholera outbreak was detected in Mbale city , as of 3 March 2024 , 32 cases including five confirmed and one death are reported (CFR 3.1%)."
OEW11-1117032024,11,11 - 17 Mar 2024,Ongoing,UGA,Uganda,Crimean- Congo hemorrhagic fever,Ungraded,2024-02-12,2024-01-28,2024-03-03,9.0,6.0,4.0,44.40%,"From week 1 through week 9, 2024 (ending 3 March), Crimean-Congo hemorrhagic fever (CCHF) outbreak has been reported from the following districts of Uganda: Kiruhura (one confirmed case and zero death), Lyantonde (five cases, three confirmed and three deaths), Kyankwanzi (one confirmed case and zero death), Mbarara City ( one confirmed case and zero death ), Kampala city ( one confirmed case and one death) . The number of cases previously reported was reviewed. As of week 9, 2024, the outbreak is still active in Kiruhura, Lyantonde and Kyankwanzi districts. The cumulative numbers are: nine cases, six confirmed and four deaths (CFR 44.4%)."
OEW11-1117032024,11,11 - 17 Mar 2024,Ongoing,UGA,Uganda,Measles,Ungraded,2023-10-04,2023-12-23,2024-02-25,332.0,146.0,6.0,1.80%,"Measle outbreak reported from Kiryandongo and Kyegegwa was controlled end of last year. However, new measles outbreaks have been reported since 23 December 2023, from eight districts: Arua city , Yumbe, Koboko , Obongi, Hoima, Amuru, Kasese and Kyenjonjo. A total of 332 cases including 146 confirmed and six deaths are reported as of 25 February 2024."
OEW11-1117032024,11,11 - 17 Mar 2024,Ongoing,UGA,Uganda,Rift Valley fever (RVF),Ungraded,2023-09-25,2023-01-01,2024-03-03,184.0,56.0,14.0,7.60%,"Since week 1 through week 44 (ending 19 November 2023), about 182 rift valley fever (RFV) cases have been reported including 54 confirmed cases and 13 deaths from Kabale, Rubanda, Mbarara, Isingiro, Bushenyi, Nakaseke, Kazo, Lira and Kakumiro districts. In 2024, only five cases have been reported. As of 3 March 2024, only Mbarara district is experiencing an active RVF outbreak with one case and zero death reported so far."
OEW11-1117032024,11,11 - 17 Mar 2024,Ongoing,,"On 29 February 2024, the Zambia President declared the drought the country is currently facing a national disaster and emergency as it had devastated food production and power generation and the country struggles to recover a recent cholera outbreak. The lack of rain has devastated the agricultural sector, affecting more than one million families. The dry spell has from mid-January this year affected most of the central and southern half of the country, which has received less than normal rainfall leaving one million hectares of maize destroyed, almost half of the country's maize cultivation. It is also projected that the drought will lead to a power deficit and affect ground and surface water levels, with severe consequences for sectors beyond agriculture since more than 80 %of Zambia electricity generation comes from hydropower.","On 29 February 2024, the Zambia President declared the drought the country is currently facing a national disaster and emergency as it had devastated food production and power generation and the country struggles to recover a recent cholera outbreak. The lack of rain has devastated the agricultural sector, affecting more than one million families. The dry spell has from mid-January this year affected most of the central and southern half of the country, which has received less than normal rainfall leaving one million hectares of maize destroyed, almost half of the country's maize cultivation. It is also projected that the drought will lead to a power deficit and affect ground and surface water levels, with severe consequences for sectors beyond agriculture since more than 80 %of Zambia electricity generation comes from hydropower.","On 29 February 2024, the Zambia President declared the drought the country is currently facing a national disaster and emergency as it had devastated food production and power generation and the country struggles to recover a recent cholera outbreak. The lack of rain has devastated the agricultural sector, affecting more than one million families. The dry spell has from mid-January this year affected most of the central and southern half of the country, which has received less than normal rainfall leaving one million hectares of maize destroyed, almost half of the country's maize cultivation. It is also projected that the drought will lead to a power deficit and affect ground and surface water levels, with severe consequences for sectors beyond agriculture since more than 80 %of Zambia electricity generation comes from hydropower.",,,,,,,"On 29 February 2024, the Zambia President declared the drought the country is currently facing a national disaster and emergency as it had devastated food production and power generation and the country struggles to recover a recent cholera outbreak. The lack of rain has devastated the agricultural sector, affecting more than one million families. The dry spell has from mid-January this year affected most of the central and southern half of the country, which has received less than normal rainfall leaving one million hectares of maize destroyed, almost half of the country's maize cultivation. It is also projected that the drought will lead to a power deficit and affect ground and surface water levels, with severe consequences for sectors beyond agriculture since more than 80 %of Zambia electricity generation comes from hydropower.",
OEW11-1117032024,11,11 - 17 Mar 2024,Ongoing,ZMB,Zambia,Drought/food Anthrax,Ungraded Grade 2,,,,,40.0,4.0,0.40%,
OEW11-1117032024,11,11 - 17 Mar 2024,Ongoing,ZMB,Zambia,Cholera,Grade 3,2023-01-24,2023-01-20,2024-03-03,20768.0,20768.0,702.0,3.40%,"The current cholera outbreak started with Lusaka Province confirming cases in the cholera-prone areas (peri-urban). From October 2023 to 3 March 2024, nine provinces have reported cases of cholera with seven provinces confirming cholera outbreaks. A total of 40 districts have confirmed local transmission. Cumulative cases stand at 20 768 with 702 deaths (CFR 3.4%)."
OEW11-1117032024,11,11 - 17 Mar 2024,Ongoing,ZMB,Zambia,Measles,Ungraded,2022-06-13,2022-06-13,2024-02-27,1594.0,57.0,,0.00%,"In week 8, 2024, Zambia recorded a total of 54 suspected measles cases, with laboratory testing confirming 5 cases distributed across 5 districts. This adds to the cumulative count of suspected cases, at 1 594, and lab-confirmed measles cases, totaling 57 since the first week of 2024."
OEW11-1117032024,11,11 - 17 Mar 2024,Ongoing,ZWE,Zimbabwe,Anthrax,Grade 2,2023-11-13,2023-11-14,2024-02-12,683.0,,1.0,0.10%,"As of 12 February 2023, there have been a total of 683 cases reported in Zimbabawe. Eight districts have reported cases since beginning of 2023 with the majority of cases coming from Gokwe North (63.1%) and Gokwe South (33.1%). The confirmed death was reported in 2023, from Gokwe South."
OEW11-1117032024,11,11 - 17 Mar 2024,Ongoing,ZWE,Zimbabwe,Cholera,Grade 3,2023-02-12,2023-02-12,2024-03-17,28974.0,2786.0,603.0,2.10%,"The first cholera outbreak in the country in 2023 started on the 12 February 2023. Cumulatively there were 28 974 cholera cases with 603 deaths (CFR 2.0%) as of 17 March 2024. All of the ten provinces are affected with majority of the cases reported from Manicaland, Harare, Mash West and Mash Cent provinces."
OEW11-1117032024,11,11 - 17 Mar 2024,Ongoing,ZWE,Zimbabwe,Poliomyelitis (cVDPV2),Grade 2,2024-02-21,2024-02-22,2024-02-27,1.0,1.0,0.0,0.00%,"Zimbabwe is currently responding to an outbreak of a circulating Vaccine Derived Poliovirus type 2 (cVDPV2). The cVDPV2 outbreak was first detected through Environmental Surveillance (ES) in October 2023 in Harare City. So far there is human cases of vaccine deprived polio type 2 (cVDPV2) . This cVDPV2 case was detected in Sanyati district through Acute Flaccid Paralysis (AFP) surveillance. Two cVDPV2 isolates were detected from healthy children whose samples were collected as part of the initial detailed outbreak investigation. The country is now responding through strengthened routine immunization, enhanced surveillance and nOPV2 vaccination campaigns. First round of the nOPV2 campaign was conducted from 20 to 23 February 2024."
OEW11-1117032024,11,11 - 17 Mar 2024,Closed,TGO,Togo,Cholera,Grade 3,2023-12-15,2023-12-15,2024-01-31,1.0,1.0,,0.00%,"On 14 December,the Togolese Ministry of Health and Public Hygiene has announced the confirmation of a cholera case in the Gulf health district of Greater Lomé. The patient is a 45-year-old woman from Anfamé. In response, the Ministry is actively conducting community investigations to identify any additional cases or fatalities."
OEW11-1117032024,11,11 - 17 Mar 2024,Closed,UGA,Uganda,Malaria,Ungraded,2023-06-05,2023-07-02,2024-03-03,,,,-,"During week 7, 2024 (ending 18 February), there was zero district responding to malaria outbreak. Furthermore, cases of confirmed Black Water Fever have been reported from Bukomansimbi district with a total of 72 cases and 10 deaths recorded since 30 September 2023. As of week 9, 2024 (ending 3 March), no district in outbreak of malaria for two consecutive weeks and the event was closed."
