NAME,WEEK,DATE,EVENT_TYPE,ISO3,COUNTRY,EVENT_NAME,GRADE,DATE_NOTIFY,DATE_START,DATE_END,CASES_TOTAL,CASES_CONFIRMED,DEATHS,CFR,DESCRIPTION
OEW21-1521052023,21,15 - 21 May 2023,Ongoing,ETH,Ethiopia,Drought/food insecurity,Grade 3,2022-02-17,2022-01-01,2023-04-23,,,,-,"The conditions of drought and insecurity-affected regions in Ethiopia is ongoing. The regions of Oromia, Somali, and parts of SNNPR, and SWEPR are facing an extremely dire situation with high need for humanitarian response. There has been a dramatic increase in food insecurity, malnutrition, displacements, as well as deteriorating health and protection conditions with lack of access to clean water. A total of 2 million people (out of targeted 13 million) are prioritized for assistance through a four-month Drought Response Operational Action Plan. The drought situation remains severe in the southern parts of SNNPR and lowland woredas of Dawuro and West Omo zones. Zabagezo woreda in Dawuro are reportedly the most affected, with more than 45K people in need of food assistance and requiring more partner presence and technical support for all sectors including health, nutrition, water, health, and hygiene."
OEW21-1521052023,21,15 - 21 May 2023,Ongoing,ETH,Ethiopia,Humanitarian crisis (Conflict in Tigray),Grade 3,2020-11-04,2020-11-04,2023-05-10,,,,-,"In Ethiopia, some 2.7 million people have been displaced and another 887K refugees are located in the country as of 28 Feb 2023. Humanitarian partners have assisted more than 3.7 million people as of 4 January 2023, representing 68.5% of the total planned caseload of 5.4 million people in Tigray under the current round (Round 2) of food distribution. Hundreds of thousands of people continue to be uprooted from their homestead, with a consequential increase in humanitarian needs. Approximately, 18K individuals have crossed into Ethiopia fleeing conflict in neightboring Sudan between 15-10 May 2023."
OEW21-1521052023,21,15 - 21 May 2023,Ongoing,ETH,Ethiopia,Cholera,Grade 3,2022-09-17,2022-09-17,2023-05-13,,39.0,104.0,1.60%,"A cholera outbreak has been ongoing in Ethiopia since 27 August 2022. The index case was reported from Bekay Kebele, Oromia Region and the outbreak was confirmed on 9 September. As of 13 May 2023, a total of 6 592 suspected cases of cholera with 104 deaths (CFR 1.6%) have been reported. There were 128 cases and frou new deaths repored in week 19, 2023. At least 62 woredas have reported cholera cases since the beginning of the outbreak, however, during week 18, 53 woredas have active cholera outbreaks."
OEW21-1521052023,21,15 - 21 May 2023,Ongoing,ETH,Ethiopia,COVID-19,Grade 3,2020-03-13,2020-03-13,2023-04-26,,,,1.50%,"Since the confirmation of the first case on 21 March 2020, Ethiopia has confirmed a total of 500 816 cases of COVID-19 as of 26 April 2023, with 7 574 deaths and 487 838 recoveries."
OEW21-1521052023,21,15 - 21 May 2023,Ongoing,ETH,Ethiopia,Measles,Ungraded,2017-04-13,2023-01-01,2023-04-28,,,3.0,0.10%,"A total of 5 052 suspected measles cases reported as of week 17 current year (ending 28 April). Confirmed cases are 2 972 including 517 (17%) laboratory confirmed, 2 439 (82%) epidemiologically linked cases and 16 (1%) clinically compatible. Total of 45 confirmed active outbreaks affecting eight regions as of week 17, 2023"
OEW21-1521052023,21,15 - 21 May 2023,Ongoing,ETH,Ethiopia,Poliomyelitis (cVDPV2),Grade 2,2019-06-24,2019-05-20,2023-05-17,64.0,64.0,0.0,0.00%,No case of circulating vaccine-derived poliovirus type 2 (cVDPV2) was reported this week 19 of 2023 (ending 14 May 2023). There was one case reported in 2022. In
OEW21-1521052023,21,15 - 21 May 2023,Ongoing,ETH,Ethiopia,Visceral leishmaniasis,Ungraded,2023-01-01,2023-01-01,2023-04-30,180.0,,21.0,11.70%,
OEW21-1521052023,21,15 - 21 May 2023,Ongoing,,"addition, ten cases were reported in 2021, 38 in 2020 and 15 in 2019.","addition, ten cases were reported in 2021, 38 in 2020 and 15 in 2019.","addition, ten cases were reported in 2021, 38 in 2020 and 15 in 2019.",,,,,,,"addition, ten cases were reported in 2021, 38 in 2020 and 15 in 2019.","From 1 January 2023 to 30 April 2023, a total of 180 cases of visceral leishmaniasis and 21 deaths (CFR 11.7%) were reported. WHO is supporting capacity building, active case finding and scaling up of rapid serological testing in health facilities. In addition, Médecins Sans Frontières (MSF) is supporting case management."
OEW21-1521052023,21,15 - 21 May 2023,Ongoing,GAB,Gabon,COVID-19,Grade 3,2020-03-12,2020-03-12,2023-04-30,,,307.0,0.60%,"On 12 March 2020, the Ministry of Health announced the confirmation of the first COVID-19 case in the country. As of 30 April 2023, a total of 48 982 cases including 307 deaths and 48 676 recoveries have been reported in the country."
OEW21-1521052023,21,15 - 21 May 2023,Ongoing,GMB,Gambia,COVID-19,Grade 3,2020-03-17,2020-03-17,2022-11-04,,,372.0,3.00%,"The first COVID-19 confirmed case was reported in The Gambia on 17 March 2020. As of 4 November 2022, a total of 12 586 confirmed COVID-19 cases including 372 deaths, and 12 189 recoveries have been reported in the country."
OEW21-1521052023,21,15 - 21 May 2023,Ongoing,GHA,Ghana,COVID-19,Grade 3,2020-03-12,2020-03-12,2023-04-24,,,,0.90%,"As of 24 April 2023, a total of 171 657 confirmed COVID-19 cases have been reported in Ghana. There have been 1 462 deaths and 170 188 recoveries reported."
OEW21-1521052023,21,15 - 21 May 2023,Ongoing,GHA,Ghana,Measles,Ungraded,2023-01-01,2022-01-01,2023-02-17,502.0,123.0,0.0,0.00%,"There is an ongoing outbreak of measles in the Northern region of Ghana. From epidemiological week 1 to week 5 (ending 17 February 2023), a total of 209 suspected cases, including three confirmed, were reported in eleven districts. The attack rate per one million population is 209 (suspected cases). Cumulatively, a total of 502 suspected cases,"
OEW21-1521052023,21,15 - 21 May 2023,Ongoing,GHA,Ghana,Mpox,Grade 3,2022-06-08,2022-05-24,2023-03-29,124.0,124.0,4.0,3.20%,"On 8 June 2022, the Director General of the Ghana Health Service confirmed that five cases of monkeypox have been detected in the country. From 24 May-23 February 2023, there have been 123 confirmed and four deaths reported from 13 over 16 administrative regions, with the Greater Accra region reporting the most cases."
OEW21-1521052023,21,15 - 21 May 2023,Ongoing,GHA,Ghana,Poliomyelitis (cVDPV2),Grade 2,2019-08-23,2019-07-23,2023-05-17,34.0,34.0,,-,"According to Global Polio Eradication Initiative, no case of circulating vaccine-derived poliovirus type 2 (cVDPV2) was reported this week. There are three cases in 2022. No cases were reported in 2021. In addition, 12 cases were reported in 2020, and 19 were reported in 2019."
OEW21-1521052023,21,15 - 21 May 2023,Ongoing,GIN,Guinea,COVID-19,Grade 3,2020-03-13,2020-03-13,2023-02-19,,,467.0,1.20%,"The Ministry of Health in Guinea announced the first confirmed case of COVID-19 on 13 March 2020. As of 19 February 2023, a total of 38 302 cases, including 37 320 recovered cases and 467 deaths, have been reported in the country."
OEW21-1521052023,21,15 - 21 May 2023,Ongoing,GIN,Guinea,Lassa Fever,Ungraded,2023-03-21,2023-03-21,2023-03-25,1.0,1.0,1.0,100.00%,"On 21 March 2023, the Ministry of Health of Guinea notified WHO of a confirmed fatal case of Lassa fever in a three-year-old male child from the Kobela health area, Nzerekore health district. The date of onset of symptoms was 13 March 2023, with fever, asthenia, anorexia, and dry cough. On 20 March 2023, the child was taken to the regional hospital for medical attention due to the persistence of the disease. On 21 March 2023 the child presented with bleeding from the mouth and blackish blood from the anus. Laboratory tests on the blood sample taken the same day were positive for Lassa fever varus. The child died in the community, in a remote village, after escaping from the hospital. A safe and dignified burial was not performed. Public health measures are being taken."
OEW21-1521052023,21,15 - 21 May 2023,Ongoing,GIN,Guinea,Measles,Ungraded,2018-05-09,2022-01-01,2022-12-31,,432.0,33.0,0.10%,"Since the beginning of 2022 up to week 52 (ending 31 December), a total of 23 259 suspected measles cases with 432 confirmed and 33 death (CFR 0.1%) have been reported in Guinea through the Integrated disease surveillance and response."
OEW21-1521052023,21,15 - 21 May 2023,Ongoing,GIN,Guinea,Skin injury from unknown chemical exposure,Ungraded,2023-04-19,2023-04-12,2023-04-21,250.0,250.0,0.0,0.00%,"On 7 April 2023, about 270 kilometers off the west coast of Conakry, several fishermen, including Guineans, Sierra Leoneans, Liberians and Ghanaians, were exposed to an unknown chemical. According to the fishermen, a boat was seen dumping a product into the open sea. The product emitted a fizzy, pungent cloud and left a yellowish substance on the surface of the water. As of 21 April, 250 cases of burns, including 0 deaths, have been reported among fishermen only. The cases were reported in the Conakry (240 cases, 96%) and Kindia (10 cases, 4%) regions. On 21 April alone, 26 new cases were reported. Only six cases were severe enough to require hospitalization. Investigations are ongoing to identify the chemical product involved."
OEW21-1521052023,21,15 - 21 May 2023,Ongoing,GNB,Guinea-Bissau,COVID-19,Grade 3,2020-03-25,2020-03-25,2023-04-09,,,177.0,1.80%,"On 25 March 2020, the Ministry of Health of Guinea Bissau reported the first COVID-19 confirmed case in the country. As of 9 April 2023, the country has reported 9 614 confirmed cases of COVID-19 with 9 315 recoveries and 177 deaths."
OEW21-1521052023,21,15 - 21 May 2023,Ongoing,KEN,Kenya,Drought/food insecurity,Grade 3,2022-02-17,2022-01-01,2023-05-11,,,,-,"The drought situation thus remains critical in twenty-two (21) of the 23 arid and semi - arid (ASAL) counties,during the month of March 2023. Two (2) counties namely Marsabit and Turkana remain in Emergency drought phase. Eight (8) counties namely Isiolo, Mandera, Kajiado, Samburu, Tana River, Wajir, Kilifi and Kitui are in Alarm drought phase. Eleven (11) counties including; Baringo, Embu, Garissa, Lamu, Makueni, Laikipia, Narok, Nyeri, Meru, Kwale and Taita Taveta are in the Alert drought phase. While two (2) counties; West Pokot and Tharaka Nithi are in Normal drought phase. Drought is affecting about 4.5 million people, compared to 2.1 million in September 2021. Of these, approximately 2.14 million are children. The projection for Mar-Jun 2023 is expected increase affecting 5.4 million people in the country who will be in Integrated Food Security Phase Classification (IPC) Phase 3 and above. Of those 5.4 million people, 1.2 million people will likely be in Phase 4 and above."
OEW21-1521052023,21,15 - 21 May 2023,Ongoing,KEN,Kenya,Acute watery diarrhoea,Ungraded,2023-04-03,2023-03-17,2023-04-14,84.0,84.0,10.0,11.90%,"A total of 84 cases of acute watery diarrhoea have been reported from Mombasa county. All six sub-counties have reported cases, however the most affected have been Kisauni with 33 cases (39.3%) and Nyali with 17 cases ( 20.2%) reported . A surge of diarrhoeal cases was officially notified on 3 April 2023. Approximately, 47 (56%) of cases are males while 35 (41.7%) are females with the age group of 0-3 years accounting for 31% of cases. Cumulatively, 21 samples have been collected with nine samples returning positive for rotavirus, Vibrio cholerae has been ruled out."
OEW21-1521052023,21,15 - 21 May 2023,Ongoing,KEN,Kenya,Anthrax,Ungraded,,2023-04-10,2023-05-11,15.0,15.0,3.0,20.00%,"The outbreak has been reported from Muranga County. A total of 15 cases and three deaths have been reported from five sub counties; Gatanga (1), Kandara (5, including 2 deaths), Kigumo (7, including 1 death, Maragwa (1) and Mathioya (1)."
OEW21-1521052023,21,15 - 21 May 2023,Ongoing,KEN,Kenya,Cholera,Grade 3,2022-10-19,2022-10-05,2023-05-07,,464.0,164.0,1.60%,"On 2 April 2020, the president of Malawi announced the first confirmed cases of COVID-19 in the country. As of 1 May 2023, the country has a total of 88 728 confirmed cases with 2 686 deaths."
OEW21-1521052023,21,15 - 21 May 2023,Ongoing,MWI,Malawi,Poliomyelitis (WPV1),Grade 2,2022-01-31,2022-02-01,2023-05-17,1.0,1.0,0.0,0.00%,"One positive case of wild WPV1 was detected in Lilongwe from a child with the date of onset of paralysis on 19 November 2021. No other cases have been reported. Malawi continues to participate in the multi-country, subregional outbreak response, to urgently stop the WPV1 outbreak affecting the area."
OEW21-1521052023,21,15 - 21 May 2023,Ongoing,MLI,Mali,Humanitarian crisis (Sahel region),Grade 2,,2017-09-11,2023-03-16,,,,-,"The humanitarian situation in Mali remains of concern in 2023, still in the northern and central regions. The humanitarian crisis is taking place amidst COVID-19 and measles outbreak, with the risk of other emerging and re-emerging diseases. The situation in the centre and north of the country is likely related to the increase in direct and indirect attacks against national and international forces and civilians. The number of internally displaced persons (IDPs) reached 412 387 at the end of December 2022, according to the Displacement Tracking Matrix."
OEW21-1521052023,21,15 - 21 May 2023,Ongoing,MLI,Mali,COVID-19,Grade 3,2020-03-25,2020-03-25,2023-05-14,,,743.0,2.20%,"On 25 March 2020, the Ministry of Health of Mali reported the first COVID-19 confirmed cases in the country. As of 14 May 2023, a total of 33 147 confirmed COVID-19 cases have been reported in the country including 743 deaths and 32 325 recoveries."
OEW21-1521052023,21,15 - 21 May 2023,Ongoing,MLI,Mali,Measles,Ungraded,2018-02-20,2023-01-01,2023-03-26,94.0,94.0,0.0,0.00%,"From the beginning of the year through 26 March 2023, 263 suspected measles cases were tested in Mali and 94 were laboratory confirmed. Confirmed measles cases were reported in 13 of the country's 75 health districts (17.3%)."
OEW21-1521052023,21,15 - 21 May 2023,Ongoing,MRT,Mauritania,COVID-19,Grade 3,2020-03-13,2020-03-13,2023-05-14,,,997.0,1.70%,"The government of Mauritania announced its first confirmed COVID-19 case on 13 March 2020. As of 14 May 2023, a total of 63 669 cases including 997 deaths and 62 653 recovered have been reported in the country."
OEW21-1521052023,21,15 - 21 May 2023,Ongoing,MRT,Mauritania,Measles,Ungraded,2023-03-07,2022-12-26,2023-05-07,285.0,186.0,3.0,1.10%,"Since the beginning of 2023, cases of measles have been reported in the three wilayas of Nouakchott and eight other wilayas in the interior of the country. As of 7 May 2023, the country has reported 285 suspected measles cases of which 192 cases were collected and tested with 111 positive IgM+ cases. Active contact tracing resulted in 75 epidemiologically confirmed cases. Three deaths including two community deaths have been recorded to date."
OEW21-1521052023,21,15 - 21 May 2023,Ongoing,MUS,Mauritius,COVID-19,Grade 3,2020-03-18,2020-03-18,2023-05-07,,,,0.40%,"The Republic of Mauritius announced the first three positive cases of COVID-19 on 18 March 2020. As of 7 May 2023, a total of 304 233 confirmed COVID-19 cases including 1 050 deaths have been reported in the country."
OEW21-1521052023,21,15 - 21 May 2023,Ongoing,MOZ,Mozambique,Floods,Grade 2,2023-02-13,2023-02-11,2023-04-01,,,186.0,,"Between 31 Jan and 12 Mar 2023, heavy rainfall has occurred in 10/11 Provinces of Mozambique, including rains from the the Freddy cyclone system which has made landfall twice. As of 31 March, 1 255 786 people have been affected by Freddy's double landfall in Mozambique, in eight provinces including Zambezia, Sofala, Inhambane, Tete, Maputo City, Niassa, Gaza, and Manica. A total of 186 deaths have been reported, including 157 deaths in Zambezia which is by far the most affected province after"
OEW21-1521052023,21,15 - 21 May 2023,Ongoing,MOZ,Mozambique,Humanitarian crisis in Cabo Delgado,Protracted 2,2020-01-01,2020-01-01,2023-04-15,,,,-,"Acoording to Relief web, the United Nations World Food Programme (WFP) has welcomed a US$ 1.5 million contribution from the Government of Japan to provide emergency food and nutrition assistance to more than 52,000 people affected by the conflict in northern Mozambique. The contribution will help provide emergency in-kind food assistance to more than 25,800 displaced people. The funds will also help WFP to provide nutrition support to some 15,000 children under the age of five and 12,000 pregnant and nursing women."
OEW21-1521052023,21,15 - 21 May 2023,Ongoing,,Cholera Grade 16-Nov-22 15-May-23 425 425 131 0.40%,Cholera Grade 16-Nov-22 15-May-23 425 425 131 0.40%,Cholera Grade 16-Nov-22 15-May-23 425 425 131 0.40%,,,,,,,Cholera Grade 16-Nov-22 15-May-23 425 425 131 0.40%,
OEW21-1521052023,21,15 - 21 May 2023,Ongoing,MOZ,Mozambique,,Grade 3,2020-03-22,,2023-04-24,233.0,233.0,2.0,1.00%,"(CFR 0.4%) have been reported from 10 provinces and 60 districts. COVID-19 22-Mar-20 417 417 243 The first COVID-19 confirmed case was reported in Mozambique on 22 March 2020. As of 24 April 2023, a total of 233 417 confirmed COVID-19 cases were reported in the"
OEW21-1521052023,21,15 - 21 May 2023,Ongoing,,country Mozambique,Mpox,Grade 3,2022-10-06,2022-10-07,2023-05-05,1.0,1.0,0.0,,
OEW21-1521052023,21,15 - 21 May 2023,Ongoing,,including 2 243 deaths.,including 2 243 deaths.,including 2 243 deaths.,,,,,,,including 2 243 deaths.,"diagnosed Wednesday, 12 October 2022 in Maputo City man, Health minister Armindo Tiago said. As of 5 May 2023, no additonal case has been reported."
OEW21-1521052023,21,15 - 21 May 2023,Ongoing,MOZ,Mozambique,Poliomyelitis (cVDPV2),Grade 2,2018-12-07,2021-01-01,2023-05-17,6.0,6.0,0.0,0.00%,"According to the Global Polio Eradication Initiative, no case of circulating vaccine-derived poliovirus type 2 (cVDPV2) was reported this week. The number of cases in 2022 remains four. There were two cases reported in 2021."
OEW21-1521052023,21,15 - 21 May 2023,Ongoing,MOZ,Mozambique,Poliomyelitis (WPV1),Grade 2,2022-05-17,2022-05-18,2023-05-17,8.0,8.0,0.0,0.00%,"According to the Global Polio Eradication Initiative,there was no WPV1 case reported this week. There were eight cases reported in 2022."
OEW21-1521052023,21,15 - 21 May 2023,Ongoing,NAM,Namibia,COVID-19,Grade 3,2020-03-14,2020-03-14,2023-04-30,171.0,,4.0,2.40%,
OEW21-1521052023,21,15 - 21 May 2023,Ongoing,NER,Niger,Humanitarian crisis (Sahel region),Grade 2,2015-02-01,2015-02-01,2022-12-16,,,,-,"Humanitarian access in Niger has deteriorated because of growing insecurity in Diffa, Maradi, Tahoua, and Tillabéri regions. Niger hosts 580 838 people whose situation is of concern, of which 48% are internally displaced persons (IDPs), 43% refugees, 6% returnees, 2% asylum seekers and other people whose situation is worrying (mainly Burkinabés)."
OEW21-1521052023,21,15 - 21 May 2023,Ongoing,NER,Niger,COVID-19,Grade 3,2020-03-19,2020-03-19,2023-05-01,,,315.0,3.30%,"From 19 March 2020 to 1 May 2023, a total of 9 513 cases with 315 deaths have been reported across the country. A total of 9 203 recoveries have been reported from the country."
OEW21-1521052023,21,15 - 21 May 2023,Ongoing,NER,Niger,Measles,Ungraded,2022-04-05,2022-01-01,2023-03-18,423.0,50.0,0.0,0.00%,"From week 1 to week 11 (ending on 18 March 2023 ), 423 cases of measles including 50 confirmed cases have been reported in 30 districts from 8 regions. 8 %(6/72) of"
OEW21-1521052023,21,15 - 21 May 2023,Ongoing,NER,Niger,Meningitis,Ungraded,2022-12-07,2022-10-31,2023-03-26,911.0,105.0,30.0,3.30%,"A meningitis outbreak has been declared in the Dungass health district in the Zinder region. The first case was reported on 31 October 2022 and confirmed on 23 November 2022 with Neisseria meningitidis identified as the causative agent. As of 26 February 2023, 911 suspected cases of meningitis including 105 laboratory confirmed cases and 30 deaths (CFR 3.3%) were reported."
OEW21-1521052023,21,15 - 21 May 2023,Ongoing,NER,Niger,Poliomyelitis (cVDPV2),Grade 2,2020-01-01,2021-01-01,2023-05-03,31.0,33.0,0.0,0.00%,No cVDPV2 case was reported this week. There were 15 cases reported last year in 2022. There were 18 cases reported in 2021.
OEW21-1521052023,21,15 - 21 May 2023,Ongoing,NER,Niger,Rift Valley fever,Ungraded,2023-02-23,2023-02-02,2023-02-23,1.0,1.0,1.0,100.00%,
OEW21-1521052023,21,15 - 21 May 2023,Ongoing,,Natsira in Nigeria,Zinder region. Humanitarian crisis (Sahel,Grade 2,2016-10-10,2016-10-10,2023-01-13,,,,-,
OEW21-1521052023,21,15 - 21 May 2023,Ongoing,,region),region),region),,,,,,,region),"The conflict in northeastern, northwestern, and north Nigeria affects 9.3 million people, including 5.7 million children. Of these, more than 2.9 million people are internally displaced, while one million live in inaccessible areas. Humanitarian crises caused by protracted armed conflict, armed violence, and community clashes between farmers and herders have resulted in alarming food insecurity and malnutrition, compounded by epidemics and childhood illnesses in the context of deteriorating water,"
OEW21-1521052023,21,15 - 21 May 2023,Ongoing,,"From 1 states,","Cholera Bauchi,",Grade 3,,,,,,79.0,5.90%,"January to 2 April 2023, a cumulative 1 336 suspected cholera and 79 (CFR: 5.9%) have been reported from 43 Local Governmental Areas (LGAs) in 12 namely Abia, Bayelsa, Cross River, Ebonyi, Kano, Katsina, Niger, Ondo, Osun, Sokoto and Zamfara. Males represent 53% of all cholera suspected cases."
OEW21-1521052023,21,15 - 21 May 2023,Ongoing,NGA,Nigeria,COVID-19 reported.,Grade,2020-02-27,2020-02-27,2023-04-21,,,,1.20%,"The first case of COVID-19 was first detected in Nigeria 27 February 2020. As of 21 April 2023, a total of 266 675 confirmed cases with 259 953 recovered and 3 155 deaths have been"
OEW21-1521052023,21,15 - 21 May 2023,Ongoing,NGA,Nigeria,Diphteria,1,2022-12-01,2022-12-01,2023-03-04,,389.0,62.0,5.80%,"Between week 19 of 2022 and week 9 of 2023, 1064 suspected cases of diphtheria were reported from 21 states in Nigeria. Kano (843), Yobe (86), Katsina (45), and Lagos (22)states have reported the most cases (96%). A total of 62 deaths were recorded among all confirmed cases, with a CFR of 15.9%. Of suspected cases, 389 cases were confirmed, including 45 laboratory-confirmed and 343 clinically compatible. Both sexes are affected, and children aged 2-14 years account for the majority of confirmed cases (78 %)."
OEW21-1521052023,21,15 - 21 May 2023,Ongoing,NGA,Nigeria,Lassa Fever,Ungraded,2023-01-08,2023-01-01,2023-03-26,827.0,823.0,144.0,17.40%,"Since the beginning of 2023 to 26 March, 823 confirmed and four probable cases of Lassa fever with 144 deaths (CFR 17%), have been reported in 23 states and the Federal Capital Territory (FCT). Of all confirmed Lassa fever cases, 71% were reported from Ondo (32%), Edo (29%) and Bauchi (10%) States. The National Multisectoral Emergency"
OEW21-1521052023,21,15 - 21 May 2023,Ongoing,,"From 1 October 2022 to 15 March 2023, 66 Local Government Areas (LGAs) from 21 out of 36 administrative states and the Federal Capital Territory (FCT) reported 628 suspected meningitis cases, including 160 confirmed cases and 52 deaths (CFR 8.3%). Males account for 62 %of the suspected cases. Age group 5 -14 years is the most affected age group. Neisseria meningitides serogroup C is the dominant strainamong confirmed cases. 91% of all cumulative cases were from four (4) states - Jigawa (509 cases), Bauchi (23cases), Zamfara (22 cases) and Oyo (14 cases).","From 1 October 2022 to 15 March 2023, 66 Local Government Areas (LGAs) from 21 out of 36 administrative states and the Federal Capital Territory (FCT) reported 628 suspected meningitis cases, including 160 confirmed cases and 52 deaths (CFR 8.3%). Males account for 62 %of the suspected cases. Age group 5 -14 years is the most affected age group. Neisseria meningitides serogroup C is the dominant strainamong confirmed cases. 91% of all cumulative cases were from four (4) states - Jigawa (509 cases), Bauchi (23cases), Zamfara (22 cases) and Oyo (14 cases).","From 1 October 2022 to 15 March 2023, 66 Local Government Areas (LGAs) from 21 out of 36 administrative states and the Federal Capital Territory (FCT) reported 628 suspected meningitis cases, including 160 confirmed cases and 52 deaths (CFR 8.3%). Males account for 62 %of the suspected cases. Age group 5 -14 years is the most affected age group. Neisseria meningitides serogroup C is the dominant strainamong confirmed cases. 91% of all cumulative cases were from four (4) states - Jigawa (509 cases), Bauchi (23cases), Zamfara (22 cases) and Oyo (14 cases).",,,,,,,"From 1 October 2022 to 15 March 2023, 66 Local Government Areas (LGAs) from 21 out of 36 administrative states and the Federal Capital Territory (FCT) reported 628 suspected meningitis cases, including 160 confirmed cases and 52 deaths (CFR 8.3%). Males account for 62 %of the suspected cases. Age group 5 -14 years is the most affected age group. Neisseria meningitides serogroup C is the dominant strainamong confirmed cases. 91% of all cumulative cases were from four (4) states - Jigawa (509 cases), Bauchi (23cases), Zamfara (22 cases) and Oyo (14 cases).",
OEW21-1521052023,21,15 - 21 May 2023,Ongoing,NGA,Nigeria,Mpox,Grade 3,2022-01-31,2022-01-01,2023-03-29,829.0,829.0,9.0,1.10%,"From 1 January to 29 March 2023, Nigeria has reported 829 monkeypox confirmed cases with nine deaths."
OEW21-1521052023,21,15 - 21 May 2023,Ongoing,,Poliomyelitis (cVDPV2) 2 54 - -,Poliomyelitis (cVDPV2) 2 54 - -,Poliomyelitis (cVDPV2) 2 54 - -,,,,,,,Poliomyelitis (cVDPV2) 2 54 - -,Two cVDPV2 cases were reported this week; one each in Sokoto and Kebbi. There are six cVDPV2 cases reported this year and 48 cases reported in 2022.
