NAME,WEEK,DATE,EVENT_TYPE,ISO3,COUNTRY,EVENT_NAME,GRADE,DATE_NOTIFY,DATE_START,DATE_END,CASES_TOTAL,CASES_CONFIRMED,DEATHS,CFR,DESCRIPTION
OEW25-1218062023,25,12 - 18 Jun 2023,,,country including deaths. Zambia Measles Ungraded 13-Jun-22 13-Jun-22 28-May-23 2 157 132 31,country including deaths. Zambia Measles Ungraded 13-Jun-22 13-Jun-22 28-May-23 2 157 132 31,country including deaths. Zambia Measles Ungraded 13-Jun-22 13-Jun-22 28-May-23 2 157 132 31,,,,,,,country including deaths. Zambia Measles Ungraded 13-Jun-22 13-Jun-22 28-May-23 2 157 132 31,"measles outbreak continues to evolve in Lusaka, North-western and Southern provinces affecting several districts. Cumulatively, the provinces have recorded 2 157 measles cases and 31 deaths as of 28 May 2023. WHO is supporting the Ministry of Health investing other cases with similar symptoms."
OEW25-1218062023,25,12 - 18 Jun 2023,,ZWE,Zimbabwe,Cholera,Grade 3,2023-02-23,2023-02-12,2023-06-11,,593.0,,2.40%,"The first cholera outbreak in the country in 2023 started on the 12 February 2023 in Chegutu town, Mashonaland West Province. Cumulatively were 2 371 cholera cases with 58 deaths (CFR=2.4%) as of 11 June 2023. All of the ten provinces are affected with majority of the cases reported from Manicaland, Harare, Mash West and"
OEW25-1218062023,25,12 - 18 Jun 2023,,ZWE,Zimbabwe,COVID-19,Protracted 3,2020-03-20,2020-03-20,2023-06-10,,,,2.10%,"The first COVID-19 confirmed case was reported in Zimbabwe on 20 March 2020. As of 10 June 2023, a total of 265 307 confirmed COVID-19 cases were reported in the"
OEW25-1218062023,25,12 - 18 Jun 2023,,,country including 5 701 deaths. Closed Events,country including 5 701 deaths. Closed Events,country including 5 701 deaths. Closed Events,,,,,,,country including 5 701 deaths. Closed Events,
OEW25-1218062023,25,12 - 18 Jun 2023,,GIN,Guinea,Lassa Fever,Ungraded,2023-03-21,2023-03-21,2023-03-25,1.0,1.0,1.0,100.00%,"On 21 March 2023, the Ministry of Health of Guinea notified WHO of a confirmed fatal case of Lassa fever in a three-year-old male child from the Kobela health area, Nzerekore health district. The date of onset of symptoms was 13 March 2023, with fever, asthenia, anorexia, and dry cough. On 20 March 2023, the child was taken to the regional hospital for medical attention due to the persistence of the disease. On 21 March 2023 the child presented with bleeding from the mouth and blackish blood from the anus. Laboratory tests on the blood sample taken the same day were positive for Lassa fever varus. The child died in the community, in a remote village, after escaping from the hospital. A safe and dignified burial was not performed. Public health measures are being taken."
OEW25-1218062023,25,12 - 18 Jun 2023,,,"On 7 April 2023, kilometers off the west coast of Conakry, several fishermen, including Guineans, Sierra Leoneans, Liberians and Ghanaians, were exposed to an unknown chemical. According to the fishermen, a boat was seen dumping a product open sea. The product emitted a fizzy, pungent cloud and left a yellowish substance on the surface of the water. As of 21 April, 250 cases of burns, including 0 deaths, have been reported among fishermen only. The cases were reported in the Conakry (240 cases, 96%) and Kindia (10 cases, 4%) regions. On 21 April alone, 26 new cases were reported. Only six cases were severe enough to require hospitalization. Investigations are ongoing to identify the chemical product involved.","On 7 April 2023, kilometers off the west coast of Conakry, several fishermen, including Guineans, Sierra Leoneans, Liberians and Ghanaians, were exposed to an unknown chemical. According to the fishermen, a boat was seen dumping a product open sea. The product emitted a fizzy, pungent cloud and left a yellowish substance on the surface of the water. As of 21 April, 250 cases of burns, including 0 deaths, have been reported among fishermen only. The cases were reported in the Conakry (240 cases, 96%) and Kindia (10 cases, 4%) regions. On 21 April alone, 26 new cases were reported. Only six cases were severe enough to require hospitalization. Investigations are ongoing to identify the chemical product involved.","On 7 April 2023, kilometers off the west coast of Conakry, several fishermen, including Guineans, Sierra Leoneans, Liberians and Ghanaians, were exposed to an unknown chemical. According to the fishermen, a boat was seen dumping a product open sea. The product emitted a fizzy, pungent cloud and left a yellowish substance on the surface of the water. As of 21 April, 250 cases of burns, including 0 deaths, have been reported among fishermen only. The cases were reported in the Conakry (240 cases, 96%) and Kindia (10 cases, 4%) regions. On 21 April alone, 26 new cases were reported. Only six cases were severe enough to require hospitalization. Investigations are ongoing to identify the chemical product involved.",,,,,,,"On 7 April 2023, kilometers off the west coast of Conakry, several fishermen, including Guineans, Sierra Leoneans, Liberians and Ghanaians, were exposed to an unknown chemical. According to the fishermen, a boat was seen dumping a product open sea. The product emitted a fizzy, pungent cloud and left a yellowish substance on the surface of the water. As of 21 April, 250 cases of burns, including 0 deaths, have been reported among fishermen only. The cases were reported in the Conakry (240 cases, 96%) and Kindia (10 cases, 4%) regions. On 21 April alone, 26 new cases were reported. Only six cases were severe enough to require hospitalization. Investigations are ongoing to identify the chemical product involved.",
OEW25-1218062023,25,12 - 18 Jun 2023,,SEN,Senegal,Dengue,Ungraded,2022-11-14,2023-01-01,2023-05-14,40.0,40.0,0.0,0.00%,"A total of 40 dengue confirmed cases have been reported in Thilogne (38), Pikine (1) and Popenguine (1) districts from week 1 to week 12 of 2023. The last confirmed case was recorded on 23 March 2023 (week 12)."
OEW25-1218062023,25,12 - 18 Jun 2023,,,"The Ministry of Health of Equatorial Guinea declared the end of the Marburg virus disease (MVD) outbreak on 8 June 2023 after two consecutive incubation periods (42 days) without a new confirmed or probable case reported as per the WHO recommendations. As of 7 June 2023, a total of 17 confirmed and 23 probable cases were reported in the continental region of Equatorial Guinea. Of the confirmed cases, 12 died, four (4) recovered and one (1) the outcome is unknown; all of the probable cases were reported deaths, the case fatality ratio (CFR) among confirmed cases is 75%, excluding one confirmed case with an unknown outcome","The Ministry of Health of Equatorial Guinea declared the end of the Marburg virus disease (MVD) outbreak on 8 June 2023 after two consecutive incubation periods (42 days) without a new confirmed or probable case reported as per the WHO recommendations. As of 7 June 2023, a total of 17 confirmed and 23 probable cases were reported in the continental region of Equatorial Guinea. Of the confirmed cases, 12 died, four (4) recovered and one (1) the outcome is unknown; all of the probable cases were reported deaths, the case fatality ratio (CFR) among confirmed cases is 75%, excluding one confirmed case with an unknown outcome","The Ministry of Health of Equatorial Guinea declared the end of the Marburg virus disease (MVD) outbreak on 8 June 2023 after two consecutive incubation periods (42 days) without a new confirmed or probable case reported as per the WHO recommendations. As of 7 June 2023, a total of 17 confirmed and 23 probable cases were reported in the continental region of Equatorial Guinea. Of the confirmed cases, 12 died, four (4) recovered and one (1) the outcome is unknown; all of the probable cases were reported deaths, the case fatality ratio (CFR) among confirmed cases is 75%, excluding one confirmed case with an unknown outcome",,,,,,,"The Ministry of Health of Equatorial Guinea declared the end of the Marburg virus disease (MVD) outbreak on 8 June 2023 after two consecutive incubation periods (42 days) without a new confirmed or probable case reported as per the WHO recommendations. As of 7 June 2023, a total of 17 confirmed and 23 probable cases were reported in the continental region of Equatorial Guinea. Of the confirmed cases, 12 died, four (4) recovered and one (1) the outcome is unknown; all of the probable cases were reported deaths, the case fatality ratio (CFR) among confirmed cases is 75%, excluding one confirmed case with an unknown outcome",
OEW25-1218062023,25,12 - 18 Jun 2023,,ZWE,Zimbabwe,Anthrax,Ungraded,2020-01-20,2022-01-01,2023-03-19,491.0,88.0,0.0,0.00%,"The anthrax outbreak is ongoing in Zimbabwe. In February 2023, four new cases have been reported from Gokwe North district. As of 5 March 2023, the cumulative figures"
OEW25-1218062023,25,12 - 18 Jun 2023,,ZWE,Zimbabwe,Typhoid fever,Ungraded,2022-10-17,2022-10-17,2023-03-19,384.0,28.0,0.0,0.00%,"Zimbabwe has recorded 384 suspected cases of typhoid since 17 October 2022.Of these, 69 cases were reported in the last epi week. The cases have been reported mainly from Harare Province and Bulawayo (6 cases) which are the largest cities in the country. Harare has heightened surveillance and has responded to the outbreak by rolling out"
