NAME,WEEK,DATE,EVENT_TYPE,ISO3,COUNTRY,EVENT_NAME,GRADE,DATE_NOTIFY,DATE_START,DATE_END,CASES_TOTAL,CASES_CONFIRMED,DEATHS,CFR,DESCRIPTION
OEW42-1420102024,42,14 - 20 Oct 2024,,SEN,Senegal,Floods,Ungraded,2024-10-04,2024-10-16,2024-10-16,,,,0%,Several regions of the country are experiencing floods. Management is done at the regional level in a One Health approach under the coordination of Governors. A
OEW42-1420102024,42,14 - 20 Oct 2024,,DZA,Algeria,COVID-19,Protracted 3,2020-02-25,2020-02-25,2023-08-24,,,6881.0,"2,50%","From 25 February 2020 to 24 August 2023, a total of 271 853 confirmed cases of COVID-19 with 6 881 deaths have been reported from Algeria."
OEW42-1420102024,42,14 - 20 Oct 2024,,DZA,Algeria,Diphtheria,Grade 2,2023-08-03,2023-08-03,2023-08-03,80.0,16.0,0.0,"0,00%","On August 3, 2023, the Ministry of Health announced emergency measures to contain a diphtheria outbreak in the southern regions. There have been 80 cases, including 16 confirmed cases reported."
OEW42-1420102024,42,14 - 20 Oct 2024,,DZA,Algeria,Poliomyelitis (cVDPV2),Grade 2,2022-07-14,2022-04-11,2023-10-04,3.0,3.0,,-,"According to Global Polio Eradication Initiative, no case of circulating vaccine-derived poliovirus type 2 (cVDPV2) was reported this week. There were three cases reported in 2022."
OEW42-1420102024,42,14 - 20 Oct 2024,,AGO,Angola,COVID-19,Protracted 3,2020-03-21,2020-03-21,2023-10-16,105968.0,105968.0,1936.0,"1,80%","The first confirmed COVID-19 case was reported in Angola on 21 March 2020. As of 16 October 2023, 105 968 confirmed COVID-19 cases have been reported in the country, with 1 936 deaths."
OEW42-1420102024,42,14 - 20 Oct 2024,,BEN,Benin,COVID-19,Protracted 3,2020-03-17,2020-03-16,2023-05-03,28014.0,,163.0,"0,60%","The Ministry of Health in Benin announced the first confirmed case of COVID-19 on 16 March 2020. As of 3 May 2023, a total of 28 014 cases have been reported in the country, with 163 deaths and 27 847 recoveries."
OEW42-1420102024,42,14 - 20 Oct 2024,,BEN,Benin,Poliomyelitis (cVDPV2),Grade 2,2019-08-08,2019-08-24,2023-10-11,30.0,30.0,0.0,"0,00%","There have been three cases reported in 2023. There are 13 cases reported in 2022. Six cases were reported in 2021 and 2020, and eight in 2019."
OEW42-1420102024,42,14 - 20 Oct 2024,,BWA,Botswana,COVID-19,Protracted 3,2020-03-30,2020-03-30,2023-10-23,330321.0,,2799.0,"0,90%","On 30 March 2020, the Minister of Health and Wellness in Botswana reported three confirmed cases of COVID-19. As of 13 October 2023, a total of 330 321 confirmed COVID-19 cases were reported in the country including 2 799 deaths."
OEW42-1420102024,42,14 - 20 Oct 2024,,BFA,Burkina Faso,Humanitarian crisis (Sahel Region),Grade 2,2019-01-01,2019-01-01,2023-09-07,2100000.0,,,-,"Since 2015, the security situation in the Sahel and Eastern Burkina Faso has gradually deteriorated due to attacks by armed groups. Access to healthcare services remains a major challenge for the affected population. As of 30 June 2023, 5.5million People were in need of humanitarian assistance and over 2.0million IDPs registered. The situation remains fluid."
OEW42-1420102024,42,14 - 20 Oct 2024,,BFA,Burkina Faso,Chikungunya,Ungraded,2023-09-06,2023-09-19,,282.0,282.0,0.0,"0,00%","On 6 September 2023, the reference laboratory for viral haemorrhagic fevers confirmed chikungunya in a patient from the Pouytenga health district whose sample was collected as part of sentinel surveillance for dengue and other arboviruses. As of 15 October 2023, 282 PCR-confirmed cases and 0 deaths have been reported, including 75 cases in week 41."
OEW42-1420102024,42,14 - 20 Oct 2024,,BFA,Burkina Faso,COVID-19,Protracted 3,2020-03-10,2020-03-09,2023-05-03,22056.0,,396.0,"1,80%","Between 9 March 2020 and 3 May 2023, a total of 22 056 confirmed cases of COVID-19 with 396 deaths and 21 596 recoveries have been reported from Burkina Faso."
OEW42-1420102024,42,14 - 20 Oct 2024,,BFA,Burkina Faso,Dengue fever,Ungraded,2023-09-11,2023-01-01,2023-09-19,,128.0,48.0,"0,70%","From the beginning of the outbreak in January to September 19, 2023, a total of 6 703 suspected cases have been documented, with 2 494 probable cases and 48 fatalities. The Dengue outbreak in Burkina Faso is confined to the eight districts of the Hauts-Bassins region in the Western part of the country"
OEW42-1420102024,42,14 - 20 Oct 2024,,BDI,Burundi,Cholera,Grade 3,2023-01-01,2022-12-14,2023-10-14,1193.0,175.0,9.0,"0,80%","The ongoing cholera outbreak was officially declared on 1 January 2023. Cumulatively, a total of 1 193 cases with nine deaths (CFR 0.8%) have been reported"
OEW42-1420102024,42,14 - 20 Oct 2024,,BDI,Burundi,COVID-19,Protracted 3,2020-03-31,2020-03-18,2023-10-01,,,15.0,"0,00%","On 31 March 2020, the Minister of Health in Burundi reported the first two confirmed cases of COVID-19. As of 10 September 2023, the total number of confirmed COVID-19"
OEW42-1420102024,42,14 - 20 Oct 2024,,BDI,Burundi,Poliomyelitis (cVDPV2),Grade 2,2023-03-17,2022-01-01,2023-10-05,2.0,2.0,0.0,"0,00%",
OEW42-1420102024,42,14 - 20 Oct 2024,,,No cVDPV2 case was reported this week. There is one case reported this year and one last year.,No cVDPV2 case was reported this week. There is one case reported this year and one last year.,No cVDPV2 case was reported this week. There is one case reported this year and one last year.,,,,,,,No cVDPV2 case was reported this week. There is one case reported this year and one last year.,
OEW42-1420102024,42,14 - 20 Oct 2024,,,Cameroon Cameroon hosts,"Humanitarian crisis (North, Adamawa & East) about 460 000",Protracted 2 refugees and,,,,,,,- eastern part,
OEW42-1420102024,42,14 - 20 Oct 2024,,CMR,Cameroon,Humanitarian crisis (Noth- West & South-West ),Protracted 2,2016-10-01,2018-06-27,2023-10-02,,,,-,"In the North-West and South-West regions, the unstable security situation and persistent violence are exacerbating humanitarian needs. Affected people continue to flee their homes to neighboring villages and communities. Between January and July 2023, humanitarian and security partners reported the displacement of more than 42 000 people in both regions"
OEW42-1420102024,42,14 - 20 Oct 2024,,CMR,Cameroon,Humanitarian crisis (Sahel Region),Grade 2,2013-12-31,2017-06-27,2023-10-02,,,,-,"In Cameroon, the Far North region faces the triple burden of conflicts in the Lake Basin Chad, the socioeconomic impact of the Russian-Ukrainian crisis and natural hazards including floods, all this continue to drive the humanitarian needs in that region and are happening in the context of underfunded humanitarian response plan"
OEW42-1420102024,42,14 - 20 Oct 2024,,CMR,Cameroon,Cholera,Grade 3,2021-08-31,2021-10-25,2023-10-12,20933.0,,492.0,"2,40%","From 25 Oct 2021 to 12 October 2023, a total of 20 933 cases of cholera including 2 050 laboratory-confirmed cases and 492 deaths (CFR 2.4%) have been reported from nine regions. Three regions are still active (Centre, Littoral, and South-West). Patients' ages range from 2 months to 103 years with a median of 28 years, and the sex ratio"
OEW42-1420102024,42,14 - 20 Oct 2024,,CMR,Cameroon,COVID-19,Protracted 3,2020-03-06,2020-03-06,2023-10-01,125201.0,125201.0,1974.0,"1,60%","The Cameroon Ministry of Health confirmed the first COVID-19 case on 6 March 2020. As of 1 October 2023, 125 201 cases have been reported, including 1 974 deaths."
OEW42-1420102024,42,14 - 20 Oct 2024,,CMR,Cameroon,Measles,Ungraded,2019-04-02,2023-01-01,2023-10-08,6508.0,,30.0,"0,50%","From week 1 through week 40 (ending 08 October 2023), 6 008 confirmed measles cases have been reported in Cameroon, including 429 IgM+, 50 clinically compatible and"
OEW42-1420102024,42,14 - 20 Oct 2024,,,5529 epidemiologically linked. At least 30 related deaths (CFR 0.5%) have been reported,5529 epidemiologically linked. At least 30 related deaths (CFR 0.5%) have been reported,5529 epidemiologically linked. At least 30 related deaths (CFR 0.5%) have been reported,,,,,,,5529 epidemiologically linked. At least 30 related deaths (CFR 0.5%) have been reported,
OEW42-1420102024,42,14 - 20 Oct 2024,,,From 1 January three deaths were,to 12 October reported in the,"2023, 108 suspected country.",,,,,,,cases and,
OEW42-1420102024,42,14 - 20 Oct 2024,,,"Cameroon Poliomyelitis 23-May-19 1-Jan-20 1-Oct-23 13 13 0 0,00%","Cameroon Poliomyelitis 23-May-19 1-Jan-20 1-Oct-23 13 13 0 0,00%","Cameroon Poliomyelitis 23-May-19 1-Jan-20 1-Oct-23 13 13 0 0,00%",,,,,,,"Cameroon Poliomyelitis 23-May-19 1-Jan-20 1-Oct-23 13 13 0 0,00%",
OEW42-1420102024,42,14 - 20 Oct 2024,,,Cape Verde,COVID-19,Protracted 3,2020-03-19,2020-03-18,2023-07-08,64143.0,,414.0,"0,60%","The first confirmed COVID-19 case was reported in Cape Verde on 19 March 2020. As of 8 July 2023, 64 143 confirmed COVID-19 cases, including 414 deaths and 63 645 recoveries, were reported in the country."
OEW42-1420102024,42,14 - 20 Oct 2024,,CAF,Central African Republic,Humanitarian crisis,Protracted 2,2013-12-11,2013-12-11,2023-10-04,,,,-,"The protracted humanitarian crisis in Central African Republic (CAR) is still presenting worrying situations. Recently, the northwest part of the country received over 37 000 Chadians, mainly women and children seeking refuge due to insecurity in their villages. More to that, since April this year, a total of 18 545 Sudanese refugees and returnees arrived in the north-east prefecture of Vakaga, seeking safety from the ongoing conflict in Sudan. These displacements have exacerbated the humanitarian situation in those regions."
OEW42-1420102024,42,14 - 20 Oct 2024,,CAF,Central African Republic,COVID-19,Protracted 3,2020-03-14,2020-03-14,2023-06-18,15404.0,,113.0,"0,70%","The Ministry of Health and Population announced the confirmation of the first COVID-19 case in the Central African Republic on 14 March 2020. As of 18 June 2023, a total of 15 404 confirmed cases, 113 deaths and 15 252 recoveries were reported."
OEW42-1420102024,42,14 - 20 Oct 2024,,CAF,Central African Republic,Measles,Ungraded,2022-03-13,2023-01-01,2023-08-20,2055.0,,3.0,"0,10%","From week 1 to week 33 (ending 20 August 2023), the Ministry of Health and Population has recorded 1 145 confirmed measles cases, including 102 laboratory-confirmed cases, 1 043 epidemiologically linked cases. Three deaths have been reported. The measles outbreak is ongoing in 13 (37%) out of 35 health districts"
OEW42-1420102024,42,14 - 20 Oct 2024,,CAF,Central African Republic,Mpox,Protracted 2,2022-03-03,2022-03-04,2023-05-28,31.0,31.0,1.0,"3,20%","From 4 March 2022 to 28 May 2023, 31 confirmed cases of Mpox and one death have been reported in the country. Since the start of 2023, the country has reported 14 laboratory-confirmed cases, including one death. The last cases were reported during week 21 (ending 28 May) in from Baboua-Abba and Paoua districts."
OEW42-1420102024,42,14 - 20 Oct 2024,,CAF,Central African Republic,Poliomyelitis (cVDPV2),Grade 2,2019-05-24,2019-05-24,2023-10-01,46.0,46.0,0.0,"0,00%","Fifteen cases have been reported in the country this year. In addition, six cases were reported in 2022. Although no new cases were reported in 2021, four cVDPV2 cases were reported in 2020 and 21 cases in 2019 from several outbreaks."
OEW42-1420102024,42,14 - 20 Oct 2024,,,Central,Yellow Fever,Ungraded,2023-06-12,2023-01-01,2023-08-20,5.0,5.0,0.0,"0,00%","There is an ongoing yellow fever outbreak in the Central African Republic (CAR). This year from week 1 through week 33 (ending 20 August) , five confirmed cases of yellow fever were recorded including four new confirmed cases following the classification conducted on 7 July 2023 , these new confirmed cases are from the following districts : Sangha-Mbaéré (1), Berbérati ( 1) and Bambari (2)."
OEW42-1420102024,42,14 - 20 Oct 2024,,TCD,Chad,COVID-19,Protracted 3,2020-03-19,2022-03-19,2023-05-03,7822.0,,194.0,"2,50%","The first confirmed COVID-19 case was reported in Chad on 19 March 2020. As of 26 April 2023, a total of 7 822 confirmed COVID-19 cases were reported in the country, including 194 deaths."
OEW42-1420102024,42,14 - 20 Oct 2024,,TCD,Chad,Dengue,Ungraded,2023-08-05,2023-08-06,2023-10-01,1342.0,41.0,1.0,"0,10%","Chad health authorities declared the dengue outbreak officially on 15 August 2023. As of 1 October 2023, a total of 1 342 suspected cases, 41 confirmed and one death are reported."
OEW42-1420102024,42,14 - 20 Oct 2024,,TCD,Chad,Measles,Ungraded,2018-05-24,2023-01-01,2023-08-06,,820.0,4.0,"0,00%","As of Week 31 of 2023 (ending 6 August), 8 489 suspected cases and four measles-related deaths (CFR 0.1%) have been reported from 143 out of 150 districts in Chad. A total of 820 samples tested IgM positive for measles and 178 tested IgM+ for rubella."
OEW42-1420102024,42,14 - 20 Oct 2024,,TCD,Chad,Poliomyelitis (cVDPV2),Grade 2,2019-10-18,2019-09-09,2023-10-01,193.0,193.0,0.0,"0,00%","There have been 34 cases reported this year. In addition, 44 cVDPV2 cases were reported in 2022, 106 cVDPV2 cases were reported in 2020 from three different outbreaks and nine others were reported in 2019."
OEW42-1420102024,42,14 - 20 Oct 2024,,COM,Comoros,COVID-19,Protracted 3,2020-04-30,2020-04-30,2023-10-12,9109.0,,160.0,"1,80%","The first case of confirmed COVID-19 was notified on 30 April 2020 in Comoros. As of 23 May 2023, a total of 9 109 confirmed COVID-19 cases, including 160 deaths, were reported in the country."
OEW42-1420102024,42,14 - 20 Oct 2024,,COG,Congo,COVID-19,Protracted 3,2020-03-14,2020-03-14,2023-05-14,25195.0,,389.0,"1,60%","The Government of Congo announced the confirmation of the first case of COVID-19 in Congo on 14 March 2020. As of 14 May 2023, a total of 25 195 cases, including 389 deaths, have been reported in the country."
OEW42-1420102024,42,14 - 20 Oct 2024,,COG,Congo,Mpox,Protracted 2,2022-05-23,2023-08-22,2023-10-11,22.0,18.0,2.0,"9,10%","From 22 August to 11 October 2023, (18) laboratory-confirmed cases of Mpox, (4) probable cases and (2) deaths were reported from Likouala and Brazzaville Departments. From week 1 to week 36 of 2022 (week ending 11 September 2022), (5) laboratory-confirmed cases and (5) probable cases, including (3) deaths were reported from Likouala, Sangha and Pointe-Noire Departments."
OEW42-1420102024,42,14 - 20 Oct 2024,,COG,Congo,Poliomyelitis (cVDPV1),Grade 2,2023-03-21,2023-03-01,2023-10-01,1.0,1.0,,-,"A case of circulating vaccine-derived poliovirus type 1 (cVDPV1) was confirmed on 1 March 2023 in a 15-year-old child living in Dolisie, Niari Department, with onset of paralysis on 26 September 2022."
OEW42-1420102024,42,14 - 20 Oct 2024,,CIV,Côte d'Ivoire,COVID-19,Protracted 3,2020-03-11,2020-03-11,2023-07-11,,,835.0,"0,90%","Since 11 March 2020, a total of 88 338 confirmed cases of COVID-19 have been reported from Côte d'Ivoire, including 835 deaths and a total of 87 497 recoveries."
OEW42-1420102024,42,14 - 20 Oct 2024,,CIV,Côte d'Ivoire,Dengue fever,Ungraded,2023-07-10,2023-06-19,2023-09-02,3029.0,259.0,0.0,"0,00%","An outbreak of Dengue fever is ongoing in Ivory Coast. A total of 3029 cases have been reported from 19 June to 02 September 2023, with 259 confirmed cases and no fatalities. Males are more affected (51%), and the age group of more than 15 years is predominant ( 54.5%)."
OEW42-1420102024,42,14 - 20 Oct 2024,,CIV,Côte d'Ivoire,Yellow Fever,Ungraded,2023-05-17,2023-05-08,2023-06-15,1.0,1.0,0.0,"0,00%",A polymerase chain reaction -positive case of yellow fever was reported in Côte d'Ivoire on 8 May 2023 following confirmation at the Institut Pasteur in Dakar. The patient is a 35-year-old male from Abidjan with an unknown yellow fever vaccination status. The date of onset of illness is 4 April 2023.
OEW42-1420102024,42,14 - 20 Oct 2024,,,Democratic Republic of the Congo,Humanitarian crisis,Grade 3,2016-12-20,2017-04-17,2023-10-07,,,,-,"In The Democratic Republic of the Congo (DRC), the humanitarian situation remains concerning. In Ituri province, recent security incidents have been reported including kidnapping and robbery in Bunia health zone. In Kasai and Mai-Ndombe provinces, conflicts between local communities continue with thousands of people fleeing their homes. Recent armed fights are reported in Nord Kivu and Tshopo provinces"
OEW42-1420102024,42,14 - 20 Oct 2024,,,Democratic Republic of the Congo,Cholera,Grade 3,2015-01-16,2023-01-01,2023-09-17,29874.0,,107.0,"0,40%","During the epidemiological week 37 (week ending 17 September 2023), 741 new cases and ten deaths were reported. This marks an increase compared to the preceding week (624 cases, 0 deaths). Cumulatively, 29 874 cases with 107 deaths (CFR 0.4%) have been documented across six provinces in the country."
OEW42-1420102024,42,14 - 20 Oct 2024,,,Democratic Republic of the Congo,COVID-19,Protracted 3,2020-03-10,2020-03-10,2023-08-19,96230.0,,1468.0,"1,50%","Since the start of the COVID-19 outbreak, declared on 10 March 2020, a total of 96 230 confirmed cases, including 1 468 deaths, have been reported as of week 33 of 2023."
OEW42-1420102024,42,14 - 20 Oct 2024,,,Democratic Republic of the Congo,Measles,Ungraded,2021-10-12,2023-01-01,2023-10-01,247160.0,,4567.0,"1,80%",
OEW42-1420102024,42,14 - 20 Oct 2024,,,Democratic Republic of the Congo,Mpox,Protracted 2,2019-03-30,2022-01-01,2023-07-04,734.0,734.0,3.0,"0,40%","From 1 January 2022 through 13 April 2023, the Democratic Republic of the Congo reported 734 confirmed Mpox cases, with three death among the confirmed cases."
OEW42-1420102024,42,14 - 20 Oct 2024,,,Democratic Republic of the Congo,Poliomyelitis (cVDPV1),Grade 2,2022-08-27,2022-08-27,2023-10-04,208.0,208.0,0.0,"0,00%","According to the Global Polio Eradication Initiative (GPEI), no cVDPV1 cases were reported this week. There have been 61 cases reported this year and 147 cases in 2022"
OEW42-1420102024,42,14 - 20 Oct 2024,,,Democratic Republic of the Congo,Poliomyelitis (cVDPV2),Grade 2,2021-02-26,2022-01-01,2023-10-04,462.0,462.0,0.0,"0,00%",One cVDPV2 case was reported in Tshopo bringing the number of 2023 cases to 90. There were 372 cases reported in 2022.
OEW42-1420102024,42,14 - 20 Oct 2024,,GNQ,Equatorial Guinea,COVID-19,Protracted 3,2020-03-14,2020-03-14,2023-07-26,17229.0,,183.0,"1,10%","The Ministry of Health and Welfare announced the first confirmed COVID-19 case on 14 March 2020. As of 23 February 2023, a total of 17 229 cases have been reported in the country, with 183 deaths and 16 907 recoveries."
OEW42-1420102024,42,14 - 20 Oct 2024,,ERI,Eritrea,COVID-19,Protracted 3,2020-03-21,2020-03-21,2023-05-03,10189.0,,103.0,"1,00%","The first confirmed COVID-19 case was reported in Eritrea on 21 March 2020. As of 30 October 2022, 10 189 confirmed COVID-19 cases with 103 deaths were reported in the country. A total of 10 085 patients have recovered from the disease."
OEW42-1420102024,42,14 - 20 Oct 2024,,ERI,Eritrea,Poliomyelitis (cVDPV2),Grade 2,2022-06-02,2022-06-07,2023-09-21,2.0,2.0,0.0,"0,00%","No new case of cVDPV2 was reported in 2023. One case was reported in 2022, and another one reported in 2021. The latter case was confirmed on 2 June 2022 by the Ethiopian National Polio Laboratory."
OEW42-1420102024,42,14 - 20 Oct 2024,,SWZ,Eswatini,COVID-19,Protracted 3,2020-03-13,2020-03-13,2023-10-23,75052.0,,1427.0,"1,90%","The first case of COVID-19 was confirmed in the kingdom of Eswatini on 17 March 2020. As of 18 October 2023, a total of 75 052 cases have been reported with 1 427 associated deaths."
OEW42-1420102024,42,14 - 20 Oct 2024,,ETH,Ethiopia,Food insecurity,Grade 3,2022-02-17,2022-01-01,2023-09-30,,,,-,"Emergency (IPC Phase 4) outcomes with households in Catastrophe (IPC Phase 5) are expected to persist in southern, southeastern, and northern Ethiopia as per the Famine Early Warning Systems Network (FEWS NET) outlook update. Furthermore, forecasted above-average rainfall driven by El Niño and positive Indian Ocean Dipole conditions - brings not only opportunities like improved harvests and livestock reproduction, but also risks such as displacement, crop losses, and livestock diseases"
OEW42-1420102024,42,14 - 20 Oct 2024,,ETH,Ethiopia,Humanitarian crisis (Northern Ethiopia),Grade 3,2020-11-04,2020-11-04,2023-10-06,,,,-,"In Amhara region, there is an ongoing security concerns after conflict emerged early August. Partners are still unable to access many areas, and diseases surveillance not fully resumed because of limited internet access. Furthermore, armed conflict in Sudan has forced hundreds of thousands of people to flee to neighboring countries. As of 16 September 2023, over 81 000 people have arrived in Ethiopia through multiple border crossing points in Amhara, Benishangul Gumz, and Gambella Regions"
OEW42-1420102024,42,14 - 20 Oct 2024,,ETH,Ethiopia,Cholera,Grade 3,2022-09-17,2022-09-17,2023-09-21,24266.0,,295.0,"1,20%","Since the index case in August 2022, there have been 24 266 cholera cases, including 15 new cases reported in week 38 of 2023. Within this same period, there have been 295 deaths (CFR 1.2%)."
OEW42-1420102024,42,14 - 20 Oct 2024,,ETH,Ethiopia,COVID-19,Protracted 3,2020-03-13,2020-03-13,2023-09-21,501060.0,,7574.0,"1,50%","Since the confirmation of the first case on 21 March 2020, Ethiopia has confirmed a total of 501 060 cases of COVID-19 as of week 38, 2023, with 7 574 deaths and 488 159 recoveries."
OEW42-1420102024,42,14 - 20 Oct 2024,,ETH,Ethiopia,Dengue,Ungraded,2023-05-16,2023-05-10,2023-10-23,10233.0,103.0,4.0,"0,00%","Since 4 April 2023, two districts (Logia and Mille) in the Afar region of northeastern Ethiopia have been experiencing an outbreak of dengue fever. As of 18th October 2023, a total of 10 233 cases and 4 deaths associated deaths (CFR 0.04%) have been reported."
OEW42-1420102024,42,14 - 20 Oct 2024,,ETH,Ethiopia,Malaria,Grade 3,2023-01-31,2023-01-01,2023-10-08,,,,,"With the ongoing malaria outbreak in Ethiopia, a total of 76 995 malaria cases were reported in Epi-week 40, an increase by 13.9% when compared with week 39. Nine new"
OEW42-1420102024,42,14 - 20 Oct 2024,,,"deaths reported in the week 40, including six from Oromia and three West About 891 Woredas reported at least one malaria across the country","deaths reported in the week 40, including six from Oromia and three West About 891 Woredas reported at least one malaria across the country","deaths reported in the week 40, including six from Oromia and three West About 891 Woredas reported at least one malaria across the country",,,,,,,"deaths reported in the week 40, including six from Oromia and three West About 891 Woredas reported at least one malaria across the country",
OEW42-1420102024,42,14 - 20 Oct 2024,,ETH,Ethiopia,Measles,Ungraded,2017-04-13,2023-01-01,2023-10-23,,899.0,149.0,"0,80%","Since August 12, 2023, a total of 237 Woredas across all regions in Ethiopia have been affected by measles outbreak, Currently outbreak remains active in 25 Woredas located in six regions: As at 18 October 2023, a total of 18,899 cases with 149 deaths have been reported, a Case Fatality Rate (CFR) of 0.76%."
OEW42-1420102024,42,14 - 20 Oct 2024,,ETH,Ethiopia,Poliomyelitis (cVDPV2),Grade 2,2019-06-24,2019-05-20,2023-09-21,69.0,69.0,0.0,"0,00%","As of week 37, 2023, there have been a total of 69 reported cases of circulating vaccine-derived poliovirus type 2 (cVDPV2). There was one case reported in 2022, one case in 2021, 10 cases in 2020, and 43 cases in 2019. It's important to highlight that no cases have been reported in 2023."
OEW42-1420102024,42,14 - 20 Oct 2024,,GAB,Gabon,COVID-19,Protracted 3,2020-03-12,2020-03-12,2023-10-22,48992.0,,307.0,"0,60%","On 12 March 2020, the Ministry of Health announced the confirmation of the first COVID-19 case in the country. As of 9 October 2023, a total of 48 992 cases, including 307"
OEW42-1420102024,42,14 - 20 Oct 2024,,,deaths and 48 676 recoveries have been reported. No New cases reported since then,deaths and 48 676 recoveries have been reported. No New cases reported since then,deaths and 48 676 recoveries have been reported. No New cases reported since then,,,,,,,deaths and 48 676 recoveries have been reported. No New cases reported since then,
OEW42-1420102024,42,14 - 20 Oct 2024,,GMB,Gambia,COVID-19,Protracted 3,2020-03-17,2020-03-17,2023-09-21,12684.0,,372.0,"2,90%","A total of 12 684 cummulative cases have been reported with 372 deaths(CFR=2.9%). Noteably, 58% of confirmed cases are male."
OEW42-1420102024,42,14 - 20 Oct 2024,,GHA,Ghana,COVID-19,Protracted 3,2020-03-12,2020-03-12,2023-09-21,171665.0,,1462.0,"0,90%","As at week 36 of 2023, Ghana has had a cummulative 171 665 cases and 1 462 deaths(CFR 0.9%). The most recent cases (5) were from the Bibiani-Anhwiaso-Bekwai, Ayawaso West and Tema respective districts."
OEW42-1420102024,42,14 - 20 Oct 2024,,GHA,Ghana,Floods,Ungraded,2023-10-13,2023-10-16,2023-10-24,25629.0,,0.0,,"As at 16 October 2023, flooding has impacted seven districts and 81 communities downstream, resulting in damage to infrastructure and the displacement of 25,629 residents, with 5,027 seeking refuge in safe havens and the remainder staying with relatives. Approximately 400 houses were completely submerged, while flash floods"
OEW42-1420102024,42,14 - 20 Oct 2024,,GHA,Ghana,Mpox,Protracted 2,2022-06-08,2022-05-24,2023-09-21,133.0,133.0,5.0,"3,80%",
OEW42-1420102024,42,14 - 20 Oct 2024,,,"As of week 36, there have been 133 confirmed and 5 deaths(CFR 3.8%) reported from 261 Districts.","As of week 36, there have been 133 confirmed and 5 deaths(CFR 3.8%) reported from 261 Districts.","As of week 36, there have been 133 confirmed and 5 deaths(CFR 3.8%) reported from 261 Districts.",,,,,,,"As of week 36, there have been 133 confirmed and 5 deaths(CFR 3.8%) reported from 261 Districts.",
