NAME,WEEK,DATE,EVENT_TYPE,ISO3,COUNTRY,EVENT_NAME,GRADE,DATE_NOTIFY,DATE_START,DATE_END,CASES_TOTAL,CASES_CONFIRMED,DEATHS,CFR,DESCRIPTION
OEW42-1420102024,42,14 - 20 Oct 2024,,GHA,Ghana,Poliomyelitis (cVDPV2),Grade 2,2019-08-23,2019-07-23,2023-09-21,34.0,34.0,,-,"Ghana first reported a cVDPV2 outbreak in 2019. The country has a cumulative of 34 cVDPV2 AFP cases. 19 cVDPV2 cases were documented in 2019, 12 in 2020 and 3 in 2022. No new case was documented as of week 38 2023."
OEW42-1420102024,42,14 - 20 Oct 2024,,GIN,Guinea,COVID-19,Protracted 3,2020-03-13,2020-03-13,2023-05-03,,,467.0,"1,20%","The Ministry of Health in Guinea announced the first confirmed case of COVID-19 on 13 March 2020. As of 3 May 2023, a total of 38 462 cases, including 37 407 recovered cases and 467 deaths, have been reported in the country."
OEW42-1420102024,42,14 - 20 Oct 2024,,GIN,Guinea,Diphtheria,Grade 2,2023-08-21,2023-07-04,2023-10-04,456.0,14.0,57.0,"12,50%","An outbreak of diphtheria has been reported in the Kankan region of Guinea since 4 July 2023. As of 4 October 2023, 456 suspected cases have been reported, including 14 confirmed cases. A total of 57 deaths have been recorded. Of the reported cases, 59% are female. The 1-4 years age group is the most affected with 365 cases. Siguiri"
OEW42-1420102024,42,14 - 20 Oct 2024,,,District has Guinea-Bissau,reported the highest COVID-19,number of cases Protracted 3,,,2023-04-09,,,177.0,"1,80%","On 25 March 2020, the Ministry of Health of Guinea Bissau reported the first COVID-19 confirmed case in the country. As of 9 April 2023, the country has reported 9 614"
OEW42-1420102024,42,14 - 20 Oct 2024,,,confirmed cases of with 9 315 recoveries and 177 deaths. Kenya Food insecurity Grade 3 17-Feb-22 30-Sep-23 - - -,confirmed cases of with 9 315 recoveries and 177 deaths. Kenya Food insecurity Grade 3 17-Feb-22 30-Sep-23 - - -,confirmed cases of with 9 315 recoveries and 177 deaths. Kenya Food insecurity Grade 3 17-Feb-22 30-Sep-23 - - -,,,,,,,confirmed cases of with 9 315 recoveries and 177 deaths. Kenya Food insecurity Grade 3 17-Feb-22 30-Sep-23 - - -,"Climate forecasts indicate that the October to December short rains in northern and eastern Kenya will likely have an early onset and be cumulatively above average, supported by a strong El Niño event. The rains are expected to improve forage, pasture, and water resources in pastoral areas, supporting livestock body. However, there is an elevated risk that the above-average rainfall will result in flooding flood-prone the country and outbreaks of diseases like Rift Valley Fever in pastoral areas. Pastoral areas remain in Crisis (IPC the pastoral lean"
OEW42-1420102024,42,14 - 20 Oct 2024,,,"As of 31st August 2023, cumulative 20 cases and 3 deaths were reported. 17 of these cases and 3 deaths were reported In April-May 2023, In August 2023, 3 new cases","As of 31st August 2023, cumulative 20 cases and 3 deaths were reported. 17 of these cases and 3 deaths were reported In April-May 2023, In August 2023, 3 new cases","As of 31st August 2023, cumulative 20 cases and 3 deaths were reported. 17 of these cases and 3 deaths were reported In April-May 2023, In August 2023, 3 new cases",,,,,,,"As of 31st August 2023, cumulative 20 cases and 3 deaths were reported. 17 of these cases and 3 deaths were reported In April-May 2023, In August 2023, 3 new cases","emerged in Kandara sub-county, all cases were linked to the handling of an infected animal. No new cases have been reported after August."
OEW42-1420102024,42,14 - 20 Oct 2024,,,"A cholera outbreak has been ongoing in Kenya since 2022. October 2023, a total of 12 121 cases, with 577 confirmed by culture, and 202 deaths (CFR","A cholera outbreak has been ongoing in Kenya since 2022. October 2023, a total of 12 121 cases, with 577 confirmed by culture, and 202 deaths (CFR","A cholera outbreak has been ongoing in Kenya since 2022. October 2023, a total of 12 121 cases, with 577 confirmed by culture, and 202 deaths (CFR",,,,,,,"A cholera outbreak has been ongoing in Kenya since 2022. October 2023, a total of 12 121 cases, with 577 confirmed by culture, and 202 deaths (CFR",
OEW42-1420102024,42,14 - 20 Oct 2024,,,1.7%) have been reported in 27 affected Counties.,1.7%) have been reported in 27 affected Counties.,1.7%) have been reported in 27 affected Counties.,,,,,,,1.7%) have been reported in 27 affected Counties.,
OEW42-1420102024,42,14 - 20 Oct 2024,,KEN,Kenya,COVID-19 the,Protracted 3,2020-03-13,,2023-10-24,,,5689.0,"1,70%","On 12 March 2020, Ministry of Health announced the confirmation new COVID-19 case in the country. As of 18 October 2023, 343 955 confirmed COVID-19 cases have been reported, including 5 689 deaths and 44 new cases in the country."
OEW42-1420102024,42,14 - 20 Oct 2024,,,Kenya Leishmaniasis (visceral) Ungraded 31-Mar-19 3-Jan-20 22-Oct-23 2 395 2 205 10 -,Kenya Leishmaniasis (visceral) Ungraded 31-Mar-19 3-Jan-20 22-Oct-23 2 395 2 205 10 -,Kenya Leishmaniasis (visceral) Ungraded 31-Mar-19 3-Jan-20 22-Oct-23 2 395 2 205 10 -,,,,,,,Kenya Leishmaniasis (visceral) Ungraded 31-Mar-19 3-Jan-20 22-Oct-23 2 395 2 205 10 -,A cumulative total of 2 395 cases and 10 deaths (CFR 0.4%) have been reported in Kenya since 20 July 2020. The outbreak is currently active in only one county; West Pokot County. No new cases reported in the last epi week (since 10 August).
OEW42-1420102024,42,14 - 20 Oct 2024,,KEN,Kenya,Measles,Ungraded,2022-06-29,2023-01-01,2023-10-22,,259.0,23.0,-,"The outbreak has been continuous since 2022, affecting 13 counties in 2023. Cumulatively, 1 325 cases, with 256 confirmed cases and 23 deaths (CFR 1.7%) have been reported as of 22 October 2023. There have been new cases in week 41"
OEW42-1420102024,42,14 - 20 Oct 2024,,KEN,Kenya,Poliomyelitis (cVDPV2),Grade 2,2023-07-06,2023-05-26,2023-10-05,5.0,5.0,0.0,"0,00%",
OEW42-1420102024,42,14 - 20 Oct 2024,,,No cVDPV2 cases were reported this week. There have been five cases reported in 2021.,No cVDPV2 cases were reported this week. There have been five cases reported in 2021.,No cVDPV2 cases were reported this week. There have been five cases reported in 2021.,,,,,,,No cVDPV2 cases were reported this week. There have been five cases reported in 2021.,
OEW42-1420102024,42,14 - 20 Oct 2024,,LSO,Lesotho,COVID-19,Protracted 3,2020-05-13,2020-05-13,2023-10-23,35836.0,,706.0,"2,10%","Since the first confirmed COVID-19 case was reported in Lesotho on 13 May 2020 until 13 October 2023, a total of 35836 cases of COVID-19 have been reported, and 706 deaths."
OEW42-1420102024,42,14 - 20 Oct 2024,,LBR,Liberia,COVID-19,Protracted 3,2020-03-16,2020-03-16,2023-09-21,8161.0,,295.0,"3,60%","Cumulatively, from March 16, 2020, when the first case was confirmed in Liberia, until July 17, 2023, there have been 8 161 confirmed cases and 294 deaths. No new confirmed COVID-19 cases have been reported, and there are currently zero active cases in the country."
OEW42-1420102024,42,14 - 20 Oct 2024,,LBR,Liberia,Lassa Fever,Ungraded,2022-03-03,2022-01-06,2023-09-21,343.0,90.0,27.0,"7,90%","From January 6, 2022, to week 38 of 2023, a cummulative total of 343 cases have been reported with 90 confirmed and 27 deaths.(CFR 7.9%)."
OEW42-1420102024,42,14 - 20 Oct 2024,,LBR,Liberia,Measles,Ungraded,2022-02-03,2021-12-13,2023-09-21,12885.0,,95.0,"0,70%",
OEW42-1420102024,42,14 - 20 Oct 2024,,,Counties as of Liberia,week 38 of 2023. Mpox,Montserrado Protracted 2,,,,113.0,7.0,0.0,"0,00%","Liberia confirmed its first case of Mpox on 23 July 2022, with a cumualtive total of 113 suspected cases reported and 7 confirmed. The most recent case was in week 38 of 2023 in Grand Kru and Nimba counties."
OEW42-1420102024,42,14 - 20 Oct 2024,,MDG,Madagascar,Malnutrition crisis,Protracted 2,2021-07-01,2021-01-01,2023-08-06,2200000.0,,,-,"About 2.2 million people in Madagascar face food insecurity, including 479 000 children with acute malnutrition. Over 115 000 children need treatment for acute malnutrition this year. The situation is particularly dire in the Grand South and Grand South-east regions, where two out of five people are severely food insecure."
OEW42-1420102024,42,14 - 20 Oct 2024,,MDG,Madagascar,COVID-19,Protracted 3,2020-03-20,2020-03-20,2023-10-23,68352.0,,1425.0,"2,20%","The Madagascar Ministry of Health confirmed the first COVID-19 case on 20 March 2020. As of 13 October 2023, a total of 68 352 confirmed cases, including 1 425 deaths, have been reported in the country."
OEW42-1420102024,42,14 - 20 Oct 2024,,MWI,Malawi,Cholera,Grade 3,2022-03-03,2022-03-03,2023-10-15,,,1768.0,-,"Twenty-nine districts have reported Cholera cases since March 2022 in the Machinga district. As of 15 October 2023, a cumulative total of 59 040 cases and 1 768 deaths (CFR 3.0%) have been reported since the onset of the outbreak."
OEW42-1420102024,42,14 - 20 Oct 2024,,MWI,Malawi,COVID-19,Protracted 3,2020-04-02,2020-04-02,2023-08-27,,,2686.0,-,"On 2 April 2020, the president of Malawi announced the first confirmed cases of COVID-19 in the country. As of 27 August 2023, the country has 88 905 confirmed cases with 2 686 deaths."
OEW42-1420102024,42,14 - 20 Oct 2024,,MWI,Malawi,Poliomyelitis,Grade 2,2022-01-31,2022-02-01,2023-10-04,1.0,1.0,0.0,"0,00%","One positive case of wild WPV1 was detected in Lilongwe from a child with the date of onset of paralysis on 19 November 2021. No other cases have been reported. Malawi continues participating in the multi-country, subregional outbreak response to control the WPV1 outbreak."
OEW42-1420102024,42,14 - 20 Oct 2024,,MLI,Mali,Humanitarian crisis (Sahel region),Grade 2,,2017-09-11,2023-09-07,,,,-,"Mali is facing prolonged conflict, poverty, climate shocks, and growing insecurity. However, the current Humanitarian Response Plan for Mali is severely underfunded, with only 11% of the required funding secured. There has been a significant increase in IDPs in the regions of Kidal (32.8%) and Ménaka (20%). As of week 30 ( ending 30 July 2023) , over 7.5 million people are in need of humanitarian assistance."
OEW42-1420102024,42,14 - 20 Oct 2024,,MLI,Mali,Chikungunya,Ungraded,2023-10-02,2023-09-26,2023-10-05,1.0,1.0,0.0,"0,00%",The Ministry of Health of Mali has announced that a case of Chikungunya has been confirmed by real-time polymerase chain reaction (RT-PCR) on 30 September 2023 in commune VI of the Bamako district. The case is a 35-year-old male resident of Kayes Liberté in the Kayes health district with onset of symptoms on 26 September 2023.
OEW42-1420102024,42,14 - 20 Oct 2024,,MLI,Mali,COVID-19,Protracted 3,2020-03-25,2020-03-25,2023-06-11,33150.0,,743.0,"2,20%","On 25 March 2020, the Ministry of Health of Mali reported the first COVID-19 confirmed cases in the country. As of 11 June 2023, a total of 33 150 confirmed COVID-19 cases have been reported in the country, including 743 deaths and 32 331 recoveries."
OEW42-1420102024,42,14 - 20 Oct 2024,,MLI,Mali,Dengue Fever,Ungraded,2023-09-12,2023-08-31,2023-10-01,325.0,31.0,0.0,"0,00%","On 9 September 2023, the Malian Ministry of Health reported a case of dengue in a 44-year-old female resident of Bacodjicoroni Golf, commune V, Bamako district. The case had onset of symptoms on 31 August 2023. On 9 September 2023, the sample collected from the case was confirmed positive for dengue virus by real-time polymerase chain reaction (RT-PCR) at the University Clinical Research Center (UCRC) laboratory. As of 2 October 2023, 325 suspected cases including 11 confirmed cases and no deaths have been reported."
OEW42-1420102024,42,14 - 20 Oct 2024,,MLI,Mali,Measles,Ungraded,2018-02-20,2023-01-01,2023-09-24,382.0,344.0,0.0,"0,00%","From the beginning of the year through 24 Septembre 2023, 760 suspected measles cases were tested in Mali, and 344 were laboratory confirmed."
OEW42-1420102024,42,14 - 20 Oct 2024,,MRT,Mauritania,COVID-19,Protracted 3,2020-03-13,2020-03-13,2023-07-02,,,997.0,"1,70%","The government of Mauritania announced its first confirmed COVID-19 case on 13 March 2020. As of 2 July 2023, a total of 63 712 cases, including 997 deaths and 62 713"
OEW42-1420102024,42,14 - 20 Oct 2024,,MRT,Mauritania,Crimean- Congo haemorrhagic fever (CCHF),Ungraded,2023-07-27,2023-07-17,2023-09-17,2.0,2.0,1.0,"50,00%","Two Crimean-Congo haemorrhagic fever (CCHF) cases were confirmed in Mauritania since the beginning of 2023. The first case was a 58-year-old male from Tevarett district of Nouakchott North region who had reportedly been infected in the Ouad Naga district of Trarza region and developed a febrile illness on 17 July 2023. He was tested and died in Dakar, Senegal, on 26 July 2023. His results returned positive for CCHF on 27 July 2023. The second case is a 23-year-old female from Libheir locality in Barkeol district of Assaba region with date of symptom onset as of 5 September 2023. She tested positive for CCHF by RT-PCR on 9 September 2023. No epidemiological link was established between the two confirmed cases."
OEW42-1420102024,42,14 - 20 Oct 2024,,MRT,Mauritania,Measles,Ungraded,2023-03-07,2022-12-26,2023-09-17,730.0,269.0,5.0,"0,70%","Mauritania has been experiencing a measles outbreak since early 2023. A total of 20 districts have reached the epidemic threshold, including four currently experiencing an outbreak (Kaédi, Ksar, Monguel et Rosso). As of 17 September 2023, the country has reported 730 suspected cases of measles (269 confirmed, including 173 laboratory- confirmed cases and 96 epidemiologically linked cases). Five deaths, including two community deaths, have been reported among confirmed cases."
OEW42-1420102024,42,14 - 20 Oct 2024,,,"Mauritius COVID-19 18-Mar-20 1-Oct-23 295883 883 1052 0,40% The Republic of Mauritius announced the first three positive cases of COVID-19 on 18 March 2020. As of 1 October 2023, a total of 295 883 confirmed COVID-19 cases, including 1 052 deaths have been country.","Mauritius COVID-19 18-Mar-20 1-Oct-23 295883 883 1052 0,40% The Republic of Mauritius announced the first three positive cases of COVID-19 on 18 March 2020. As of 1 October 2023, a total of 295 883 confirmed COVID-19 cases, including 1 052 deaths have been country.","Mauritius COVID-19 18-Mar-20 1-Oct-23 295883 883 1052 0,40% The Republic of Mauritius announced the first three positive cases of COVID-19 on 18 March 2020. As of 1 October 2023, a total of 295 883 confirmed COVID-19 cases, including 1 052 deaths have been country.",,,,,,,"Mauritius COVID-19 18-Mar-20 1-Oct-23 295883 883 1052 0,40% The Republic of Mauritius announced the first three positive cases of COVID-19 on 18 March 2020. As of 1 October 2023, a total of 295 883 confirmed COVID-19 cases, including 1 052 deaths have been country.",
OEW42-1420102024,42,14 - 20 Oct 2024,,MUS,Mauritius,Dengue fever,reported in the Ungraded,2023-07-10,2023-06-08,2023-10-01,262.0,,0.0,"0,00%",
OEW42-1420102024,42,14 - 20 Oct 2024,,MOZ,Mozambique,Humanitarian crisis in Cabo Delgado,Protracted 2,2020-01-01,2023-10-12,2023-08-06,,,,-,"Most poor and very poor households in Mozambique face Minimal (IPC Phase 1) outcomes as the ongoing harvest improves food access and availability. In Cabo Delgado, ongoing humanitarian assistance drives Stressed (IPC Phase 2) outcomes, with Crisis (IPC Phase 3) outcomes persisting in conflict-affected areas. There have been a reduced number of attacks."
OEW42-1420102024,42,14 - 20 Oct 2024,,MOZ,Mozambique,Cholera,Grade 3,2022-09-14,2023-10-12,2023-08-04,34645.0,,144.0,"0,40%","The current cholera outbreak in the country started in Niassa province on 14 September 2022. As of 24 September 2023, 34 645 cholera cases have been recorded with 144 deaths (CRF 0.4%) in 11 affected provinces, 64 of the 67 affected districts have ended the outbreak ."
OEW42-1420102024,42,14 - 20 Oct 2024,,MOZ,Mozambique,COVID-19,Protracted 3,2020-03-22,2020-03-22,2023-10-23,233654.0,,2249.0,"1,00%","The first confirmed COVID-19 case was reported in Mozambique on 22 March 2020. As of 18 October 2023, a total of 233 654 confirmed COVID-19 cases were reported in the country, including 2 249 deaths."
OEW42-1420102024,42,14 - 20 Oct 2024,,MOZ,Mozambique,Poliomyelitis (cVDPV2),Grade 2,2018-12-07,2021-01-01,2023-08-04,6.0,6.0,0.0,"0,00%","According to the Global Polio Eradication Initiative, no case of circulating vaccine-derived poliovirus type 2 (cVDPV2) was reported this week. The number of cases in 2022 remains four. There were two cases reported in 2021."
OEW42-1420102024,42,14 - 20 Oct 2024,,MOZ,Mozambique,Poliomyelitis (WPV1),Grade 2,2022-05-17,2022-05-18,2023-10-04,8.0,8.0,0.0,"0,00%","According to the Global Polio Eradication Initiative, there was no WPV1 case reported this week. There were eight cases reported on 10 August 2022."
OEW42-1420102024,42,14 - 20 Oct 2024,,NAM,Namibia,COVID-19,Protracted 3,2020-03-14,2020-03-14,2023-07-09,171998.0,,4098.0,"2,40%","The first case of COVID-19 was detected in Namibia on the 14 March 2020. As of 9 July 2023, a total of 171 998 confirmed cases with 4 098 deaths have been reported."
OEW42-1420102024,42,14 - 20 Oct 2024,,NER,Niger,Humanitarian crisis (Sahel region),Grade 2,2015-02-01,2015-02-01,2023-09-07,,,,-,"The number of internally displaced people in Niger has reached a record high, with an increase from 1.9 million in 2017 to 4.3 million individuals (15% population) in 2023, indicating a significant rise in the need for humanitarian assistance. On 28 July, Niger experienced a military coup and this marks the third Sahel country in less than three"
OEW42-1420102024,42,14 - 20 Oct 2024,,NER,Niger,COVID-19,Protracted 3,2020-03-19,2020-03-19,2023-05-01,9513.0,,315.0,"3,30% from","From 19 March 2020 to 1 May 2023, a total of 9 513 cases with 315 deaths have been reported across the country. A total of 9 203 recoveries have been reported the"
OEW42-1420102024,42,14 - 20 Oct 2024,,NER,Niger,Diphtheria,Grade 2,2023-08-28,2023-07-04,2023-09-30,,7.0,104.0,"6,90%","An outbreak of diphtheria has been confirmed in Matameye health district, Zinder region. The first case was reported on 17 July 2023. As of 30 September 2023, a total of 1518 suspected cases, including 104 deaths (CFR:5.7) were reported from 10 health districts. Public health response activities are ongoing in affected districts."
OEW42-1420102024,42,14 - 20 Oct 2024,,NER,Niger,Measles,Ungraded,2022-04-05,2022-01-01,2023-09-30,1784.0,567.0,0.0,"0,00%","As of epidemiological week 39, 2023 ( ending 30 September ) , 1 784 suspected measles cases were reported, of which 991 were investigated across 66 districts in the eight regions. Of these cases, 57% (n=567) were laboratory-confirmed. Additionally, 91% (n=66) of the districts reported at least one suspected case, and 34 (49%) health"
OEW42-1420102024,42,14 - 20 Oct 2024,,,districts have Niger,reached the epidemic Meningitis,threshold since Ungraded,,,2023-09-30,2248.0,736.0,129.0,"5,70%","A meningitis outbreak was been declared in the Dungass health district in Zinder region. The first case was reported on 31 October 2022 and confirmed on 23 November 2022, with Neisseria meningitidis identified as the causative agent. As of 31 October 2023, 2 248 suspected cases of meningitis, including 736 laboratory-confirmed cases and 129 deaths (CFR 5.7%) were reported."
OEW42-1420102024,42,14 - 20 Oct 2024,,NER,Niger,Poliomyelitis (cVDPV2),Grade 2,2020-01-01,2021-01-01,2023-10-11,34.0,34.0,0.0,"0,00%",No new case of cVDPV2 was reported during this week. The total number of cases reported in 2022 is 16. There were 18 cases reported in 2021.
OEW42-1420102024,42,14 - 20 Oct 2024,,NGA,Nigeria,Humanitarian crisis (Sahel region),Grade 2,2016-10-10,2016-10-10,2023-09-07,,,,-,"People face emergency levels of food insecurity, with very high rates of severe acute malnutrition that could lead to death in Borno, Adamawa and Yobe states. As of week 30, 2023, over 6 million people are targetted for humanitarian aid, 8.3 million people are in need of humanitarian assistance, 2.2 million IDPs, and 4.3 million people in need of food security aid."
OEW42-1420102024,42,14 - 20 Oct 2024,,,"From 1 January to 27 August 2023, a cumulative total of 2 860 suspected cholera cases and 84 deaths (CFR 2.9%) were reported from 124 Local Government Areas in 25 states. Of all suspected cases, 51% are male, and the age groups most affected are <5 years, followed by 5-14 years. The most affected states are Zamfara (787), Cross River (718), Katsina (302), Bayelsa (265) and Ebonyi (227).","From 1 January to 27 August 2023, a cumulative total of 2 860 suspected cholera cases and 84 deaths (CFR 2.9%) were reported from 124 Local Government Areas in 25 states. Of all suspected cases, 51% are male, and the age groups most affected are <5 years, followed by 5-14 years. The most affected states are Zamfara (787), Cross River (718), Katsina (302), Bayelsa (265) and Ebonyi (227).","From 1 January to 27 August 2023, a cumulative total of 2 860 suspected cholera cases and 84 deaths (CFR 2.9%) were reported from 124 Local Government Areas in 25 states. Of all suspected cases, 51% are male, and the age groups most affected are <5 years, followed by 5-14 years. The most affected states are Zamfara (787), Cross River (718), Katsina (302), Bayelsa (265) and Ebonyi (227).",,,,,,,"From 1 January to 27 August 2023, a cumulative total of 2 860 suspected cholera cases and 84 deaths (CFR 2.9%) were reported from 124 Local Government Areas in 25 states. Of all suspected cases, 51% are male, and the age groups most affected are <5 years, followed by 5-14 years. The most affected states are Zamfara (787), Cross River (718), Katsina (302), Bayelsa (265) and Ebonyi (227).",
OEW42-1420102024,42,14 - 20 Oct 2024,,NGA,Nigeria,COVID-19,Protracted 3,2020-02-27,2020-02-27,2023-08-15,,,3155.0,"1,20%","The first case of COVID-19 was first detected in Nigeria on 27 February 2020. As of 15 August 2023, a total of 266 675 confirmed cases with 259 953 recovered and 3 155 deaths have been reported."
OEW42-1420102024,42,14 - 20 Oct 2024,,NGA,Nigeria,Diphtheria,Grade 2,2022-12-01,2022-12-01,2023-07-31,,,137.0,"7,50%","Between week 19, 2022 and week 31, 2023, 4 160 suspected cases of diphtheria were reported from 27 states in Nigeria. Kano (3 233), Yobe (477), and Katsina (132) States have reported the most cases. A total of 137 deaths were recorded among confirmed cases (CFR 7.5%). Of suspected cases, 1 534 were confirmed, including 87 laboratory- confirmed, 158 epidemiologically 289 clinically compatible."
OEW42-1420102024,42,14 - 20 Oct 2024,,NGA,Nigeria,Lassa Fever,"linked, and 1 Ungraded",2023-01-08,2023-01-01,2023-09-17,7352.0,,181.0,"2,50%",
OEW42-1420102024,42,14 - 20 Oct 2024,,,of all confirmed Nigeria,cases. Mpox,Protracted 2,2022-01-31,2022-01-01,2023-07-09,843.0,843.0,9.0,"1,10%","From 1 January to 9 July 2023, Nigeria has reported 843 monkeypox confirmed cases with nine deaths (CFR 1.1%)."
OEW42-1420102024,42,14 - 20 Oct 2024,,NGA,Nigeria,Poliomyelitis (cVDPV2),Grade 2,2018-06-01,2022-01-01,2023-10-11,74.0,67.0,,-,No cVDPV2 case was reported this week. There have been 26 cVDPV2 cases reported this year and 48 cases in 2022.
OEW42-1420102024,42,14 - 20 Oct 2024,,RWA,Rwanda,COVID-19,Protracted 3,2020-03-14,2020-03-14,2023-02-26,,,1468.0,"1,10%","The Rwanda Ministry of Health announced the confirmation of the first COVD-19 case on 14 March 2020. As of 26 February 2023, a total of 133 194 cases with 1 468 deaths and 131 647 recovered cases have been reported in the country."
OEW42-1420102024,42,14 - 20 Oct 2024,,STP,Sao Tome and Principe,COVID-19,Protracted 3,2020-04-07,2020-04-06,2023-10-23,6599.0,,80.0,"1,20%","On 6 April 2020, the Ministry of Health of Sao Tome and Principe reported the country's first case of COVID-19. As of 18 October 2023, a total of 6 599 confirmed cases of COVID-19 have been reported, including 80 deaths. A total of 6 519 cases have been reported as recoveries."
OEW42-1420102024,42,14 - 20 Oct 2024,,SEN,Senegal,Chikungunya,Ungraded,2023-06-08,2023-06-08,2023-08-01,230.0,230.0,0.0,"0,00%","On 24 July 2023, the Institut Pasteur in Dakar reported an IgM-confirmed case of Chikungunya from the Sokone district. As of 1 October 2023, there were 230 confirmed cases from six regions, with Kedougou (164) and Tambacounda (60) being the most affected."
OEW42-1420102024,42,14 - 20 Oct 2024,,SEN,Senegal,COVID-19,Protracted 3,2020-03-02,2020-03-02,2023-04-28,,,1971.0,"2,20%","From 2 March 2020 to 28 April 2023, a total of 88 997 confirmed cases of COVID-19 including 1 971 deaths and 87 024 recoveries have been reported in Senegal."
OEW42-1420102024,42,14 - 20 Oct 2024,,SEN,Senegal,Crimean- Congo haemorrhagic fever (CCHF),Ungraded,2023-04-21,2023-04-21,2023-08-01,3.0,3.0,1.0,"33,30%","The Ministry of Health of Senegal reported a confirmed case of Crimean-Congo hemorrhagic fever on 21 April 2023 in a 35-year-old male, butcher. The date of onset of symptoms was 10 April. On 9 May 2023, a second confirmed case was reported followed by a third confirmed case on 10 July."
OEW42-1420102024,42,14 - 20 Oct 2024,,SEN,Senegal,Dengue,Ungraded,2022-11-14,2023-01-01,2023-10-01,55.0,55.0,0.0,"0,00%",A total of 55 dengue confirmed cases have been reported in 15 districts of Senegal from week 1 to week 39 of 2023. The majority of cases have been reported from Thilogne
OEW42-1420102024,42,14 - 20 Oct 2024,,SEN,Senegal,Measles,Ungraded,2022-07-04,2023-01-01,2023-10-01,467.0,467.0,0.0,"0,00%","From epidemic week 1 to 39 of 2023 (ending 1 October 2023), 467 confirmed cases of measles with no deaths were reported in Senegal."
