NAME,WEEK,DATE,EVENT_TYPE,ISO3,COUNTRY,EVENT_NAME,GRADE,DATE_NOTIFY,DATE_START,DATE_END,CASES_TOTAL,CASES_CONFIRMED,DEATHS,CFR,DESCRIPTION
OEW33-1218082024,33,12 - 18 Aug 2024,,ZMB,Zambia,Drought/food insecurity,Ungraded,2024-03-08,2024-01-15,2024-05-27,,,,-,"On 29 February 2024, the Zambia President declared the drought the country is currently facing a national disaster and emergency as it had devastated food production and power generation and the country struggles to recover a recent cholera outbreak. As of 27 May 2024, 84 out of the 116 districts in Zambia are affected by the drought. According to a recent rapid assessment and the President's Drought Response Appeal on 16 April 2024, nearly 6.6 million people are now in urgent need of humanitarian assistance. Moreover, the Integrated Food Security Phase Classification (IPC) report released in November 2023 projected that Zambia would have more than 2 million people at IPC Phase 3 or above by March 2024. It is also projected that the drought will lead to a power deficit and affect ground and surface water levels, with severe consequences for sectors beyond agriculture, as more than 80% of Zambia's electricity generation comes from hydropower."
OEW33-1218082024,33,12 - 18 Aug 2024,,ZMB,Zambia,Cholera,Grade 3,2023-01-24,2023-01-20,2024-08-04,23238.0,23238.0,740.0,3.2%,"The current cholera outbreak started with Lusaka Province confirming cases in cholera-prone areas (peri-urban). From October 2023 to 6 May 2024, nine provinces reported cases of cholera, and seven provinces confirmed outbreaks. From week 1 to 31, 2024, 1368 cases of cholera were confirmed."
OEW33-1218082024,33,12 - 18 Aug 2024,,ZMB,Zambia,Measles,Ungraded,2022-06-13,2022-06-13,2024-08-04,4259.0,179.0,,0.0%,"As of 4 August, 2024, Zambia recorded a cumulative total of 4 259 suspected measles cases with 179 confirmed since the start of 2024."
OEW33-1218082024,33,12 - 18 Aug 2024,,ZWE,Zimbabwe,Drought/food insecurity,Ungraded,2024-04-05,2024-04-05,2024-05-20,,,,-,"On 3 April 2024, Zimbabwe authorities declared state of disaster over a devastating drought that's sweeping across much of southern Africa due to El Nino phenomenon. it needs $ two billion for humanitarian assistance. Due to the El Niño-induced drought more than 80% of country received below normal rainfall."
OEW33-1218082024,33,12 - 18 Aug 2024,,ZWE,Zimbabwe,Anthrax,Grade 2,2023-11-13,2023-11-14,2024-05-05,784.0,,1.0,0.1%,
