NAME,WEEK,DATE,EVENT_TYPE,ISO3,COUNTRY,EVENT_NAME,GRADE,DATE_NOTIFY,DATE_START,DATE_END,CASES_TOTAL,CASES_CONFIRMED,DEATHS,CFR,DESCRIPTION
OEW33-1218082024,33,12 - 18 Aug 2024,,UGA,Uganda,Landslides,Ungraded,2024-08-16,2024-08-20,2024-08-23,328.0,328.0,35.0,10.7%,"The previously reported landslide at the Kiteezi landfill in Kampala, Uganda, triggered by torrential rain, was confirmed by WCO. There have been 35 reported deaths, with 33 identified and two still unclaimed. Rescue efforts continue as 28 people remain missing, and 328 individuals have been displaced across 5 Local Government Areas. The displaced population includes 120 adult females, 62 adult males, and 146 minors. Homes, shops, and public facilities were buried under garbage due to the heavy rainfall."
OEW33-1218082024,33,12 - 18 Aug 2024,,AGO,Angola,Poliomyelitis (cVDPV2),Grade 2,2024-05-15,2024-05-15,2024-07-07,13.0,13.0,,0.0%,"On 3 May, 2024, Angolan health authorities announced the detection of polio in Chitato Municipality, Lunda Norte province, which borders the Democratic Republic of Congo. Currently a total of 10 laboratory confirmed poliovirus were notified in the provinces of Luanda, Huambo, Lunda Norte and Moxico. Of these, four were detected in children under five and six in the environment.."
OEW33-1218082024,33,12 - 18 Aug 2024,,BEN,Benin,Measles,Ungraded,2024-07-03,2024-01-01,2024-06-23,728.0,321.0,,0.0%,"A measles outbreak has been ongoing in Benin, from week 1 through week 25, 2024 (ending 23 June), with a total of 728 suspected cases of measles, including 288 confirmed IgM+ cases, 33 clinically compatible cases are reported with the incidence rate of 24.9 per 1 million population"
OEW33-1218082024,33,12 - 18 Aug 2024,,BFA,Burkina Faso,Humanitarian crisis (Sahel Region),Protracted 2,2019-01-01,2019-01-01,2024-04-18,5500000.0,5500000.0,,-,"Since 2015, the security situation in the Sahel and Eastern Burkina Faso has gradually deteriorated due to attacks by armed groups. Access to healthcare services remains major challenge for the affected population. As of February 2024, 5.5 million people needed humanitarian assistance, 3.2 million of which are children and over 2.1 million IDPs registered, and 5 478 schools closed."
OEW33-1218082024,33,12 - 18 Aug 2024,,BFA,Burkina Faso,Hepatitis E,Ungraded,2024-06-06,2024-01-04,2024-06-01,93.0,8.0,3.0,3.2%,"From 4 January to 1 June 2024, a total of 93 suspected cases of hepatitis E were reported from Kaya health district of the North central region. Eight out of 63 samples tested positive for hepatitis E by PCR. The median age of the cases is 22 and women represent 47.4% of the cases. Fourty-six (48.5%) of the 93 suspected cases are internally displaced persons."
OEW33-1218082024,33,12 - 18 Aug 2024,,BFA,Burkina Faso,Measles,Ungraded,2024-02-06,2024-01-14,2024-05-28,9904.0,484.0,46.0,0.5%,"Burkina Faso is experiencing a decrease in measles cases. Between week 1 and week 21 of 2024, a total of 9 904 suspected measles cases, resulting in 46 deaths, were recorded. This downward trend is observed in all nine health districts that conducted the anticipated reactive campaign. Currently only four health districts have active outbreaks of measles."
OEW33-1218082024,33,12 - 18 Aug 2024,,BDI,Burundi,Flood,Grade 2,2024-01-01,2023-09-01,2024-06-03,,,,,"Since the beginning of the rainy season in September 2023, Burundi has been affected by heavy rains, floods and landslides, exacerbated by the El niño phenomenon. The most affected health districts are located in the western part of the country, including Cibitoke, Bubanza, Rumonge, Makamba and Bujumbura."
OEW33-1218082024,33,12 - 18 Aug 2024,,BDI,Burundi,Cholera,Grade 3,2023-01-01,2022-12-14,2024-06-01,189.0,,11.0,0.6%,"Burundi faces cholera outbreaks almost every year in some areas. The ongoing cholera outbreak was officially declared on 1 January 2023. As of 1 June 2024, a total of 1 890 cases, 11 deaths (CFR 0.6%), have been reported since the start of the outbreak."
OEW33-1218082024,33,12 - 18 Aug 2024,,BDI,Burundi,Measles,Ungraded,2024-02-15,2023-01-01,2024-02-12,167.0,167.0,22.0,1.3%,"On 14 February 2024, Burundi's Ministry of Health reported a measles outbreak, with 20 of the country's 49 health districts experiencing active outbreaks. These districts were identified as having unvaccinated children in the 2022 National Vaccination Coverage Survey. In 2023, there were 1 670 confirmed cases resulting in 22 deaths, representing a case fatality rate of 1.3%. Among the confirmed cases, 55% were aged 6-59 months, and 82% were under 15 years old. From 1 January to 12 February 2024, 34 deaths were reported in five health districts."
OEW33-1218082024,33,12 - 18 Aug 2024,,BDI,Burundi,Mpox,Grade 3,2024-07-25,2024-07-25,2024-07-25,3.0,3.0,,0.0%,"On 25 July 2024, the Ministry of Health of Burundi declared an outbreak of Mpox following confirmation of three cases by the National Reference Laboratory. These cases were identified on 22 July at Kamenge University Hospital, Kamenge Military Hospital, and Isare Health District. They presented with symptoms including fever, joint pain, and a widespread rash. Samples collected during a multidisciplinary investigation tested positive for mpox on 25 July."
OEW33-1218082024,33,12 - 18 Aug 2024,,CMR,Cameroon,Humanitarian crisis (Noth- West & South- West ),Protracted 2,2016-10-01,2018-06-27,2024-05-07,3400000.0,,,-,"In the North-West and South-West regions, the unstable security situation and persistent violence are exacerbating humanitarian needs. Affected people continue to flee their homes to neighbouring villages and communities. By May 2024, the following observations were made: 3.4M people in need, 2.3M people targeted, 1M IDPs, 658k Returnees and 489K Refugees and Asylum Seekers."
OEW33-1218082024,33,12 - 18 Aug 2024,,CMR,Cameroon,Humanitarian crisis (Sahel Region),Protracted 2,2013-12-31,2017-06-27,2024-02-13,,,,-,"The Far North region of Cameroon is still facing humanitarian crisis. The region bordering Nigeria and Chad and Lake Chad remains the most affected. Between August and September 2023, nearly 6 000 newly displaced people were registered in Mokolo district following repeated attacks by non-state armed groups. More than 2 200 new asylum seekers/refugees were registered for the same period at Gourenguel transit site, in Mokolo district of Mayo-Tsanaga department."
OEW33-1218082024,33,12 - 18 Aug 2024,,,"From Week 1 to Week 13 (ending 31 March 2024), 645 suspected measles cases, including 104 deaths (CFR 16%), were reported in Cameroon. A cumulative total of 232 cases were confirmed, including 129 IgM positive, 88 epidemiologically linked, and 15 clinically compatible. In 2023, 6 088 confirmed measles cases and at least 75 related deaths were reported in Cameroon..Cameroon","From Week 1 to Week 13 (ending 31 March 2024), 645 suspected measles cases, including 104 deaths (CFR 16%), were reported in Cameroon. A cumulative total of 232 cases were confirmed, including 129 IgM positive, 88 epidemiologically linked, and 15 clinically compatible. In 2023, 6 088 confirmed measles cases and at least 75 related deaths were reported in Cameroon..Mpox","From Week 1 to Week 13 (ending 31 March 2024), 645 suspected measles cases, including 104 deaths (CFR 16%), were reported in Cameroon. A cumulative total of 232 cases were confirmed, including 129 IgM positive, 88 epidemiologically linked, and 15 clinically compatible. In 2023, 6 088 confirmed measles cases and at least 75 related deaths were reported in Cameroon..Grade 3",,,,,,,"From Week 1 to Week 13 (ending 31 March 2024), 645 suspected measles cases, including 104 deaths (CFR 16%), were reported in Cameroon. A cumulative total of 232 cases were confirmed, including 129 IgM positive, 88 epidemiologically linked, and 15 clinically compatible. In 2023, 6 088 confirmed measles cases and at least 75 related deaths were reported in Cameroon..6.7%","From 1 January to 4 April 2024, 15 suspected cases of Mpox including 2 laboratory-confirmed and 1 death have been reported. From 1 January to 28 December 2023, 113"
OEW33-1218082024,33,12 - 18 Aug 2024,,,suspected cases Cameroon,"of Mpox, including Yellow Fever",27 Ungraded,,,,,,,country. 0.0%,"From week 1 to week 28 of 2024, Cameroon reported 11 plaque reduction neutralization test (PRNT) positive yellow fever cases across seven regions. Among these PRNT positive cases, five have been classified as confirmed cases in four regions: Adamawa, Centre, Littoral, and Nord Regions. Additionally, 11 cases are currently awaiting PRNT"
OEW33-1218082024,33,12 - 18 Aug 2024,,,Cape Verde,Dengue,Grade 3,2023-11-06,2023-11-06,2024-03-24,992.0,543.0,,0.0%,"On 6 November 2023, the Ministry of Health Surveillance Service reported two confirmed cases of Dengue through Polymerase Chain Reaction testing and one borderline case in Praia City, Santiago Island, Cabo Verde. The same day three more suspected cases were reported from the Central Hospital. As of 11 March 2024, a total of 992 suspected cases, including 543 confirmed cases and no deaths, were reported."
OEW33-1218082024,33,12 - 18 Aug 2024,,CAF,Central African Republic,Humanitarian crisis,Protracted 2,2013-12-11,2013-12-11,2024-06-05,6100000.0,,,-,"The Central African Republic has been facing a humanitarian crisis for more than a decade following military-political conflicts. Of the country's 6.1 million inhabitants, 2.8 million will need humanitarian assistance in 2024. More than 522 000 people are currently internally displaced, 2.5 million suffer from food insecurity, and 756 000 are CAR refugees."
OEW33-1218082024,33,12 - 18 Aug 2024,,CAF,Central African Republic,Impact of Sudan crisis in CAR,Grade 3,2023-05-01,2023-05-01,2024-07-31,,,,,"CAR is the least affected among the four AFRO countries regarding the ongoing Sudan conflict As of 06 May 2024, there were 71, 000 forcibly displaced people from Sudan who arrived in CAR since 15 April 2023. Out of this number, 6 158 are returnees and 23 286 Sudanese refugees\asylum seekers."
OEW33-1218082024,33,12 - 18 Aug 2024,,CAF,Central African Republic,Hepatitis E,Ungraded,2024-06-13,2024-04-14,2024-07-06,49.0,6.0,3.0,12.2%,"As of July 6, 2024, 49 suspected cases were recorded including six confirmed cases and three deaths (CFR 6.0%). Of nine samples analyzed at the viral hepatitis laboratory of the Pasteur Institute in Bangui, six were positive for acute hepatitis E virus infection. Seven (7) new samples are being analyzed at the Pasteur Institute in Bangui."
OEW33-1218082024,33,12 - 18 Aug 2024,,CAF,Central African Republic,Measles,Ungraded,2022-03-13,2023-01-01,2024-08-26,802.0,,1.0,0.1%,"At the end of epi-week 24, 2024, the country recorded 802 suspected cases and one death. Since the start of 2024 in January to June 23, CAR has been responding to measles outbreak."
OEW33-1218082024,33,12 - 18 Aug 2024,,CAF,Central African Republic,Meningitis,Ungraded,2024-03-27,2024-03-22,2024-04-26,64.0,5.0,10.0,15.6%,"On 22 March 2024, health authorities declared a meningitis outbreak in Batangafo-Kabo district. From week 7 to week 16 (ending 21 April 2024), a total of 64 suspected meningitis cases including 10 deaths (CFR: 16%) were reported from three communes of Batangafo-Kabo health district, namely Kabo, Sido and Ouaki communes. A total of 52 cerebrospinal fluid samples were collected from the suspected cases and analyzed at Institut Pasteur of Bangui. Bacterial pathogens were identified in 5 (9.6%) samples by PCR test. Neisseria meningitidis serotype W135 and Streptococcus pneumoniae were identified in 3 and 2 samples respectively."
OEW33-1218082024,33,12 - 18 Aug 2024,,CAF,Central African Republic,Mpox,Grade 3,2022-03-03,2022-03-04,2024-08-26,66.0,66.0,1.0,1.5%,"In the Central African Republic (CAR), there were 19 reported laboratory-confirmed cases of mpox from January to April 2024. However, no deaths were recorded. Since 2022, CAR has reported 66 laboratory-confirmed cases and 1 death (CFR = 1.5%)."
OEW33-1218082024,33,12 - 18 Aug 2024,,CAF,Central African Republic,Poliomyelitis (cVDPV2),Grade 2,2019-05-24,2019-05-24,2024-07-31,45.0,45.0,,0.0%,"A total of 14 cases were reported in the country in 2023, including six in 2022. There were no new cases reported in the country as of week 29 of 2024 The number of confirmed cases reported in 2023 was revised to 14 and last date of detection is 07 October 2023."
OEW33-1218082024,33,12 - 18 Aug 2024,,CAF,Central African Republic,Yellow Fever,Ungraded,2023-06-12,2023-01-01,2024-04-21,11.0,5.0,,0.0%,"Chad has recorded one new probable yellow fever case, which tested positive using the plaque reduction neutralization test (PRNT) in week 15, in the Vakaga health district, bringing the total number of probable cases in 2024 to six. Other probable cases for the year have been reported in the Mbaïki and Kémo health districts. In 2023, five confirmed cases of yellow fever were recorded for the following districts: Sangha-Mbaéré (1), Berbérati (1), Bambari (2), and Bossembélé (1). The number of confirmed cases this year has been reviewed."
OEW33-1218082024,33,12 - 18 Aug 2024,,TCD,Chad,Humanitarian crisis (Sahel region),Protracted 2,2022-02-11,2016-03-01,2024-06-16,2100000.0,,,-,"As of June 2024, Eastern Chad has received over 608 715 Sudanese refugees, of which 58.0% are women and 21.0% are children under five years. The crisis has resulted in 7 187 injuries and 350 deaths. Over 2.1 million people are affected, including both refugees and host populations, and 1 213 515 individuals are in urgent need of humanitarian assistance."
OEW33-1218082024,33,12 - 18 Aug 2024,,TCD,Chad,Impact of Sudan crisis in Chad,Grade 3,2023-04-15,2023-04-15,2024-05-10,,,,-,"Chad is the AFRO country most affected by the armed conflict in Sudan, hosting about 1 million refugees. These Sudanese refugees are mainly hosted in the refugee's camps across Ennedi Est, Wadi Fira, Ouaddai and Sila provinces. From 15 April 2023 to 3 May 2024, about 588 825 Sudanese refugees have been listed including 96 181 that have crossed the border since January 2024. Most new arrivals are women and children (88%), and 14% are persons with special needs,.Chad"
OEW33-1218082024,33,12 - 18 Aug 2024,,,"From 2 January to 28 April 2024, a total of 2 092 suspected cases including 7 deaths (CFR 0.3%) were reported from two health districts of the Ouaddaï province (Adré and Hadjer-Hadid). Thirty-six (36) cases were laboratory-confirmed by RT-PCR at Institut Pasteur of Dakar between 1 and 19 March 2024. The most affected age groups are 6-17 years (1 113 cases) and 18-59 years (500 cases), representing 53.2% and 23.9% of the suspected cases, respectively. Males (1 160 cases; 55.4%) are the most affected.","From 2 January to 28 April 2024, a total of 2 092 suspected cases including 7 deaths (CFR 0.3%) were reported from two health districts of the Ouaddaï province (Adré and Hadjer-Hadid). Thirty-six (36) cases were laboratory-confirmed by RT-PCR at Institut Pasteur of Dakar between 1 and 19 March 2024. The most affected age groups are 6-17 years (1 113 cases) and 18-59 years (500 cases), representing 53.2% and 23.9% of the suspected cases, respectively. Males (1 160 cases; 55.4%) are the most affected.","From 2 January to 28 April 2024, a total of 2 092 suspected cases including 7 deaths (CFR 0.3%) were reported from two health districts of the Ouaddaï province (Adré and Hadjer-Hadid). Thirty-six (36) cases were laboratory-confirmed by RT-PCR at Institut Pasteur of Dakar between 1 and 19 March 2024. The most affected age groups are 6-17 years (1 113 cases) and 18-59 years (500 cases), representing 53.2% and 23.9% of the suspected cases, respectively. Males (1 160 cases; 55.4%) are the most affected.",,,,,,,"From 2 January to 28 April 2024, a total of 2 092 suspected cases including 7 deaths (CFR 0.3%) were reported from two health districts of the Ouaddaï province (Adré and Hadjer-Hadid). Thirty-six (36) cases were laboratory-confirmed by RT-PCR at Institut Pasteur of Dakar between 1 and 19 March 2024. The most affected age groups are 6-17 years (1 113 cases) and 18-59 years (500 cases), representing 53.2% and 23.9% of the suspected cases, respectively. Males (1 160 cases; 55.4%) are the most affected.",
OEW33-1218082024,33,12 - 18 Aug 2024,,TCD,Chad,Measles,Ungraded,2018-05-24,2024-01-01,2024-05-05,5631.0,,20.0,0.4%,"From 1 January to 5 May 2024, 5 631 suspected measles cases, including 20 deaths, were recorded in the health districts of Moissala, Guelo, Dono Manga, Kouloudia, Arada, N'Djamena Centre, N'Djamena East, Gagal, Gore, N'Djamena North, Amtiman, Pala, Kouno, Massakory, and Koukou Angarana. Between Week 1 and Week 18 of 2024,"
OEW33-1218082024,33,12 - 18 Aug 2024,,TCD,Chad,Poliomyelitis (cVDPV2),Grade 2,2019-10-18,2019-09-09,2024-07-31,204.0,204.0,,0.0%,"In 2023 there were a total of 55 cVDPV2 cases reported. In week 30 of 2024, there were 5 reported cases in Chad. 44 cVDPV2 cases were reported in 2022, 106 cVDPV2 cases were reported in 2020 from three different outbreaks, and nine others were reported in 2019. The last date of detection was 13 May 2024."
OEW33-1218082024,33,12 - 18 Aug 2024,,COM,Comoros,Cholera,Grade 3,2024-02-02,2024-02-02,2024-06-25,10142.0,,147.0,1.4%,"The cholera outbreak has been ongoing in Comoros since the first case was reported on 2 February 2024. As of 30 June 2024, a cumulative total of 10 142 cases had been reported, with the majority of cases reported from Ndzuwani (8 942 cases), followed by Ngazidja (625 cases) and Mwali (575 cases); 147 deaths (CFR 1.4%) were also reported."
OEW33-1218082024,33,12 - 18 Aug 2024,,COG,Congo,Measles,Ungraded,2024-05-15,2024-04-02,2024-07-24,42.0,42.0,,0.0%,"Since the beginning of 2024, there has been an ongoing measles outbreak in Congo affecting three districts: Etoumbi (25 confirmed cases), Poto-poto (five confirmed cases), and Impfondo (12 confirmed cases). As of 24 July 2024, there is only one confirmed measles case in Pointe Noire in Congo."
OEW33-1218082024,33,12 - 18 Aug 2024,,COG,Congo,Mpox,Grade 3,2022-05-23,2024-01-01,2024-04-23,60.0,19.0,,0.0%,"From 9 January to 23 April 2024, a total of 60 suspected cases were reported from nine health districts in five departments: Cuvette, Likouala, Plateaux , Pointe-Noire and Brazzaville. From 22 August to 27 November 2023, 60 suspected cases, including 21 confirmed and 5 deaths (CFR 8.3%), were reported from four health districts in three departments: Brazzaville, Cuvette and Likouala."
OEW33-1218082024,33,12 - 18 Aug 2024,,COG,Congo,Poliomyelitis (cVDPV1),Grade 2,2023-03-21,2023-03-01,2024-07-31,1.0,1.0,,-,"No Circulating vaccine-derived poliovirus type 1 (cVDPV1) cases were reported this week. As of 31 Juky 2024, only one case was reported. The last update of detedction was on 15 October 2022."
OEW33-1218082024,33,12 - 18 Aug 2024,,CIV,Côte d'Ivoire,Dengue,Grade 3,2023-07-10,2023-06-19,2024-05-11,405.0,332.0,2.0,0.0%,"An outbreak of Dengue fever is ongoing in Ivory Coast. A total of 4 050 cases have been reported from 1 January 2023 to 11 May 2024, with 325 confirmed cases and 2"
OEW33-1218082024,33,12 - 18 Aug 2024,,CIV,Côte d'Ivoire,Measles,Ungraded,2024-07-03,2024-01-01,2024-06-23,5617.0,4758.0,,0.0%,
OEW33-1218082024,33,12 - 18 Aug 2024,,,The measles including 678,outbreak has been confirmed IgM+,ongoing in Cote cases and 4 080,,,,,,,"reported, 4.0%","Côte d'Ivoire Mpox Grade 3 5-Jul-24 5-Jul-24 36 1 A case of Mpox was confirmed on 4 July 2024 in Côte d'Ivoire, in the San Pedro region (Tabou). The patient is a male in his 40s. As of 18 August, Cote d'Ivoire has reported"
OEW33-1218082024,33,12 - 18 Aug 2024,,,"confirmed cases, including one death (CFR: 4%)","confirmed cases, including one death (CFR: 4%)","confirmed cases, including one death (CFR: 4%)",,,,,,,"confirmed cases, including one death (CFR: 4%)","Heavy rainfall between January and April triggered significant flooding Kivu and Tanganyika provinces, placing approximately 471 000 people at risk of increased humanitarian needs. The floods inundated around 1.1 million acres of land, including nearly 52,000 acres of cropland, in areas surrounding Lake Tanganyika and upstream from the Congo River basin. The ongoing El Niño season expected to bring heavy rainfall, particularly to the central and northern regions, with forecasts indicating that the water level in Lake Tanganyika will continue rise, peaking late June."
OEW33-1218082024,33,12 - 18 Aug 2024,,,Democratic Republic of the Congo,Humanitarian crisis,Grade 3,2016-12-20,2017-04-17,2024-05-11,7100000.0,,,-,"The humanitarian crisis in the Democratic Republic of Congo has affected about six provinces, namely, North Kivu, South Kivu, Ituri, Tshopo and Tanganyika provinces. Currently, 7 100 000 people have been displaced since its onset. There are currently 522 410 new refugees. There have been various levels of security threats, widespread instability, and gang violence. At present, there are multiple outbreaks like, cholera, measles and Mpox."
OEW33-1218082024,33,12 - 18 Aug 2024,,,Democratic Republic of the Congo,Cholera,Grade 3,2015-01-16,2024-01-01,2024-04-14,1336.0,1571.0,217.0,1.6%,"From week 1 to week 15, 2024 (week ending 14 April), 13 360 suspected cholera cases, including 217 deaths (CFR 1.6%), were reported from 13/26 provinces. North Kivu, Haut Katanga, South Kivu, and Haut Lomami are the most affected provinces, accounting for 58.5% (n=7 815), 17.1% (n=2 287), 10.2% (n=1 365), and 9.2% (n=1 230) of cases respectively. The majority of deaths (59%) have been reported from the Haut Katanga province. In 2023, more than 62 000 cases and more than 700 deaths were reported."
OEW33-1218082024,33,12 - 18 Aug 2024,,,Democratic Republic of the Congo,Measles,Ungraded,2021-10-12,2024-01-01,2024-03-17,30144.0,1178.0,791.0,2.6%,"In 2023, a total of 311 500 suspected measles cases and 5 799 deaths were reported. This year, from week 1 through week 11 (ending 17 March), a total of 30 144 cases, 1"
OEW33-1218082024,33,12 - 18 Aug 2024,,,Democratic Republic of the Congo,Mpox,Grade 3,2019-03-30,2024-01-01,2024-04-21,5768.0,632.0,332.0,5.8%,178 confirmed and 791 deaths have been reported so far; 18 out of 26 provinces have reported confirmed measles outbreaks since the beginning of this year.
OEW33-1218082024,33,12 - 18 Aug 2024,,,,Poliomyelitis (cVDPV1),Grade 2,2022-08-27,2023-01-01,2024-05-15,107.0,107.0,,0.0%,"As per the Global Polio Eradication Initiative (GPEI), no cVDPV1 case was reported this week. There is one case reported this year and 106 cases in 2023."
OEW33-1218082024,33,12 - 18 Aug 2024,,,Democratic Republic of the Congo,Poliomyelitis (cVDPV2),Grade 2,2021-02-26,2023-01-01,2024-05-15,118.0,118.0,,0.0%,"As per the Global Polio Eradication Initiative (GPEI), no cVDPV2 cases were reported this week. The number of 2023 cases remains 118."
OEW33-1218082024,33,12 - 18 Aug 2024,,ETH,Ethiopia,Flood,Grade 2,2024-05-15,2024-05-01,2024-07-10,,,,,"Heavy rains in April and early May caused flooding in several districts across the country, particularly in Afar, Amhara, Central Ethiopia, Oromia, Sidama, Somali, South Ethiopia, and Tigray regions. More than 590 000 people are reportedly affected and some 95 000 displaced, based on preliminary reports. The rains and the unusually heavy wind accompanying the rainy season this year have led to significant damage to houses, public infrastructure, and croplands. This has further limited the population's access to services and deepened vulnerabilities, particularly in areas already affected by conflict and violence, prolonged drought, as well as pre-existing poor road infrastructure."
OEW33-1218082024,33,12 - 18 Aug 2024,,ETH,Ethiopia,Food insecurity (Horn of Africa crisis),Grade 3,2022-02-17,2022-01-01,2024-07-10,,,,-,"According to the Famine Early Warning Network (FEWNET), Crisis (IPC Phase 3) and Stressed (IPC Phase 2) outcomes are ongoing and expected to persist through September in many areas of northern Ethiopia and parts of the pastoral south and southeast, where humanitarian food assistance is significant and likely preventing worse outcomes. The food security situation is expected to deteriorate further, with more than 10 million people anticipated to be critically food insecure during the main lean season (July-September)"
OEW33-1218082024,33,12 - 18 Aug 2024,,ETH,Ethiopia,Humanitarian crisis (Northern Ethiopia),Grade 3,2020-11-04,2020-11-04,2024-07-04,,,,-,"In Ethiopia, it is reported that an estimated 4.5 million people are currently displaced in both rural and urban locations, mainly in Somali, Oromia and Tigray regions. The majority of the displacements are due to conflict, which peaked in 2021. About 56% of IDPs have been displaced for more than one year, 23% for two to four years and 1 % for five or more years. The country continues to face a major humanitarian crisis caused by climate shocks, disease outbreaks and insecurity aggravated by economic and financial challenges. This makes 2024 an exceptional year in terms of compounded shocks, exacerbating negative humanitarian impacts on already vulnerable communities who have not fully recovered from events of recent years"
OEW33-1218082024,33,12 - 18 Aug 2024,,ETH,Ethiopia,Impact of Sudan crisis in Ethiopia,Grade 3,2023-05-01,2023-05-01,2024-07-10,,,,,"Following the outbreak of armed conflict in Sudan on 15 April 2023, Ethiopia is receiving thousands of forcibly displaced people at two main points of entry (Metema and Kurmuk) along the land border between Sudan and Ethiopia. As of 30 June 2024, a total of 56 486 individuals in need of international protection crossed the border from Sudan to Ethiopia including 46 427 Sudanese and Non-Sudanese refugees/asylum seekers and 10 059 Ethiopian refugee returnees."
