NAME,WEEK,DATE,EVENT_TYPE,ISO3,COUNTRY,EVENT_NAME,GRADE,DATE_NOTIFY,DATE_START,DATE_END,CASES_TOTAL,CASES_CONFIRMED,DEATHS,CFR,DESCRIPTION
OEW33-1218082024,33,12 - 18 Aug 2024,,ETH,Ethiopia,Landslides,Ungraded,2024-07-23,2024-07-23,2024-07-24,15515.0,,257.0,,"At least 257 people have reportedly died, and about 15 515 have been affected by a landslide incident on 21 and 22 July 2024, following heavy rains in a mountainous area in two kebeles of Geza Gofa Woreda in Gofa Zone, South Ethiopia Region. The death toll is expected to rise to up to 500 people ."
OEW33-1218082024,33,12 - 18 Aug 2024,,ETH,Ethiopia,Cholera,Grade 3,2022-09-17,2022-08-01,2024-07-14,51068.0,,624.0,1.2%,"The ongoing cholera outbreak in Ethiopia started on 27 August 2022. As of 14 July 2024, a total of 51 068 cases, 624 deaths (CFR 1.2%) are reported. In 2024, from January"
OEW33-1218082024,33,12 - 18 Aug 2024,,,a total of 19 832 cases and 149 deaths are reported,a total of 19 832 cases and 149 deaths are reported,a total of 19 832 cases and 149 deaths are reported,,,,,,,a total of 19 832 cases and 149 deaths are reported,
OEW33-1218082024,33,12 - 18 Aug 2024,,ETH,Ethiopia,Dengue,Grade 3,2023-05-16,2023-05-10,2024-07-02,,28197.0,21.0,0.0%,"The dengue outbreak that started in April 2023 in two districts (Logia and Mille) is still ongoing. As of 2 total of 28 197 cases with 21 deaths are reported. In 2024, 2 539 cases and zero death are reported."
OEW33-1218082024,33,12 - 18 Aug 2024,,ETH,Ethiopia,Malaria,Ungraded,2024-06-20,2024-01-01,2024-07-15,3289475.0,,695.0,0.0%,"In 2024, from 1 January to 15 July, a total of 3 289 475 malaria cases and 695 deaths were reported nationwide in Ethiopia. In Epidemiological Week 27, there were 266"
OEW33-1218082024,33,12 - 18 Aug 2024,,,"047 malaria cases and 74 deaths recorded. Most malaria cases, over 79%, were reported from four regions: Oromia (40%), Amhara, (20%), Southwest Ethiopia (SWEPRS) (13%) and South Ethiopia Region (SER) (8%).","047 malaria cases and 74 deaths recorded. Most malaria cases, over 79%, were reported from four regions: Oromia (40%), Amhara, (20%), Southwest Ethiopia (SWEPRS) (13%) and South Ethiopia Region (SER) (8%).","047 malaria cases and 74 deaths recorded. Most malaria cases, over 79%, were reported from four regions: Oromia (40%), Amhara, (20%), Southwest Ethiopia (SWEPRS) (13%) and South Ethiopia Region (SER) (8%).",,,,,,,"047 malaria cases and 74 deaths recorded. Most malaria cases, over 79%, were reported from four regions: Oromia (40%), Amhara, (20%), Southwest Ethiopia (SWEPRS) (13%) and South Ethiopia Region (SER) (8%).",
OEW33-1218082024,33,12 - 18 Aug 2024,,ETH,Ethiopia,Measles,Ungraded,2017-04-13,2024-01-01,2024-07-28,25407.0,25407.0,,-,"Measles outbreak is still ongoing in Ethiopia. In 2024, from week 1 through week 30 (ending 28 July) a total of 25 407 confirmed cases were reported. The Incidence Rate at"
OEW33-1218082024,33,12 - 18 Aug 2024,,,national level is 230 cases per 1 million population in 2024 as of week 30 (while 42 cases per 1million in 2023). The number of deaths reported so far is under verification,national level is 230 cases per 1 million population in 2024 as of week 30 (while 42 cases per 1million in 2023). The number of deaths reported so far is under verification,national level is 230 cases per 1 million population in 2024 as of week 30 (while 42 cases per 1million in 2023). The number of deaths reported so far is under verification,,,,,,,national level is 230 cases per 1 million population in 2024 as of week 30 (while 42 cases per 1million in 2023). The number of deaths reported so far is under verification,
OEW33-1218082024,33,12 - 18 Aug 2024,,GAB,Gabon,Diphtheria,Ungraded,2024-01-23,2023-12-01,2024-03-19,28.0,2.0,3.0,10.7%,"On 23 January 2024, Cameroon reported a confirmed case of Diphtheria. The affected individual is a 9-year-old male from Bitam Health District in Gabon. The onset of symptoms occurred on 1 December 2023, and he sought medical consultation on 3 December 2023 in the Enongal health area, Ebolowa health district in Cameroon. The"
OEW33-1218082024,33,12 - 18 Aug 2024,,,"person died on 7 December 2023. The sample tested positive for Diphtheria on 23 January 2024. As of 19 March 2024, a total of 28 suspected cases, including 2 laboratory","person died on 7 December 2023. The sample tested positive for Diphtheria on 23 January 2024. As of 19 March 2024, a total of 28 suspected cases, including 2 laboratory","person died on 7 December 2023. The sample tested positive for Diphtheria on 23 January 2024. As of 19 March 2024, a total of 28 suspected cases, including 2 laboratory",,,,,,,"person died on 7 December 2023. The sample tested positive for Diphtheria on 23 January 2024. As of 19 March 2024, a total of 28 suspected cases, including 2 laboratory","Ghana Dengue Grade 3 14-Jul-24 20-Jul-24 70 70 0% On 14 July, the Ministry of Health of Ghana notified WHO of the confirmation of nine cases of Dengue in three districts of the Eastern Region. As of 20 July, 574 suspected"
OEW33-1218082024,33,12 - 18 Aug 2024,,,"confirmed cases, 8 clinically compatible cases and three deaths (CFR: 10%) were notified.","confirmed cases, 8 clinically compatible cases and three deaths (CFR: 10%) were notified.","confirmed cases, 8 clinically compatible cases and three deaths (CFR: 10%) were notified.",,,,,,,"confirmed cases, 8 clinically compatible cases and three deaths (CFR: 10%) were notified.",
OEW33-1218082024,33,12 - 18 Aug 2024,,,cases including 70 confirmed cases of Dengue have been reported from seven districts. Ghana,Measles,Ungraded,2024-04-01,2024-01-01,2024-04-19,183.0,350.0,,0.0%,
OEW33-1218082024,33,12 - 18 Aug 2024,,GIN,Guinea,Dengue,Grade 3,2024-07-15,2024-07-08,2024-07-20,12.0,3.0,1.0,0.9%,There was one new confirmed case reported on 11 July 2024 giving a cumulative of 12 dengue cases (three confirmed) and one death reported in 2014.
OEW33-1218082024,33,12 - 18 Aug 2024,,GIN,Guinea,Diphtheria,Grade 2,2023-08-21,2023-07-04,2024-04-09,4517.0,4307.0,105.0,2.3%,"An outbreak of diphtheria has been reported in the Kankan region of Guinea since 4 July 2023. As of 9 April 2024, 4 517 suspected cases were reported from the Kankan, Faranah, Labé, Mamou, Conakry and N'Nzérékoré regions, including 4 307 confirmed cases and 105 deaths. Of the confirmed cases, 29 were laboratory-confirmed, 4 173 were clinically compatible and 105 were epidemiologically linked. The Siguiri health district in the Kankan region is the epicenter of the outbreak, with 98.4% of suspected"
OEW33-1218082024,33,12 - 18 Aug 2024,,GIN,Guinea,Measles,Ungraded,2024-07-03,2024-01-01,2024-06-23,1076.0,247.0,7.0,0.7%,"Measles outbreak in ongoing in Guinea, from week 1 through week 25, 2024 (ending 23 June), a total of 1 076 suspected measles cases were recorded including 247 confirmed cases. Seven deaths recorded in the regions of Conakry (1), Kindia (1) and N' Zérékoré (5) . The incidence rate per 1 million population is 31.1"
OEW33-1218082024,33,12 - 18 Aug 2024,,KEN,Kenya,Food insecurity (Horn of Africa crisis),Grade 3,2022-02-17,2022-01-01,2024-05-10,,,,-,"The key drivers of food insecurity in Kenya are high prices of staple foods, the impacts of El Niño and floods - resulting in the loss of livestock, damage to infrastructure, property, and farmland, - as well as localized resource-based and human-wildlife conflicts. During the projection period (April to June 2024), the forecasted MAM (March, April, and May) rains are expected to further improve the seasonal performance and thus improve the food security situation. Approximately, 1.2 million people (7 %of the population analyzed) are classified in IPC Phase 3 or above, including about 26 000 people classified in Phase 4 and 1.2 million in Phase 3."
OEW33-1218082024,33,12 - 18 Aug 2024,,KEN,Kenya,Cholera,Grade 3,2022-10-19,2022-10-05,2024-06-23,12624.0,,208.0,1.6%,"This is the second wave since the beginning of 2024 - where there have been 392 cumulative cases and 3 deahs in 2024. Overall since the start of the outbreak, there have been 12,624 cases and 208 deaths with a CFR of 1.6%. The outbreak is affecting three counties: Tana River (60), Lamu (18) and Siaya (1). A total of 79 cases with one (1) death have been reported. Eight (8) cases have been confirmed by culture, and 76 RDT positive. Tana River County attack rate is 18.0 per 100,000, and the Garsen sub- county attack rate is 40.7 per 100,000."
OEW33-1218082024,33,12 - 18 Aug 2024,,KEN,Kenya,Hepatitis A,Ungraded,2024-07-23,2024-01-01,2024-07-23,19.0,19.0,3.0,15.8%,"Since January 2024, confirmed cases of hepatitis A through PCR (polymerase chain reaction) are reported from Uasin Gishu county. As of 23 July 2024, a total of 19 cases with three deaths (CFR 15.8%) are reported. The cases were reported from five sub counties: Kapsaret, Kesses, Moiben, Soy and Turbo. Among the 19 total cases reported,"
OEW33-1218082024,33,12 - 18 Aug 2024,,KEN,Kenya,Measles,Ungraded,2022-06-29,2023-01-01,2024-06-13,1543.0,199.0,11.0,0.7%,"The measles outbreak has been continuous since January 2023. Nine counties are actively reporting measles cases; Garissa, Kilifi, Mombasa, Turkana, Samburu, Wajir, Meru, Kwale, and Mandera, since early 2024. A total of 1 543 cases with 11 deaths (CFR 0.8%) have been reported."
OEW33-1218082024,33,12 - 18 Aug 2024,,KEN,Kenya,Mpox,Grade 3,2024-08-03,,2024-08-03,1.0,1.0,,0.0%,"Kenya has confirmed one mpox case in a 42-year-old truck driver from Taveta County, detected on 22 July 2024. The patient, showing symptoms since 9 July 2024, had traveled through Uganda and Kenya. Initially tested negative, mpox was later confirmed. The patient was treated and released, and on 3 August 2024, was en route to Rwanda via Tanzania. Contact tracing is ongoing. The Ministry of Health has issued advisories and is actively managing the situation."
OEW33-1218082024,33,12 - 18 Aug 2024,,KEN,Kenya,Poliomyelitis (cVDPV2),Grade 2,2023-07-06,2023-05-26,2024-05-29,8.0,8.0,,0.0%,"According to Global Polio Eradication Initiative, no cVDPV2 cases were reported this week. There have been eight cases reported in 2023."
OEW33-1218082024,33,12 - 18 Aug 2024,,KEN,Kenya,Visceral Leishmania,Ungraded,2024-08-01,2024-01-01,2024-07-30,54.0,,4.0,7.4%,"Since January 2024, Visceral Leishmaniasis cases have been reported in Kitui and Mandera Counties. As of 30 July 2024, 54 cases with four deaths (CFR 7.4%) have been The cases from the following countries: Mandera 48 cases and Kitui six cases. Males account for 82% of all positive cases"
OEW33-1218082024,33,12 - 18 Aug 2024,,,reported. Lesotho,are reported Drought/food insecurity,Ungraded,2024-07-22,2024-07-12,2024-07-12,,,,,"On 12 July 2024, following the extreme El Niño induced drought conditions, Health authorities declared a National Food Insecurity Disaster. The total food insecure population for the consumption year 2024/2025 is estimated at 699 049, compared to 581 730 in 2023/2024, reflecting a 20% increase and a further deterioration of food security. The entire projected to be at Crisis level (IPC Phase 3) for the period, necessitating urgent action to save lives and protect livelihoods."
OEW33-1218082024,33,12 - 18 Aug 2024,,LBR,Liberia,country is Lassa Fever,Ungraded,2022-03-03,2022-01-06,2024-06-05,479.0,151.0,45.0,9.4%,"From 6 January 2022, to 30 May 2024, a cumulative total of 466 cases of Lassa Fever have been reported with 151 confirmed and 45 deaths (CFR 39%)."
OEW33-1218082024,33,12 - 18 Aug 2024,,LBR,Liberia,Measles,Ungraded,2022-02-03,2021-12-13,2024-06-02,13711.0,13056.0,95.0,0.7%,"Since the measles outbreak started on 13 December 2021, there have been 13 711 suspected cases, 13056 confirmed cases, and 95 deaths with CFR 0.7%, as of June 2, 2024. The highest affected is Montserrado with 5373 confirmed cases"
OEW33-1218082024,33,12 - 18 Aug 2024,,MDG,Madagascar,Cyclone Gamane\Flood,Grade 2,2024-02-26,2024-02-05,2024-05-19,95391.0,,19.0,0.0%,"Since weeks 6 and 7, 2024 heavy rainfall has triggered flooding in the central and northeastern parts of Madagascar. This has resulted in population displacements and the loss of homes and infrastructure, including roads, bridges, agriculture, health facilities, water, sanitation, and hygiene infrastructure. Seven regions have been affected."
OEW33-1218082024,33,12 - 18 Aug 2024,,,"The humanitarian situation in the Grand Sud remained fragile and is expected to deteriorate further, thus reversing the marginal gains made in 2023. Malnutrition rates are","The humanitarian situation in the Grand Sud remained fragile and is expected to deteriorate further, thus reversing the marginal gains made in 2023. Malnutrition rates are","The humanitarian situation in the Grand Sud remained fragile and is expected to deteriorate further, thus reversing the marginal gains made in 2023. Malnutrition rates are",,,,,,,"The humanitarian situation in the Grand Sud remained fragile and is expected to deteriorate further, thus reversing the marginal gains made in 2023. Malnutrition rates are",expected to reach IPC Phase 4 (Emergency) in Ikongo and Varika during the lean season. 196 500 children under five may suffer from acute malnutrition from October
OEW33-1218082024,33,12 - 18 Aug 2024,,,2023 to April Madagascar,2024. Two districts Malaria,will reach a critical Ungraded,,,,,,,April 2024. 0.0%,"Madagascar has been experiencing a malaria outbreak since last year and the same trend continues in 2024. From week 1 to week 19, 2024, a total of 1 531 902 cases and"
OEW33-1218082024,33,12 - 18 Aug 2024,,,Malawi Drought Ungraded 26-Mar-24 28-Mar-24 28-Mar-24 - - - -,Malawi Drought Ungraded 26-Mar-24 28-Mar-24 28-Mar-24 - - - -,Malawi Drought Ungraded 26-Mar-24 28-Mar-24 28-Mar-24 - - - -,,,,,,,Malawi Drought Ungraded 26-Mar-24 28-Mar-24 28-Mar-24 - - - -,
OEW33-1218082024,33,12 - 18 Aug 2024,,,212 deaths are reported.,212 deaths are reported.,212 deaths are reported.,,,,,,,212 deaths are reported.,
OEW33-1218082024,33,12 - 18 Aug 2024,,MLI,Mali,Floods,Ungraded,2024-08-21,2024-08-23,2024-08-23,39768.0,39768.0,22.0,0.1%,"Since the beginning of July 2024, Mali has faced severe flooding across several regions, causing significant human and material losses. By August 18, 2024, over 39 768 people were affected, including 16 639 children, 10 695 women, and 12 434 men. The floods resulted in 22 deaths and 104 injuries. Additionally, eight healthcare facilities were damaged. The crisis has exacerbated public health issues, particularly with contaminated water sources, increasing the risk of cholera and other waterborne diseases. Urgent needs include healthcare, shelter, and access to clean water."
OEW33-1218082024,33,12 - 18 Aug 2024,,MLI,Mali,Humanitarian crisis (Sahel region),Protracted 2,2017-09-11,2017-09-11,2024-03-24,7500000.0,7500000.0,,0.0%,"Mali is facing prolonged conflict, poverty, climate shocks, and growing insecurity. However, the current Humanitarian Response Plan for Mali needs to be more funded, with only 11% of the required funding secured for the 4.1M(million) people targeted. There has been a significant increase in IDPs in the regions of Kidal (32.8%) and Ménaka (20%). As of March 2024, over 7.1M people require humanitarian assistance."
OEW33-1218082024,33,12 - 18 Aug 2024,,MLI,Mali,Dengue,Grade 3,2023-09-12,2024-01-01,2024-05-26,4605.0,614.0,4.0,0.1%,"From 1 January to 26 May 2024, Mali reported 4 605 suspected cases of dengue including 614 confirmed cases and four deaths."
OEW33-1218082024,33,12 - 18 Aug 2024,,MLI,Mali,Measles,Ungraded,2018-02-20,2024-01-01,2024-05-26,493.0,277.0,,0.0%,"Between 1 January and 26 May 2024, 493 suspected cases of measles were reported, with 277 confirmed cases. During the same period in 2023, there were 288 confirmed cases, representing a 4% decrease in 2024 compared to the previous year."
OEW33-1218082024,33,12 - 18 Aug 2024,,MRT,Mauritania,Influx of refugees from Mali (Sahel region),Protracted 2,2024-03-11,2024-03-14,2024-03-19,180.0,,,-%,"The humanitarian situation in the Hodh Chargui region (HEC) of Mauritania is becoming critical with the massive arrival of thousands of Malian refugees fleeing insecurity and violence. It is estimated that over 180 000 refugees and returnees are registered or awaiting registration in the Bassiknou district. According to UNHCR data, over 40% are outside the formal camp system, many with livestock, putting pressure on natural resources (such as water and grazing land) and basic social services. Both displaced populations and host communities require protection, shelter, clean water, hygiene and sanitation facilities, as well as healthcare for their well-being."
OEW33-1218082024,33,12 - 18 Aug 2024,,MRT,Mauritania,Measles,Ungraded,2023-03-07,2024-01-01,2024-05-12,2384.0,280.0,4.0,0.2%,"Between 1 January and 12 May 2024, Mauritania reported 2 384 suspected measles cases across 49 districts, with 280 confirmed cases -81 through epidemiological links and 199 via laboratory tests. In response, a vaccination campaign is scheduled from 28 May to 6 June 2024, targeting 1 943 636 children aged nine months to 14 years. This campaign will also incorporate the administration of vitamin A and mebendazole."
OEW33-1218082024,33,12 - 18 Aug 2024,,MUS,Mauritius,Dengue,Grade 3,2023-12-17,2023-12-17,2024-06-23,9088.0,9088.0,29.0,0.3%,"The index for the ongoing dengue outbreak in Mauritius was reported on 11 December 2023, as of 23 June 2024, a total of 9 088 cases and 29 deaths (CFR 0.3%) have been reported."
OEW33-1218082024,33,12 - 18 Aug 2024,,MUS,Mauritius,Leptospirosis,Ungraded,2024-05-10,2024-01-01,2024-06-26,55.0,55.0,9.0,16.4%,"On 4 May 2024, the Ministry of Health and wellness of Mauritius notified the public of a rising incidence of leptospirosis cases in Mauritius with a total of 20 cases reported since the beginning of 2024. As of 26 June 2024, a total of 55 cases and nine deaths are reported"
OEW33-1218082024,33,12 - 18 Aug 2024,,MOZ,Mozambique,Humanitarian crisis in Cabo Delgado,Protracted 2,2020-01-01,2023-10-12,2024-05-15,2000000.0,2000000.0,,-,"From 22 December 2022, 112 894 people have been displaced in Cabo Delgado due to NSAGs' attacks, including 91 239 farmers who abandoned their lands during harvest season. Children, women, and men comprise 62%, 23%, and 15% of the displaced. Food aid reached over 64,000 individuals, and 24,000 received shelter. By 5 March 2024, 154 children were missing, and 182 were unaccompanied. As of 15 May 2024, eight out of eleven provinces and at least 22 districts have reported cholera cases, with a cumulative total of 15,386 cases. The highest number of cases were reported from the provinces of Nampula, Tete, Cabo Delgado, and Zambezia. Additionally, there was a conjunctivitis outbreak affecting 1,225 people, with schools disrupted."
OEW33-1218082024,33,12 - 18 Aug 2024,,MOZ,Mozambique,Cholera,Grade 3,2024-04-18,2023-10-12,2024-06-23,48181.0,48181.0,174.0,0.0%,"The current cholera outbreak in the country began in Niassa province on 14 September 2022. As of 23 June 2024, there have been 8,024 cumulative cases in 2024 alone, including 18 deaths (CFR 0.2%). Epi week 25 saw a 33% decrease in cases and 0 deaths, with 3 out of 11 provinces (Maputo, Nampula, Sofala) reporting active outbreaks in the past month. However, all 3 of these provinces are experiencing downward trends in recent weeks."
OEW33-1218082024,33,12 - 18 Aug 2024,,,"Drought Ungraded 31-May-24 22-May-24 22-May-24 On 22 May 224, the Government of Namibia declared a State of Emergency following the worst drought the country has experienced in 100 years. One in five Namibians is considered food insecure, with over 331 000 households already enrolled in the government-funded drought relief program to support affected communities. This situation, driven by the El Niño-induced drought and concurrent floods in Southern Africa, despite current efforts, necessitates more focused attention and proactive measures from","Drought Ungraded 31-May-24 22-May-24 22-May-24 On 22 May 224, the Government of Namibia declared a State of Emergency following the worst drought the country has experienced in 100 years. One in five Namibians is considered food insecure, with over 331 000 households already enrolled in the government-funded drought relief program to support affected communities. This situation, driven by the El Niño-induced drought and concurrent floods in Southern Africa, despite current efforts, necessitates more focused attention and proactive measures from","Drought Ungraded 31-May-24 22-May-24 22-May-24 On 22 May 224, the Government of Namibia declared a State of Emergency following the worst drought the country has experienced in 100 years. One in five Namibians is considered food insecure, with over 331 000 households already enrolled in the government-funded drought relief program to support affected communities. This situation, driven by the El Niño-induced drought and concurrent floods in Southern Africa, despite current efforts, necessitates more focused attention and proactive measures from",,,,,,,"Drought Ungraded 31-May-24 22-May-24 22-May-24 On 22 May 224, the Government of Namibia declared a State of Emergency following the worst drought the country has experienced in 100 years. One in five Namibians is considered food insecure, with over 331 000 households already enrolled in the government-funded drought relief program to support affected communities. This situation, driven by the El Niño-induced drought and concurrent floods in Southern Africa, despite current efforts, necessitates more focused attention and proactive measures from",
OEW33-1218082024,33,12 - 18 Aug 2024,,,governments and partners.,governments and partners.,governments and partners.,,,,,,,governments and partners.,"The Ministry of Health and Social Services (MoHSS) has reported a confirmed outbreak of Measles in Omaruru health district of Erongo Region,. Between 1 January and 5 June 2024, 39 suspected cases, including confirmed cases, have been reported from the same health facility. All six confirmed cases have been reported among learners"
OEW33-1218082024,33,12 - 18 Aug 2024,,NER,Niger,Floods,Ungraded,2024-06-12,2024-06-10,2024-06-13,3825.0,,18.0,,"As of 10 June 2024, the heavy rains that have hit Niger since the beginning of the season (in May) across the entire national territory have resulted in the following: Four out of the eight regions in the country are affected, encompassing 18 departments, with the Maradi region being the most affected. A total of 499 households are affected, comprising 3,825 displaced persons. There have been 18 deaths, including 11 due to house collapses (a total of 329 households have collapsed). and 23 injuries have been recorded, including 12 in Maradi (52.2%)."
OEW33-1218082024,33,12 - 18 Aug 2024,,NER,Niger,Humanitarian crisis (Sahel region),Protracted 2,2015-02-01,2015-02-01,2024-04-18,4300000.0,4300000.0,,0.0%,
OEW33-1218082024,33,12 - 18 Aug 2024,,,0,1,2,,,,6.0,7.0,8.0,9,"Niger is contending with a severe humanitarian crisis due to regional instability in the Tillaberi, Maradi, Diffa, and Tahoua regions. The instability stems from conflicts spilling over from Mali, Burkina Faso, and Nigeria, compounded by the country's internal political turmoil following a military coup on 28 July 2023 -the third such coup in the Sahel in under three years. International sanctions, environmental challenges, deep-seated poverty, and frail social support have further strained the relief efforts. Despite these adversities, there has been a slight decrease in refugee and asylum seeker figures, although new arrivals from Chad, Mali, Burkina Faso, and Nigeria persist post-21 March 2024. Concurrently, Niger has seen the internally displaced population escalate dramatically, from 1.9 million in 2017 to 4.3 million individuals, which is 15% of the population in 2024, significantly amplifying the demand for humanitarian aid. Acute food insecurity currently afflicts 3.3 million residents, with an alarming 7.3 million more at risk of deteriorating conditions amid the ongoing turmoil."
OEW33-1218082024,33,12 - 18 Aug 2024,,NER,Niger,Diphtheria,Ungraded,2023-08-28,2023-07-04,2024-06-19,5367.0,4656.0,320.0,6.0%,"An outbreak of diphtheria has been confirmed in Matameye health district, Zinder region. The first case was reported on 17 July 2023. As of week number 24 of 2024, 5367 suspected cases, including 320 deaths (CFR 6 %) were reported. Public health response activities are ongoing in affected districts."
OEW33-1218082024,33,12 - 18 Aug 2024,,NER,Niger,Measles,Ungraded,2022-04-05,2024-01-01,2024-08-10,4439.0,604.0,20.0,0.5%,"As of epidemiological week 32, a total of 4429 suspected cases of measles were reported, including 604 confirmed cases and 20 deaths (case fatality rate: 0.5%), across 65"
OEW33-1218082024,33,12 - 18 Aug 2024,,NER,Niger,Meningitis,Ungraded,2022-12-07,2024-01-01,2008-12-11,3268.0,13.0,256.0,7.8%,"Niger continues to notify meningitis cases. From epidemiological week 1 to week 28, 2024 , a total of 3 268 suspected cases including 1300 confirmed cases and 256 deaths (CFR 7.3%) were notified in eight regions, namely Agadez, Diffa, Dosso, Maradi, Niamey, Tahoua, Tilaberi and Zinder. Agadez and Niamey regions are the most affected."
