NAME,WEEK,DATE,EVENT_TYPE,ISO3,COUNTRY,EVENT_NAME,GRADE,DATE_NOTIFY,DATE_START,DATE_END,CASES_TOTAL,CASES_CONFIRMED,DEATHS,CFR,DESCRIPTION
OEW33-1218082024,33,12 - 18 Aug 2024,,NER,Niger,Suspected heavy metal poisoning,Ungraded,2024-06-12,2024-05-27,2024-06-12,14.0,,176.0,,"A mysterious illness has been reported in Niger as of 27 May 2024 , cases present with symptoms like ascites, abdominal pain, weight loss, and vomiting. The index case began experiencing symptoms on 15 May . The patient's family of six has also been affected. All are suspected to have contracted the illness from an unknown source, potentially linked to drinking water from boreholes. Cases have been reported in four regions: Tahoua (2), Dosso (5), Maradi (6), and Tillaberry (1). No laboratory results are available. A multidisciplinary team has been deployed. Samples have been sent to CERMES, with results pending. Insecurity and population mobility are hindering the response. A lack of laboratory facilities for heavy metal testing is also a challenge."
OEW33-1218082024,33,12 - 18 Aug 2024,,NGA,Nigeria,Floods,Ungraded,2024-08-19,2024-08-20,2024-08-22,1951.0,1951.0,7.0,0.4%,"Jigawa State has been heavily affected by flooding since Week 29 of 2024, impacting 14 Local Government Areas(LGAs), 45 wards, and 139 settlements. So far, 3 843 houses have been damaged, and there are 31 IDP camps across 5 LGAs, with 1 951 displaced individuals. 7 fatalities have been reported, and farmlands, highways, and some health facilities have been submerged. Immediate needs include healthcare, food, shelter, and logistical support, while an Incident Action Plan (IAP) is in place with support from WHO and key stakeholders."
OEW33-1218082024,33,12 - 18 Aug 2024,,,,people of the,,2016-10-10,2024-01-01,2024-08-11,5951.0,8300000.0,176.0,0.0%,"People face emergency levels of food insecurity, with very high rates of severe acute malnutrition that could lead to death in Borno, Adamawa and Yobe states. As of week 11, 2024, over 6 million are targeted for humanitarian aid, 8.3 million people need humanitarian assistance, 2.2 million IDPs, and 4.3 million people need food security aid. Due to the fluidity situation, the numbers are constantly changing."
OEW33-1218082024,33,12 - 18 Aug 2024,,,"From 1 January to 11 August 2024, there were 5 951 suspected cholera cases reported in Nigeria, including 176 deaths (CFR: 3%). Reports came from 36 states.","From 1 January to 11 August 2024, there were 5 951 suspected cholera cases reported in Nigeria, including 176 deaths (CFR: 3%). Reports came from 36 states.","From 1 January to 11 August 2024, there were 5 951 suspected cholera cases reported in Nigeria, including 176 deaths (CFR: 3%). Reports came from 36 states.",,,,,,,"From 1 January to 11 August 2024, there were 5 951 suspected cholera cases reported in Nigeria, including 176 deaths (CFR: 3%). Reports came from 36 states.",
OEW33-1218082024,33,12 - 18 Aug 2024,,NGA,Nigeria,Dengue,Grade 3 Ungraded,,,2024-03-24,72.0,14.0,,0.0%,"Nigeria is responding to Dengue outbreak that started As of 3 March 2024, there has been 72 suspected cases reported with 14 confirmed and zero deaths since 19 December 2023."
OEW33-1218082024,33,12 - 18 Aug 2024,,NGA,Nigeria,Lassa Fever of,the,2023-01-08,,,6597.0,1009.0,171.0,16.9%,"In week 29, the number new confirmed cases was 11. Cumulatively from week 1 to 29, 2024, 163 deaths have been reported with a case fatality rate (CFR) of 17.1% which is marginally higher than the CFR for same period in 2023 (16.9%). for 2024, have recorded at least one confirmed case across 125 Local Government Areas"
OEW33-1218082024,33,12 - 18 Aug 2024,,NGA,Nigeria,Measles,Ungraded,2024-04-01,2024-01-01,2024-05-12,8935.0,4633.0,,0.0%,"Between 1 January and 12 May 2024, in Nigeria, 8 935 suspected measles cases were reported, with 1 141 confirmed cases, 3 373 confirmed through epidemiological link, and 119 classified as compatible. Additionally, there were 280 IgM positive rubella cases. The measles incidence rate is 18.4 per 1 000 000 population. Notably, 302 out of 774 districts (39%) have reached the epidemic threshold, indicating a significant outbreak."
OEW33-1218082024,33,12 - 18 Aug 2024,,NGA,Nigeria,Meningitis,Ungraded,2024-01-29,2023-10-08,2024-06-29,2669.0,135.0,240.0,9.0%,"1 October 2023 and 29 June 2024, a total of 2 669 suspected cases including 1135 confirmed cases and 240 deaths (CFR: 9 %) were reported from 22 out of 33 states."
OEW33-1218082024,33,12 - 18 Aug 2024,,NGA,Nigeria,Mpox,Grade 3,2022-01-31,2022-01-01,2024-08-10,3771.0,1086.0,17.0,,
OEW33-1218082024,33,12 - 18 Aug 2024,,,Between,Between,Between,,,,,,,Between,
OEW33-1218082024,33,12 - 18 Aug 2024,,NGA,Nigeria,Poliomyelitis (cVDPV2),Grade 2,2018-06-01,2022-01-01,2024-03-20,139.0,139.0,,0.5% -,"No cVDPV2 case was reported this week. There were four cases reported in 2024, 87 cVDPV2 cases reported in 2023 and 48 cases in 2022."
OEW33-1218082024,33,12 - 18 Aug 2024,,,"Nigeria Uknown 20-Mar-24 7 3.6% On 20 March 2024, NCDC notified of the outbreak of an unknown illness through IDSR by the Sokoto State Ministry of Health. The iIndex case presented is a 6-year-old girl from Isa LGA, who presented with symptoms including abdominal pain and distension, and vomiting on 6 February 2024. Cumulatively, from weeks 6 to week 15, a total of 196 cases with 7 deaths (CFR 3.6%) were reported. 70% are aged 0 - 10 years, followed by 11 - 20 years (20%), >30 years (6%), and 21 - 30 years (4%). 55.1% of the","Nigeria Uknown 20-Mar-24 7 3.6% On 20 March 2024, NCDC notified of the outbreak of an unknown illness through IDSR by the Sokoto State Ministry of Health. The iIndex case presented is a 6-year-old girl from Isa LGA, who presented with symptoms including abdominal pain and distension, and vomiting on 6 February 2024. Cumulatively, from weeks 6 to week 15, a total of 196 cases with 7 deaths (CFR 3.6%) were reported. 70% are aged 0 - 10 years, followed by 11 - 20 years (20%), >30 years (6%), and 21 - 30 years (4%). 55.1% of the","Nigeria Uknown 20-Mar-24 7 3.6% On 20 March 2024, NCDC notified of the outbreak of an unknown illness through IDSR by the Sokoto State Ministry of Health. The iIndex case presented is a 6-year-old girl from Isa LGA, who presented with symptoms including abdominal pain and distension, and vomiting on 6 February 2024. Cumulatively, from weeks 6 to week 15, a total of 196 cases with 7 deaths (CFR 3.6%) were reported. 70% are aged 0 - 10 years, followed by 11 - 20 years (20%), >30 years (6%), and 21 - 30 years (4%). 55.1% of the",,,,,,,"Nigeria Uknown 20-Mar-24 7 3.6% On 20 March 2024, NCDC notified of the outbreak of an unknown illness through IDSR by the Sokoto State Ministry of Health. The iIndex case presented is a 6-year-old girl from Isa LGA, who presented with symptoms including abdominal pain and distension, and vomiting on 6 February 2024. Cumulatively, from weeks 6 to week 15, a total of 196 cases with 7 deaths (CFR 3.6%) were reported. 70% are aged 0 - 10 years, followed by 11 - 20 years (20%), >30 years (6%), and 21 - 30 years (4%). 55.1% of the","cases are female. Cases initially reported from Isa LGA, Sokoto State, with reports extending to Sabon Birni LGA (7 cases) in Sokoto State Rwanda Malaria Ungraded 1-Jul-24 26-May-24 7-Jul-24 - - - -"
OEW33-1218082024,33,12 - 18 Aug 2024,,,"From the epi week 21 to 25, 2024, malaria cases increased compared to the previous weeks of 2023, while the results of the analysis revealed that from week 26 to 27,2024 the cases declined and did not surpass the epidemic thresholds","From the epi week 21 to 25, 2024, malaria cases increased compared to the previous weeks of 2023, while the results of the analysis revealed that from week 26 to 27,2024 the cases declined and did not surpass the epidemic thresholds","From the epi week 21 to 25, 2024, malaria cases increased compared to the previous weeks of 2023, while the results of the analysis revealed that from week 26 to 27,2024 the cases declined and did not surpass the epidemic thresholds",,,,,,,"From the epi week 21 to 25, 2024, malaria cases increased compared to the previous weeks of 2023, while the results of the analysis revealed that from week 26 to 27,2024 the cases declined and did not surpass the epidemic thresholds",
OEW33-1218082024,33,12 - 18 Aug 2024,,RWA,Rwanda,MPox,Grade 3,2024-07-24,2024-07-24,2024-07-24,2.0,2.0,,0.0%,"On 24 July 2024, MOH confirmed two cases of mpox using PCR. Both have a history of travel to DRC. The cases include a 33-year-old female trader who was identified at POE and is currently isolated in Rusizi district and a 34-year-old male who is currently isolated in Kibagaba Hospital, Gasabo district. A total of 11 contacts are being followed.Senegal"
OEW33-1218082024,33,12 - 18 Aug 2024,,,"Between 1 January and 26 May 2024, Senegal reported seven new Chikungunya cases. The cases ranged from eight to 30 years old, with a median age of 21 years. Matam had the highest number of cases with three, followed by Tambacounda with two, and Dakar and Kolda each with one. The last reported case had an onset of symptoms on 26 April 2024.","Between 1 January and 26 May 2024, Senegal reported seven new Chikungunya cases. The cases ranged from eight to 30 years old, with a median age of 21 years. Matam had the highest number of cases with three, followed by Tambacounda with two, and Dakar and Kolda each with one. The last reported case had an onset of symptoms on 26 April 2024.","Between 1 January and 26 May 2024, Senegal reported seven new Chikungunya cases. The cases ranged from eight to 30 years old, with a median age of 21 years. Matam had the highest number of cases with three, followed by Tambacounda with two, and Dakar and Kolda each with one. The last reported case had an onset of symptoms on 26 April 2024.",,,,,,,"Between 1 January and 26 May 2024, Senegal reported seven new Chikungunya cases. The cases ranged from eight to 30 years old, with a median age of 21 years. Matam had the highest number of cases with three, followed by Tambacounda with two, and Dakar and Kolda each with one. The last reported case had an onset of symptoms on 26 April 2024.",
OEW33-1218082024,33,12 - 18 Aug 2024,,SEN,Senegal,COVID-19,Ungraded,2024-06-24,2024-06-24,,124.0,78.0,,0.0%,"Of the 124 RDTs carried out on returning pilgrims carried out upon arrival to the airport, 78 cases were detected positive for SARS-CoV-2, including 36 cases confirmed by PCR."
OEW33-1218082024,33,12 - 18 Aug 2024,,SEN,Senegal,Crimean- Congo haemorrhagic fever (CCHF),Ungraded,2024-03-26,2024-03-22,2024-04-26,3.0,3.0,,0.0%,"On 22 March 2024, the Institut Pasteur in Dakar (IPD) confirmed a case of Crimean-Congo Haemorrhagic fever (CCHF) in a 25-year-old male farmer. The patient, originally from the Guinguinéo district, probably contracted the disease while working in the Ndoffane district. Investigations are ongoing in all the areas visited by the patient. So far 11 samples collected from contacts at the Dakar hospital have tested negative. On 26 April 2024, WHO was informed of the confirmation of two additional CCHF cases in a 40-year-old male and a 25-year-old male from Pikine and Yeumbeul districts of Dakar respectively. Blood samples collected from the two male cases on 17 and 19 April 2024 respectively returned positive for CCHF on PCR on 25 April 2024. PCR testing returned negative for yellow fever, dengue, RVF, west nile, chikungunya, and zika. Both cases are alive. In-depth investigations are ongoing."
OEW33-1218082024,33,12 - 18 Aug 2024,,SEN,Senegal,Dengue,Grade 3,2022-11-14,2023-01-31,2024-05-12,23.0,23.0,,0.0%,"As of 12 May 2024, Senegal has reported a total of 23 confirmed dengue cases. The cases, ranging in age from 15 to 62 years with a median age of 32 years, include nine females and 14 males. The majority of cases have been reported in the Dakar region (15 cases, 65%), followed by Louga (4 cases, 17%), Saint-Louis (2 cases, 9%), Matam (1 case, 4%), and Thies (1 case, 4%). The first case was recorded on 1 January 2024, in Guediawaye, and the most recent case was on 4 March 2024, in Dakar-Ouest."
OEW33-1218082024,33,12 - 18 Aug 2024,,SEN,Senegal,Measles,Ungraded,2022-07-04,2024-01-01,2024-05-26,252.0,252.0,,0.0%,"Between 1 January and 26 May 2024, Senegal reported 252 confirmed measles cases, with the highest numbers in Louga (56), Matam (41), and Kaffrine (33). The cases were evenly split between females (125) and males (127), ranging from 0.4 to 42 years old, with a median age of 6 years. Most cases (70%) were among children aged nine months to five years. Among these cases, 69% were unvaccinated. Twenty-three districts have reached the epidemic threshold in 2024, with the onset of symptoms of the last case on 29 April 2024 in Saint Louis."
OEW33-1218082024,33,12 - 18 Aug 2024,,ZAF,South Africa,Flood,Ungraded,2024-06-04,2024-06-10,2024-06-11,,,22.0,-,"From 1 to 3 June 2024, heavy rainfall, strong winds, and snowfall affected the Eastern Cape and KwaZulu-Natal provinces, causing floods and resulting in significant material damage and fatalities. As of 6 June, 22 people have died, including 11 in the Eastern Cape province and 11 in Durban city in KwaZulu-Natal province. Additionally, 55 people have been injured, 120 people have been displaced to three temporary shelters, and more than 2,000 people have been evacuated in Nelson Mandela Bay Municipality."
OEW33-1218082024,33,12 - 18 Aug 2024,,ZAF,South Africa,Cholera,Grade 3,2024-01-20,2024-01-20,2024-06-10,155.0,12.0,,0.0%,"The cholera outbreak has been ongoing in South Africa since December 4, 2023. It started with imported cases linked to ongoing outbreaks in Southern Africa and two locally transmitted cases from Limpopo in January. As of 17 May 2024, 12 confirmed cases with no deaths have been reported. Limpopo province is most affected with 10 of"
OEW33-1218082024,33,12 - 18 Aug 2024,,ZAF,South Africa,Mpox,Grade 3,2024-05-15,2024-05-15,2024-07-19,22.0,22.0,3.0,13.6%,"Through IHR notification from South Africa, WHO received a report of one laboratory confirmed mpox case from Johannesburg. This case was confirmed after initial testing by Lancet Laboratory on 9 May 2024. As of 2 July 2024, 22 (10 from KwaZulu Natal; 11 from Gauteng; and 1 from Western Cape Province) mpox cases have been reported in South Africa, with three deaths."
OEW33-1218082024,33,12 - 18 Aug 2024,,SSD,South Sudan,Food insecurity (Horn of Africa crisis),Grade 3,2020-12-18,2021-04-05,2024-07-10,,,,-,"For 2024, it is estimated that millions of people will still be unable to meet minimum food needs as food stocks could be depleted by April 2024. Additionally, ongoing sporadic conflicts and the influx of returnees and refugees from Sudan is likely to strain food supplies and incomes further, driving severe malnutrition."
OEW33-1218082024,33,12 - 18 Aug 2024,,SSD,South Sudan,Humanitarian crisis,Protracted 3,2016-08-15,2016-08-15,2024-07-10,9000000.0,,,-,"The humanitarian situation in South Sudan remains concerning with increasing needs and the number of people requiring assistance. This year, it is estimated that nine million people need humanitarian assistance including 6.3 million for health needs and two million people are internally displaced persons. In 2024, the humanitarian response plan needs US $ 1.8 billion to reach six million of the most vulnerable people, however, as of 10 June 2024, only 18% of the needed funding has been covered"
OEW33-1218082024,33,12 - 18 Aug 2024,,SSD,South Sudan,Impact of Sudan crisis in South Sudan,Grade 3,2023-04-15,2023-05-01,2024-07-10,,,,,"Regarding the impact of the ongoing Sudan conflict crisis, as of 30 June, more than 720 000 people crossed into South Sudan from Sudan due to the conflict, with over 560 000 being South Sudanese. the country is now leading in number of people received fleeing conflict in Sudan compared to other Sudan's neighbouring countries"
OEW33-1218082024,33,12 - 18 Aug 2024,,,"South Sudan Anthrax 2 1-Jan-24 111 2.7% From January 2024 through 14 July 2024, cumulatively, a total of 111 human anthrax cases including three deaths (CFR 2.7%) have been reported in South Sudan. Most of","South Sudan Anthrax 2 1-Jan-24 111 2.7% From January 2024 through 14 July 2024, cumulatively, a total of 111 human anthrax cases including three deaths (CFR 2.7%) have been reported in South Sudan. Most of","South Sudan Anthrax 2 1-Jan-24 111 2.7% From January 2024 through 14 July 2024, cumulatively, a total of 111 human anthrax cases including three deaths (CFR 2.7%) have been reported in South Sudan. Most of",,,,,,,"South Sudan Anthrax 2 1-Jan-24 111 2.7% From January 2024 through 14 July 2024, cumulatively, a total of 111 human anthrax cases including three deaths (CFR 2.7%) have been reported in South Sudan. Most of","the reported cases, 71 (64.0%), were from the Jur River Western Bar El Gazal State and cases (34.3%) reported from West in Warrap State"
OEW33-1218082024,33,12 - 18 Aug 2024,,SSD,South Sudan,Hepatitis E,Ungraded,2018-01-03,2019-01-01,2024-06-16,6807.0,,69.0,1.0%,"The ongoing Hepatitis E outbreak is active in Rubkona county (Bentiu IDPs camp), Unity State since December 2018, in Fangak county, Jonglei State since 2023 and in Western Bahr EL-Ghazal State since February 2023 (week 8). As of week 24, 2024, in Fangak county 655 cases, with 23 reported deaths since the outbreak began in week 2 of 2023; in Rubkona county ( (Bentiu IDPs camp) , since the outbreak began in 2018, 5 619 cases and 27 deaths have been reported; in Western Bahr EL-Ghazal State, a total of 501 cases were reported, with 19 deaths. In Twic county, Warrap State, In March, an outbreak of Hepatitis E was officially declared by the State Ministry of Health, . from"
OEW33-1218082024,33,12 - 18 Aug 2024,,,"week 6 to week 22 of 2024, a total of 32 suspected cases were reported, with no fatalities.","week 6 to week 22 of 2024, a total of 32 suspected cases were reported, with no fatalities.","week 6 to week 22 of 2024, a total of 32 suspected cases were reported, with no fatalities.",,,,,,,"week 6 to week 22 of 2024, a total of 32 suspected cases were reported, with no fatalities.",
OEW33-1218082024,33,12 - 18 Aug 2024,,SSD,South Sudan,Poliomyelitis (cVDPV2),Grade 2,2024-02-26,2023-01-01,2024-07-31,9.0,9.0,,0.0%,"According to the Global Polio Eradication Initiative (GPEI), no cVDPV2 case was reported this week . There are six cases reported this year and three cases reported last year."
OEW33-1218082024,33,12 - 18 Aug 2024,,SSD,South Sudan,Yellow fever,Ungraded,2023-12-24,2023-12-24,2024-07-07,139.0,3.0,6.0,4.3%,"The National Ministry of Health of the Republic of South Sudan officially declared a Yellow Fever outbreak on the 24 December 2023, following confirmation of one suspected case notified to Ministry of health on 21 December 2023. As of 7 July 2024, a total of 139 suspected cases have been reported including six deaths. Male account for 71 (51%) of the total cases reported"
OEW33-1218082024,33,12 - 18 Aug 2024,,TZA,"Tanzania, United Republic of",Flood,Grade 2,2024-04-24,2024-04-24,2024-07-10,,,,,"In 2024, the rains which started in November 2023 have continued, expanding from four to eight regions: Morogoro, Mbeya, Kilimanjaro, Unguja, Geita, Dar es Salaam, Manyara, and Pwani. The floods have caused further destruction of homes, crops, and agricultural assets. Since January a total of 155 deaths and 236 injured and affected 200 000 people and 51000 households have been reported. In addition, Cyclone Hidaya made landfall on Saturday 4 May, bringing strong winds and heavy rains to the coast south of Dar es Salaam. Pwani, Morogoro, Lindi and Mtwara experienced heavy rainfall, with some areas receiving more than 140% of their average monthly rainfall."
OEW33-1218082024,33,12 - 18 Aug 2024,,TZA,"Tanzania, United Republic of",Cholera,Grade 3,2023-10-03,2023-09-05,2024-07-13,4306.0,,81.0,1.9%,"Since 5 September 2023 cholera outbreaks have been reported in 22 regions (Mara, Arusha, Kilimanjaro, Kigoma, Kagera, Singida, Simiyu, Shinyanga, Tabora, Ruvuma, Mwanza, Geita, Rukwa, Dodoma, Manyara, Morogoro, Katavi, Pwani, Mtwara, Tanga, Lindi and Dar es Salaam) in Tanzania Mainland, where a total of 4 306 cases and 81 deaths (CFR 1.9%) reported. Out of 22 regions, Cholera outbreak was declared over in 15 regions (Mtwara, Katavi, Arusha, Kilimanjaro, Morogoro, Pwani, Geita, Mwanza, Simiyu, Kagera, Ruvuma, Tanga, Rukwa, Dar es Salaam and Tabora)."
OEW33-1218082024,33,12 - 18 Aug 2024,,,"A 22-year-old young man, who was diagnosed on July 30, 2024, was successfully treated in a health facility, according to a press release published today. The Minister of Health and Public Hygiene alerts and recalls the preventive measures in the Vo health district, located in the Maritime Region","A 22-year-old young man, who was diagnosed on July 30, 2024, was successfully treated in a health facility, according to a press release published today. The Minister of Health and Public Hygiene alerts and recalls the preventive measures in the Vo health district, located in the Maritime Region","A 22-year-old young man, who was diagnosed on July 30, 2024, was successfully treated in a health facility, according to a press release published today. The Minister of Health and Public Hygiene alerts and recalls the preventive measures in the Vo health district, located in the Maritime Region",,,,,,,"A 22-year-old young man, who was diagnosed on July 30, 2024, was successfully treated in a health facility, according to a press release published today. The Minister of Health and Public Hygiene alerts and recalls the preventive measures in the Vo health district, located in the Maritime Region",
OEW33-1218082024,33,12 - 18 Aug 2024,,TGO,Togo,Dengue,Grade 3,2024-06-28,2024-06-28,2024-08-26,55.0,17.0,1.0,1.8%,"In week 28, 89 out of 203 suspected dengue cases were confirmed, bringing the total to 643 cases. Patients ranged from 3 to 79 years old. To manage the dengue epidemic, an incident management system and a one-month action plan have been implemented, and a webinar for healthcare providers was conducted on July 22nd."
OEW33-1218082024,33,12 - 18 Aug 2024,,TGO,Togo,Measles,Ungraded,2024-03-14,2024-03-14,2024-06-16,628.0,199.0,1.0,0.2%,"In Togo there is an ongoing measles outbreak since week 5 of 2024 with 13 districts affected. As at week 23 in 2024, there are a total of 628 suspected cases reported, 199 confirmed measles cases, 1 death reported among the confirmed cases in Oti South district"
OEW33-1218082024,33,12 - 18 Aug 2024,,UGA,Uganda,Food insecurity (Horn of Africa crisis),Grade 3,2022-02-17,2022-01-01,2024-06-12,,,,-,"In Uganda, Karamoja is the most vulnerable region to climate-related shocks and hazards, which significantly contribute to persistently low food and livestock production levels. The situation is expected to improve in the projected period (August 2024 - February 2025) due to seasonal gains and projected production; however, the forecasted"
OEW33-1218082024,33,12 - 18 Aug 2024,,UGA,Uganda,Anthrax,Grade 2,2024-06-13,2024-06-04,2024-08-04,11.0,11.0,,0.0%,There is an ongoing anthrax outbreak reported in Uganda affecting Amudat districts since 4 June 2024. The outbreak in Kween was controlled. Eight cases have been confirmed in Amudat.
OEW33-1218082024,33,12 - 18 Aug 2024,,UGA,Uganda,Cholera,Grade 3,2024-05-13,2024-05-11,2024-05-26,57.0,15.0,4.0,7.0%,"The cholera outbreak in Kyotera district is still ongoing since 5 May 2024. As of 26 May 2024, a total of 57 cases ,15 confirmed, and four deaths are reported."
OEW33-1218082024,33,12 - 18 Aug 2024,,UGA,Uganda,Crimean- Congo haemorrhagic fever (CCHF),Ungraded,2024-02-12,2024-04-24,2024-08-04,15.0,2.0,,0.0%,"A new positive case was reported on 29 July 2024 from the Kiruhura district, bringing the total number of cases to seven. Cumulatively, from week 1-31, 2024, 15 samples"
OEW33-1218082024,33,12 - 18 Aug 2024,,,"(all from males) tested positive for CCHF from seven districts: Lyantonde (3), Kampala (3), Kiruhura (3), Kasese (2), Mbarara (1), Hoima (1), and Kiboga (1).","(all from males) tested positive for CCHF from seven districts: Lyantonde (3), Kampala (3), Kiruhura (3), Kasese (2), Mbarara (1), Hoima (1), and Kiboga (1).","(all from males) tested positive for CCHF from seven districts: Lyantonde (3), Kampala (3), Kiruhura (3), Kasese (2), Mbarara (1), Hoima (1), and Kiboga (1).",,,,,,,"(all from males) tested positive for CCHF from seven districts: Lyantonde (3), Kampala (3), Kiruhura (3), Kasese (2), Mbarara (1), Hoima (1), and Kiboga (1).",
OEW33-1218082024,33,12 - 18 Aug 2024,,UGA,Uganda,Measles,Ungraded,2023-10-04,2024-03-05,2024-07-29,428.0,49.0,9.0,2.1%,"As of 29 July 2024 (week 31), the measles outbreak is ongoing in nine districts. Moroto has reported the highest number of cases (312 cases, 13 confirmed and seven deaths). Cumulatively, 428 cases, 49 confirmed, and nine deaths have been reported."
OEW33-1218082024,33,12 - 18 Aug 2024,,UGA,Uganda,Mpox,Grade 3,2024-07-26,2024-07-29,2024-07-29,8.0,2.0,,0.0%,"In June and early July 2024, Kasese District enhanced surveillance for Mpox disease along the border following increased cases in the DRC. Following the orientation of screeners at the point of entry and Bwera Hospital, eight suspects were identified, of which two tested positive for Mpox."
OEW33-1218082024,33,12 - 18 Aug 2024,,UGA,Uganda,Rift Valley Fever (RVF),Ungraded,2024-05-24,2024-02-23,2024-07-29,16.0,5.0,5.0,31.3%,"As of 29 July 2024 (week 31), four districts: Kyegegwa (7), Mubende (5), Sembabule (3), and Ntungamo (1) are experiencing Rift Valley Fever outbreaks (RVF), with a cumulative number of 16 cases, five confirmed, and five deaths since 1 March 2024."
OEW33-1218082024,33,12 - 18 Aug 2024,,UGA,Uganda,Undiagnosed disease,Ungraded,2024-07-08,2024-07-08,2024-07-08,16.0,,3.0,18.8%,
