NAME,WEEK,DATE,EVENT_TYPE,ISO3,COUNTRY,EVENT_NAME,GRADE,DATE_NOTIFY,DATE_START,DATE_END,CASES_TOTAL,CASES_CONFIRMED,DEATHS,CFR,DESCRIPTION
OEW10-0309032025,10,3 - 9 Mar 2025,,GIN,Guinea,Mpox,Grade 3,2024-09-02,2024-09-02,2025-02-23,2.0,2.0,0.0,0.00%,"As of 23 February 2025, no new mpox case was confirmed. On 2 September 2024, a clade IIb mpox case was confirmed in a 7-year-old schoolgirl of Koyamah locality in the"
OEW10-0309032025,10,3 - 9 Mar 2025,,,southern Macenta health district of Guinea. A second clade IIb case was confirmed on 8 December 2024.,southern Macenta health district of Guinea. A second clade IIb case was confirmed on 8 December 2024.,southern Macenta health district of Guinea. A second clade IIb case was confirmed on 8 December 2024.,,,,,,,southern Macenta health district of Guinea. A second clade IIb case was confirmed on 8 December 2024.,
OEW10-0309032025,10,3 - 9 Mar 2025,,KEN,Kenya,,Ungraded,2022-06-29,2023-01-01,2025-03-06,2949.0,355.0,18.0,0.60%,
OEW10-0309032025,10,3 - 9 Mar 2025,,KEN,Kenya,Mpox,Grade 3,2024-08-03,2024-07-22,2025-03-06,53.0,53.0,1.0,1.90%,"One new confirmed case has been reported since the last update in bulletin week 9 from Busia County, bringing Kenya's total confirmed cases to 53, with one death (CFR"
OEW10-0309032025,10,3 - 9 Mar 2025,,,1.9%) across 12 counties as of 7 March 2025. Genomic sequencing of 33 confirmed cases has identified the circulating strain as sub-clade 1b virus.,1.9%) across 12 counties as of 7 March 2025. Genomic sequencing of 33 confirmed cases has identified the circulating strain as sub-clade 1b virus.,1.9%) across 12 counties as of 7 March 2025. Genomic sequencing of 33 confirmed cases has identified the circulating strain as sub-clade 1b virus.,,,,,,,1.9%) across 12 counties as of 7 March 2025. Genomic sequencing of 33 confirmed cases has identified the circulating strain as sub-clade 1b virus.,
OEW10-0309032025,10,3 - 9 Mar 2025,,LSO,Lesotho,Drought/food insecurity,Ungraded,2024-07-22,2024-07-12,2025-02-14,335000.0,335000.0,,-,"According to FAO, after dry spells in Dec 2024, weather forecasts point to improved conditions for 2025 crops. Cumulative rainfall amounts since the start of the cropping season in October 2024 through January 2025 were generally below average, with more substantial deficits recorded in minor cereal-producing areas of the Southwest. According to the latest Integrated Food Security Phase Classification (IPC) analysis released in February 2025, about 335 000 people (22% population), are currently facing IPC Phase 3 (Crisis) and above levels of acute food insecurity, and this situation is expected to persist until March 2025. This figure is moderately higher than the food- insecure population estimate in 2024."
OEW10-0309032025,10,3 - 9 Mar 2025,,LBR,Liberia,Lassa Fever,Ungraded,2022-03-03,2024-12-20,2025-01-26,3.0,3.0,0.0,0.00%,"In epidemiological week 4 (week ending 26 January 2025), one new confirmed case of Lassa fever was reported from Grand Bassa County, Liberia. From 20 December 2024 to 26 January 2025, a total of three (3) confirmed cases with zero deaths (CFR 0.0%) have been reported from Grand Bassa County."
OEW10-0309032025,10,3 - 9 Mar 2025,,LBR,Liberia,Mpox,Grade 3,2024-08-31,2024-08-31,2025-02-05,69.0,69.0,0.0,0.00%,"On 6 February, Liberia reported one new confirmed Mpox case from the capital, Monrovia. Six cases were confirmed between 17 January and 5 February 2025. Cumulatively, from 1 January 2024 to 5 February 2025, 69 cases have been confirmed for Mpox."
OEW10-0309032025,10,3 - 9 Mar 2025,,MDG,Madagascar,Cyclone Dikeledi,Ungraded,2025-01-14,2025-01-13,2025-02-20,7028.0,,,,"As of 15 January 2025, a total of 7,028 people (2,284 families) had been affected with the Dikeledi cyclone in northern Madagascar, mainly in Diana (3,809) and Sava (3,203), with three deaths reported, according to the National Office for Risk and Disaster Management (BNGRC). All displacement sites in the north were vacated, as displaced people returned home. The cyclone flooded 1,185 houses, damaged 1,092, and completely destroyed 209. Education for about 8,000 children was disrupted, with 82 classrooms damaged including 72 partially destroyed."
OEW10-0309032025,10,3 - 9 Mar 2025,,MDG,Madagascar,Malnutrition crisis,Protracted 2,2021-07-01,2021-01-01,2025-02-20,357900.0,,,-,"Madagascar's Grand Sud and Grand Sud-Est regions face ongoing drought and malnutrition, with 357,900 children projected to be acutely malnourished by August 2025, including 83,400 severe cases. The IPC analysis forecasts a peak crisis in January-April 2025, with some districts in IPC Phase 3 (Serious) and others in Phase 2 (Alert). Food shortages, poor water access, and disease drive the crisis"
OEW10-0309032025,10,3 - 9 Mar 2025,,MWI,Malawi,Drought/food insecurity,Ungraded,2024-03-26,2024-03-28,2025-01-20,5700000.0,,,-,"In Malawi, the food insecurity situation is expected to deteriorate during the projection period (October 2024 - March 2025) which coincides with the lean season. Nearly 5.7 million people (28 %of the analyzed population) are estimated to be in Phase 3 or above with 416 000 people expected to be in Phase 4."
OEW10-0309032025,10,3 - 9 Mar 2025,,MWI,Malawi,Cholera,Grade 3,,2024-09-12,2025-02-19,297.0,115.0,14.0,4.70%,"In Epi-week 06 (week ending 9 February 2025), confirmed cholera cases dropped from 10 in the previous week to 2, marking an 80% decline. However, outbreaks remain active in Mzimba North, Balaka, and Machinga, while Chitipa and Karonga have successfully contained the spread. During this period, two new cases were reported in Balaka and Machinga. From 8 Sepptember 2024 when the outbreak began to 9th February 2025, a total of 297 cholera cases have been recorded, with 14 deaths, resulting in a case fatality rate (CFR) of 4.7%. 115 of the cases were confirmed by Cultere test."
OEW10-0309032025,10,3 - 9 Mar 2025,,MLI,Mali,Humanitarian crisis (Sahel region),Protracted 2,2017-09-11,2017-09-11,2025-01-20,6400000.0,,0.0,0.00%,"The humanitarian context in Mali remains marked by a complex crisis that stems from a volatile security situation, exacerbated by structural vulnerability factors, socio- economic challenges, as well as climate change. In 2025, 6.4 million Malians will have multi-sectoral humanitarian needs."
OEW10-0309032025,10,3 - 9 Mar 2025,,MOZ,Mozambique,Drought/food insecurity,Ungraded,2024-09-05,2024-09-05,2025-02-10,374000.0,374000.0,,0.00%,"According to UNHCR, 374 000 refugees have self-relocated from Nampula urban locations to Maratane settlement in Mozambique as of 10 February 2024. Around 8 271 individuals were seeking asylum in neighbouring countries. The situation in northern Mozambique has been compounded by the humanitarian crisis resulting from Cyclones Chido and Dikeledi as well as the ongoing armed conflict in Cabo Delgado, which has resulted in the displacement of hundreds of thousands."
OEW10-0309032025,10,3 - 9 Mar 2025,,MOZ,Mozambique,Humanitarian crisis in Cabo Delgado,Protracted 2,2020-01-01,2024-10-31,2025-01-20,1300000.0,,,-,"In 2024, the compound effects of armed conflict in Cabo Delgado province, and vulnerability to natural hazards countrywide drove humanitarian needs in Mozambique. The year was marked by a recrudescence of the conflict in coastal districts of Cabo Delgado. The operational environment became more complex as non-State armed groups demonstrated increased capacity to plan and execute complex attacks. The displaced population remained vulnerable amid scarcer resources. An estimated 580,000 people remain displaced, predominantly women and children, with the largest concentrations in Pemba, Metuge, and Macomia. In 2025, 1.3 million people will need humanitarian assistance."
OEW10-0309032025,10,3 - 9 Mar 2025,,MOZ,Mozambique,Cholera,Grade 3,,2024-10-28,2025-01-12,302.0,,29.0,9.60%,"A cholera outbreak was declared in Mogovolas District, Nampula Province on 28 October 2024. As of 12 January 2025, 302 suspected cases and 29 deaths (including 25 community deaths) had been reported. The outbreak primarily affected Namitil Sede locality (94% of cases), with smaller clusters in Rieque (2%), Mavuruta (2%), Moquito (1%), and Ilute Sede (0.4%) localities. In week 51, 19 suspected cases and eight community deaths were recorded. No further data has been reported since week 51 due to the destruction of the cholera treatment center (CTC) and a health facility in the district."
OEW10-0309032025,10,3 - 9 Mar 2025,,NAM,Namibia,Drought/food insecurity,Ungraded,2024-05-31,2024-05-22,2025-01-25,1260000.0,,,-,"From October 2024 - March 2025, the food security situation is expected to worsen due to the start of the lean season, and seasonal price increases, where 1.26 million people (41 %of the population) are expected to be in IPC Phase 3 or above. Most of the areas are likely to remain classified in Crisis (IPC Phase 3)."
OEW10-0309032025,10,3 - 9 Mar 2025,,NAM,Namibia,Malaria,Ungraded,2024-12-24,2024-11-04,2025-02-23,14367.0,14367.0,39.0,0.30%,"On 23 December 2024, the Ministry of Health and Social Services issued a Public Notice informing the nation about the increasing number of Malaria cases in most of the malaria-endemic regions of Namibia. By 23 February 2025, Namibia reported a total of 14 367 malaria cases and 39 deaths (CFR 0.3%)."
OEW10-0309032025,10,3 - 9 Mar 2025,,NER,Niger,Humanitarian crisis (Sahel region),Protracted 2,2015-02-01,2015-02-01,2025-02-28,,,,-,
OEW10-0309032025,10,3 - 9 Mar 2025,,NER,Niger,Diphtheria,Ungraded,2023-08-28,2025-01-01,2025-03-02,498.0,,28.0,5.60%,"In epidemiological week 9 (week ending on 2 March 2025), a total of forty-nine new cases of diphtheria, including one death, were reported by thirteen health districts, representing 18 %of all 72 health districts in the country. The Ingal Health District (Agadez Region) and Tanout (Zinder Region) reported the highest number of cases (eight cases for each district). From epidemiological week 1 to week 9 of 2025, the country had recorded 498 cases, including 28 deaths (CFR: 5.6 %)."
OEW10-0309032025,10,3 - 9 Mar 2025,,NGA,Nigeria,Humanitarian crisis (Sahel region),Protracted 2,2016-10-10,2016-10-10,2025-01-23,7800000.0,,,0.00%,"Nigeria continues to face extensive humanitarian challenges. There is significant population displacement, with approximately 2.3 million internally displaced persons (IDPs) recorded by the end of 2024 with an estimated 33 million people projected to experience food insecurity during the 2025 lean season. Additionally, 1.8 million children in six north-eastern and north-western states are at risk of severe acute malnutrition (SAM)- among the highest global levels according to the IPC. Recent floods affected 34 out of 36 states, with Borno being the most severely impacted. High levels of inflation, including food inflation has impacted on the humanitarian situation. . In 2025, 7.8 million people will need humanitarian assistance."
OEW10-0309032025,10,3 - 9 Mar 2025,,NGA,Nigeria,Cholera,Grade 3,,2025-03-02,2025-03-02,1124.0,27.0,28.0,2.50%,"In epidemiological week 9, two new suspected cases and zero deaths were reported from Bauchi and Osun states. From 1 January to 2 March 2025, a total of 1 124 suspected cases of Cholera, including 28 deaths ( CFR: 2.5%), were reported. Of the total cases reported, 27 were confirmed by culture. This outbreak spans 25 states and 65 Local Government Areas (LGAs), with 77% of cases reported in Baylesa (n=748) and Rivers (n=107)."
OEW10-0309032025,10,3 - 9 Mar 2025,,NGA,Nigeria,Lassa Fever,Ungraded,2024-11-30,2025-01-01,2025-02-23,511.0,506.0,95.0,18.60%,"In epidemiological week 8 (17- 23 February 2025), 54 new confirmed cases of Lassa fever, including 6 deaths, were reported from eight states across Nigeria. From 1 January to -23 February 2025, a cumulative total of 506 confirmed cases with 95 deaths (CFR 18.8 %) have been reported from 12 states. Ondo (160 cases, 21 deaths), Bauchi (122 cases, 10 deaths), Edo (88 cases, 14 deaths), and Taraba (80 cases, 25 deaths) States are the most affected."
OEW10-0309032025,10,3 - 9 Mar 2025,,NGA,Nigeria,Measles,Ungraded,2025-01-01,2025-01-01,2025-01-31,627.0,112.0,,0.00%,"From epidemiological week 1 to week 5, 2025 (the week ending on 31 January 2025), Nigeria reported 627 measles cases with zero deaths. Of the reported cases, 112 were confirmed IgM+ at the laboratory. Katsina (n=102), Jigawa (n=84), Akwa Ibom (n=56), Kebbi (n=52), and Enugu (n=32) states account for 51.9% of the 627 suspected cases reported."
OEW10-0309032025,10,3 - 9 Mar 2025,,NGA,Nigeria,Mpox,Grade 3,2022-01-31,2022-01-01,2025-03-07,2130.0,268.0,2.0,0.10%,"In the last six weeks, Nigeria reported 66 cases of Mpox. Cumulatively, from 1 January 2024 to 07 March 2025, 268 confirmed cases and two deaths were reported."
OEW10-0309032025,10,3 - 9 Mar 2025,,NGA,Nigeria,Poliomyelitis (cVDPV2),Grade 2,2018-06-01,2022-01-01,2025-03-05,236.0,236.0,0.0,0.00%,"Seven cases of cVDPV2 were reported this week, with four from 2024 (originating from Kano, Borno, and Jigawa) and three from 2025 (from Kano and Borno). This brings the total number of cVDPV2 cases in 2025 to three. The cumulative total for 2024 stands at 98 cases. In comparison, 87 cases were reported in 2023 and 48 cases in 2022."
OEW10-0309032025,10,3 - 9 Mar 2025,,RWA,Rwanda,Mpox,Grade 3,2024-07-24,2024-07-24,2025-02-09,102.0,102.0,0.0,0.00%,"Rwanda confirmed its first two cases of Mpox on 24 July 2024. The current situation, as of 9 February 2025 is as following: 102 total confirmed cases and cumulative"
OEW10-0309032025,10,3 - 9 Mar 2025,,SEN,Senegal,Chikungunya,Ungraded,,2025-01-23,2025-02-16,2.0,2.0,,0.00%,
OEW10-0309032025,10,3 - 9 Mar 2025,,,suspected cases: 6 309.,suspected cases: 6 309.,suspected cases: 6 309.,,,,,,,suspected cases: 6 309.,"As of February 2025, no additional chikungunya cases have been reported. The Ministry of Health and Social Action of Senegal initially confirmed two Gossas District (Fatick Region) and Goudomp District (Sedhiou Region) during epidemiological and 2 of 2025 (ending 12 January). Since then, no further infections have been detected."
OEW10-0309032025,10,3 - 9 Mar 2025,,SEN,Senegal,Dengue fever,,2022-11-14,2025-01-06,2025-02-16,24.0,24.0,0.0,0.00%,"In week 7 of 2025 (10-16 February), 11 new confirmed measles cases were reported in Senegal. Since the beginning of the year, a total of 36 cases have been recorded, evenly distributed between males and females (50% each). These cases have been reported in 15 districts across seven regions, with Louga region accounting for the highest number (21 cases, 58%), followed by Thiès (6 cases, 17%), Saint Louis (3 cases, 8%), Dakar (2 cases, 6%), Kédougou (2 cases, 6%), Matam (1 case, 3%), and Tambacounda (1 case, 3%)."
OEW10-0309032025,10,3 - 9 Mar 2025,,SEN,Senegal,Measles,Ungraded,2022-07-04,2025-01-01,2025-02-16,36.0,36.0,0.0,0.00%,"In week 7 of 2025 (10-16 February), 11 new confirmed measles cases were reported in Senegal. Since beginning of 2025, a total of 36 confirmed cases have been recorded from 15 districts across seven regions. The cases are evenly distributed between males and females (50% each). The Louga region has reported the highest number of cases (21 cases, 58%), followed by Thiès (6 cases, 17%), Saint Louis (3 cases, 8%), Dakar (2 cases, 6%), Kédougou (2 cases, 6%), Matam (1 case, 3%), and Tambacounda (1 case, 3%)."
OEW10-0309032025,10,3 - 9 Mar 2025,,SLE,Sierra Leone,Mpox,Grade 3,2025-01-11,2025-01-09,2025-03-09,72.0,72.0,,1.40%,
OEW10-0309032025,10,3 - 9 Mar 2025,,,See details in the article,See details in the article,See details in the article,,,,,,,See details in the article,
OEW10-0309032025,10,3 - 9 Mar 2025,,ZAF,South Africa,Diphtheria,Ungraded,2024-07-19,2024-12-24,2025-02-23,62.0,62.0,,6.50%,"In epidemiological week 8 (week ending 23 February 2025), nine new cases of diphtheria (three symptomatic and six asymptomatic carriers) were reported from Western Cape Province in South Africa. From 1 January 2024 to 23 February 2025, a cumulative total of 62 cases (29 symptomatic and 33 asymptomatic carriers) have been reported across South Africa. The majority of confirmed cases and carriers (95%, 59/62) are from the Western Cape Province."
OEW10-0309032025,10,3 - 9 Mar 2025,,ZAF,South Africa,Mpox,Grade 3,2025-02-25,2025-02-25,2025-02-25,3.0,3.0,,0.00%,"On 24 February 2025, the Government of South Africa notified WHO of a new cluster of three mpox cases in Ekurhuleni Metropolitan Municipality, Gauteng Province, following"
OEW10-0309032025,10,3 - 9 Mar 2025,,,"laboratory confirmation. See details in the week 9 bulletin here: https://iris.who.int/bitstream/handle/10665/380693/OEW9-240202032025.pdf South Sudan Humanitarian crisis Protracted 3 15-Aug-16 15-Aug-16 28-Feb-25 9,300,000 - - - The conflict in Sudan has deepened a complex, protracted humanitarian crisis in South Sudan characterized by food insecurity, malnutrition, displacement, and the erosion of livelihood systems. In February, armed clashes in counties along the Sobat-River corridor caused widespread civilian displacement threatening to disrupt humanitarian access. More recently, changes in the humanitarian funding environment since January risks disrupting the provision of basic services for vulnerable population groups entering the country from Sudan, as well as for communities across the state. A total of 9.3 million people need humanitarian assistance this year","laboratory confirmation. See details in the week 9 bulletin here: https://iris.who.int/bitstream/handle/10665/380693/OEW9-240202032025.pdf South Sudan Humanitarian crisis Protracted 3 15-Aug-16 15-Aug-16 28-Feb-25 9,300,000 - - - The conflict in Sudan has deepened a complex, protracted humanitarian crisis in South Sudan characterized by food insecurity, malnutrition, displacement, and the erosion of livelihood systems. In February, armed clashes in counties along the Sobat-River corridor caused widespread civilian displacement threatening to disrupt humanitarian access. More recently, changes in the humanitarian funding environment since January risks disrupting the provision of basic services for vulnerable population groups entering the country from Sudan, as well as for communities across the state. A total of 9.3 million people need humanitarian assistance this year","laboratory confirmation. See details in the week 9 bulletin here: https://iris.who.int/bitstream/handle/10665/380693/OEW9-240202032025.pdf South Sudan Humanitarian crisis Protracted 3 15-Aug-16 15-Aug-16 28-Feb-25 9,300,000 - - - The conflict in Sudan has deepened a complex, protracted humanitarian crisis in South Sudan characterized by food insecurity, malnutrition, displacement, and the erosion of livelihood systems. In February, armed clashes in counties along the Sobat-River corridor caused widespread civilian displacement threatening to disrupt humanitarian access. More recently, changes in the humanitarian funding environment since January risks disrupting the provision of basic services for vulnerable population groups entering the country from Sudan, as well as for communities across the state. A total of 9.3 million people need humanitarian assistance this year",,,,,,,"laboratory confirmation. See details in the week 9 bulletin here: https://iris.who.int/bitstream/handle/10665/380693/OEW9-240202032025.pdf South Sudan Humanitarian crisis Protracted 3 15-Aug-16 15-Aug-16 28-Feb-25 9,300,000 - - - The conflict in Sudan has deepened a complex, protracted humanitarian crisis in South Sudan characterized by food insecurity, malnutrition, displacement, and the erosion of livelihood systems. In February, armed clashes in counties along the Sobat-River corridor caused widespread civilian displacement threatening to disrupt humanitarian access. More recently, changes in the humanitarian funding environment since January risks disrupting the provision of basic services for vulnerable population groups entering the country from Sudan, as well as for communities across the state. A total of 9.3 million people need humanitarian assistance this year","Since the start of the Sudan emergency in April 2023, a total of 1 052 891 people fleeing conflict arrived from Sudan, including 718 453 returnees as of 24 February 2025.South Sudan"
OEW10-0309032025,10,3 - 9 Mar 2025,,,"Since last report on this event on 1 December 2024, there were five new cases reported including two new cases in week 7 of 2025 keeping the total number to 173 human cases, including three deaths (CFR 1.7%). The cases have been reported across four counties in two states in South Sudan since 2024","Since last report on this event on 1 December 2024, there were five new cases reported including two new cases in week 7 of 2025 keeping the total number to 173 human cases, including three deaths (CFR 1.7%). The cases have been reported across four counties in two states in South Sudan since 2024","Since last report on this event on 1 December 2024, there were five new cases reported including two new cases in week 7 of 2025 keeping the total number to 173 human cases, including three deaths (CFR 1.7%). The cases have been reported across four counties in two states in South Sudan since 2024",,,,,,,"Since last report on this event on 1 December 2024, there were five new cases reported including two new cases in week 7 of 2025 keeping the total number to 173 human cases, including three deaths (CFR 1.7%). The cases have been reported across four counties in two states in South Sudan since 2024",
OEW10-0309032025,10,3 - 9 Mar 2025,,SSD,South Sudan,Cholera,Grade 3,2024-10-11,2024-09-28,2025-02-16,31871.0,,536.0,1.70%,"During the past seven days, 991 cholera cases including 11 deaths were reported from 25 counties. This brings the total number of cases reported since the banging of the outbreak to 31 871, across 36 counties, seven states and one administrative area. The total number of cholera related deaths reported so far is 536 (CFR 1.7%) including 280 health facility deaths"
OEW10-0309032025,10,3 - 9 Mar 2025,,SSD,South Sudan,Mpox,Grade 3,2025-02-07,2025-02-07,2025-02-27,6.0,6.0,,0.00%,"On 7 February 2025, South Sudan's Ministry of Health declared an outbreak of mpox following the confirmation of a case on 6 February 2025 at the National Public Health Reference Laboratory. As of 27 February 2025, the country has reported six confirmed cases with no death. The outbreak is in two counties of Juba (Capital city with five cases) and Malakal (state Capital of Upper Nile with one case)."
OEW10-0309032025,10,3 - 9 Mar 2025,,SSD,South Sudan,Poliomyelitis (cVDPV2),Grade 2,2024-02-26,2023-01-01,2025-02-16,13.0,13.0,0.0,0.00%,"There was no new case of polio reported during week 7 of 2025 (ending 16 February) , keeping the total number of confirmed acute flaccid paralysis Polio cases at 13."
OEW10-0309032025,10,3 - 9 Mar 2025,,TZA,"Tanzania, United Republic of",Cholera,Grade 3,2023-10-03,2023-09-05,2025-02-19,13833.0,,158.0,1.10%,"Since 1 January 2024 cholera outbreaks have been reported in 23 regions out of 31 of Tanzania. Currently seven regions have active outbreaks (Simiyu, Morogoro, Rukwa, Lindi, Mbeya, Tabora, and Mara). In 2025, a total of 1 716 cases and 11 deaths (CFR 0.6%) have been reported as of 19 February. Cumulatively from Jan 2024 to 19 Feb 2025, a total of 13 833 cases and 158 deaths ( CFR 1.1%) have been reported countrywide"
OEW10-0309032025,10,3 - 9 Mar 2025,,TZA,"Tanzania, United Republic of",Marburg virus disease,Grade 2,2024-12-09,2024-12-10,2025-02-16,10.0,2.0,10.0,100.00%,"Zero new confirmed cases of Marburg Virus Disease (MVD) were reported from Tanzania during epidemiological week 10 (03 - 09 March 2025). A cumulative total of 10 cases with 10 deaths (CFR 100.0%) have been reported since the MVD outbreak was declared by the Ministry of Health of Tanzania. Of these, two were confirmed by laboratory tests while eight (8) are considered probable cases with epidemiological links to the index case. Since the last confirmed case died on 28 January 2025, 40 days have passed without a report of a new confirmed case of the disease in the country."
OEW10-0309032025,10,3 - 9 Mar 2025,,TGO,Togo,Meningitis,Ungraded,2025-01-15,2025-01-01,2025-02-10,51.0,9.0,7.0,13.70%,"During epidemiological week 2, 2025, the Dankpen 2 locality from the Dankpen district in Togo crossed the epidemic threshold with nine suspected cases (an attack rate of 24.93 cases per 100,000 inhabitants). From epidemiological week 1 to epidemiological week 7, a total of 51 suspected cases and 7 deaths were reported in three districts ( Dankpen I, Dankpen2 and Dankpen 3), with a sex ratio (M/F) of 1.21 (28 males and 23 females). The most affected age group is 15 to 29 years."
OEW10-0309032025,10,3 - 9 Mar 2025,,UGA,Uganda,Cholera,Grade 3,2025-01-12,2025-01-07,2025-02-09,117.0,46.0,1.0,0.90%,"An outbreak of cholera is ongoing in Lamwo district, Northern region of Uganda. From 7 January - 9 February 2025, a total of 117 cases, including one death (CFR 0.9%), have been reported from six parishes in Agoro Subcounty. Of these cases, 46 have been laboratory-confirmed for Vibrio cholerae O1 Ogawa infection."
OEW10-0309032025,10,3 - 9 Mar 2025,,UGA,Uganda,Mpox,Grade 3,2024-07-26,2024-07-29,2025-03-04,3833.0,3833.0,31.0,0.8%,
OEW10-0309032025,10,3 - 9 Mar 2025,,,See details in the article.,See details in the article.,See details in the article.,,,,,,,See details in the article.,
OEW10-0309032025,10,3 - 9 Mar 2025,,UGA,Uganda,Sudan virus disease,Grade 2,2025-01-30,2025-01-29,2025-03-09,14.0,14.0,4.0,28.60%,"Two new confirmed cases of Sudan virus disease were reported from Uganda during epidemiological week 10 (03 - 09 March 2025). Since the official declaration of the SVD outbreak in Uganda on 30 January 2025, a total of 14 cases (12 confirmed and 2 probable) with four deaths (CFR 28.6%) have been reported. See details here"
