NAME,WEEK,DATE,EVENT_TYPE,ISO3,COUNTRY,EVENT_NAME,GRADE,DATE_NOTIFY,DATE_START,DATE_END,CASES_TOTAL,CASES_CONFIRMED,DEATHS,CFR,DESCRIPTION
OEW43-2127102024,43,21 - 27 Oct 2024,Ongoing,LSO,Lesotho,Drought/food insecurity,Ungraded,2024-07-22,2024-07-12,2024-09-09,293.0,293.0,,-,"Prolonged dry spells, high temperatures, and economic challenges have left approximately 293 000 people in rural Lesotho (19 percent of the population) facing severe food insecurity, classified as IPC Phase 3 (Crisis) or worse, from May to September 2024. The most affected districts include Maseru and Qacha's Nek, where 30 percent of the population is in Crisis (IPC Phase 3), followed by Mohale's Hoek and Quthing."
OEW43-2127102024,43,21 - 27 Oct 2024,Ongoing,,,Lassa Fever,Ungraded,2022-03-03,2022-01-06,2024-06-05,479.0,151.0,45.0,"9,40%","From 6 January 2022, May 2024, a cumulative total of 466 cases of Lassa Fever have been reported with 151 confirmed and 45 deaths (CFR 39%). Liberia Measles Ungraded 3-Feb-22 13-Dec-21 13711 0,70%"
OEW43-2127102024,43,21 - 27 Oct 2024,Ongoing,,Since the measles 2024. The highest,outbreak started affected is,on 13 December Montserrado with,,,,,,,"of June 2,","A confirmed Mpox case was reported on 31 August 2024, from Doodwicken Clinic in Jedepo Health District, Sinoe County. This case, involving a 7-year-old girl, marks the beginning of the outbreak in the region. So far, eight suspected cases have been reported, with one confirmed case, and four negative, while two results are pending, and one case was discarded. Since the onset, 30 contacts have been identified and monitored daily. The district rapid response team has been activated. Investigations, along with active case searches, are ongoing."
OEW43-2127102024,43,21 - 27 Oct 2024,Ongoing,MDG,Madagascar,Cyclone Gamane\Flood,Grade 2,2024-02-26,2024-02-05,2024-05-19,95.0,,19.0,"0,00%","Since weeks 6 and 7, 2024 heavy rainfall has triggered flooding in the central and northeastern parts of Madagascar. This has resulted in population displacements and the"
OEW43-2127102024,43,21 - 27 Oct 2024,Ongoing,,"loss of homes and infrastructure, including roads, bridges, agriculture, health facilities, water, sanitation, and hygiene infrastructure. Seven regions have been affected. Madagascar crisis Protracted 2 1-Jan-21 30-Oct-24 - The humanitarian situation in the Grand Sud remained fragile and is expected to deteriorate further, thus reversing the marginal gains made in 2023. From May to September 2024, about 1.22 million people (12% of the rural population) in Madagascar are experiencing acute food insecurity (IPC3+), with the highest levels in Ambovombe Androy","loss of homes and infrastructure, including roads, bridges, agriculture, health facilities, water, sanitation, and hygiene infrastructure. Seven regions have been affected. Madagascar crisis Protracted 2 1-Jan-21 30-Oct-24 - The humanitarian situation in the Grand Sud remained fragile and is expected to deteriorate further, thus reversing the marginal gains made in 2023. From May to September 2024, about 1.22 million people (12% of the rural population) in Madagascar are experiencing acute food insecurity (IPC3+), with the highest levels in Ambovombe Androy","loss of homes and infrastructure, including roads, bridges, agriculture, health facilities, water, sanitation, and hygiene infrastructure. Seven regions have been affected. Madagascar crisis Protracted 2 1-Jan-21 30-Oct-24 - The humanitarian situation in the Grand Sud remained fragile and is expected to deteriorate further, thus reversing the marginal gains made in 2023. From May to September 2024, about 1.22 million people (12% of the rural population) in Madagascar are experiencing acute food insecurity (IPC3+), with the highest levels in Ambovombe Androy",,,,,,,"loss of homes and infrastructure, including roads, bridges, agriculture, health facilities, water, sanitation, and hygiene infrastructure. Seven regions have been affected. Madagascar crisis Protracted 2 1-Jan-21 30-Oct-24 - The humanitarian situation in the Grand Sud remained fragile and is expected to deteriorate further, thus reversing the marginal gains made in 2023. From May to September 2024, about 1.22 million people (12% of the rural population) in Madagascar are experiencing acute food insecurity (IPC3+), with the highest levels in Ambovombe Androy","and Amboasary Atsimo districts. This number is expected to rise to 1.32 million (13%) from October to December 2024, and to 1.78 million (17%) from January to April 2025, indicating a worsening food security situation."
OEW43-2127102024,43,21 - 27 Oct 2024,Ongoing,MDG,Madagascar,Malaria,Ungraded,2024-02-28,2024-01-01,2024-05-12,1531902.0,,212.0,"0,00%","Madagascar has been experiencing a malaria outbreak since last year and the same trend continues in 2024. From week 1 to week 19, 2024, a total of 1 531 902 cases and 212 deaths are reported..Malawi"
OEW43-2127102024,43,21 - 27 Oct 2024,Ongoing,,"Malawi formally declared a state of disaster on 23 March 2024 due to drought in 23 out of its 28 districts. From October 2024 to May 2025, Southern Malawi, particularly Nsanje district in the Lower Shire livelihood zone, remains the area of highest concern for food security. More than half of Nsanje's population is experiencing Crisis (IPC Phase 3) food insecurity due to an El Niño-induced drought, compounded by inadequate recovery from previous flooding and waterlogging in 2023. From October 2024 to January 2025, Crisis (IPC Phase 3) food security conditions are also expected to persist in Mangochi district in the south and Nkhotakota and Lilongwe districts in central Malawi.","Malawi formally declared a state of disaster on 23 March 2024 due to drought in 23 out of its 28 districts. From October 2024 to May 2025, Southern Malawi, particularly Nsanje district in the Lower Shire livelihood zone, remains the area of highest concern for food security. More than half of Nsanje's population is experiencing Crisis (IPC Phase 3) food insecurity due to an El Niño-induced drought, compounded by inadequate recovery from previous flooding and waterlogging in 2023. From October 2024 to January 2025, Crisis (IPC Phase 3) food security conditions are also expected to persist in Mangochi district in the south and Nkhotakota and Lilongwe districts in central Malawi.","Malawi formally declared a state of disaster on 23 March 2024 due to drought in 23 out of its 28 districts. From October 2024 to May 2025, Southern Malawi, particularly Nsanje district in the Lower Shire livelihood zone, remains the area of highest concern for food security. More than half of Nsanje's population is experiencing Crisis (IPC Phase 3) food insecurity due to an El Niño-induced drought, compounded by inadequate recovery from previous flooding and waterlogging in 2023. From October 2024 to January 2025, Crisis (IPC Phase 3) food security conditions are also expected to persist in Mangochi district in the south and Nkhotakota and Lilongwe districts in central Malawi.",,,,,,,"Malawi formally declared a state of disaster on 23 March 2024 due to drought in 23 out of its 28 districts. From October 2024 to May 2025, Southern Malawi, particularly Nsanje district in the Lower Shire livelihood zone, remains the area of highest concern for food security. More than half of Nsanje's population is experiencing Crisis (IPC Phase 3) food insecurity due to an El Niño-induced drought, compounded by inadequate recovery from previous flooding and waterlogging in 2023. From October 2024 to January 2025, Crisis (IPC Phase 3) food security conditions are also expected to persist in Mangochi district in the south and Nkhotakota and Lilongwe districts in central Malawi.",
OEW43-2127102024,43,21 - 27 Oct 2024,Ongoing,MWI,Malawi,Cholera,Grade 3,,2024-09-12,2024-09-12,10.0,2.0,0.0,"0,00%","On 10 September 2024, Chitipa has reported 10 suspected cases at Kapenda Health Centre, with 3 cRDT positive, 1 culture positive, and 1 sample pending. The cases are sporadic, initially coming from the Songwe River area, but current cases are from other regions. None had travel history prior to the onset of diarrhoea. All suspected cases are being followed by the District Rapid Response Team, with control measures like water chlorination in place, and the situation is under close national monitoring."
OEW43-2127102024,43,21 - 27 Oct 2024,Ongoing,MWI,Malawi,Measles,Ungraded,2024-09-12,2024-09-12,2024-09-12,3.0,3.0,0.0,"0,00%","On 29 August 2024, Mangochi District Heath Office was alerted on a cluster of suspected measles cases in a village under Mkuchinga Jwambone Health Center. Six samples were collected for laboratory investigation at Kamuzu Central Hospital in Lilongwe. Three samples were confirmed positive for Measles on 9 September, 2024. The ages of the confirmed measles cases are seven months, five and seven years old."
OEW43-2127102024,43,21 - 27 Oct 2024,Ongoing,MLI,Mali,Floods,Grade 2,2024-08-21,2024-08-23,2024-08-23,39.0,39.0,22.0,,"Since the beginning of July 2024, Mali has faced severe flooding across several regions, causing significant human and material losses. By 18 August 2024, over 39 768 people were affected, including 16 639 children, 10 695 women, and 12 434 men. The floods resulted in 22 deaths and 104 injuries. Additionally, eight healthcare facilities were damaged. The crisis has exacerbated public health issues, particularly with contaminated water sources, increasing the risk of cholera and other waterborne diseases. Urgent needs include healthcare, shelter, and access to clean water."
OEW43-2127102024,43,21 - 27 Oct 2024,Ongoing,MLI,Mali,Humanitarian crisis (Sahel region),Protracted 2,2017-09-11,2017-09-11,2024-09-10,8.0,8.0,0.0,"0,00%","Since 2011, Mali has been facing a security crisis and currently, six regions are affected particularly in Segou, Mopti, Timbuktu, Gao, Kidal and Menaka as of September 3 2024. Among them, As of August 25, the The main ones are particularly affected: Ségou, Mopti, Timbuktu, Gao, Kidal and Menaka. As of August 30, 2024, flooding has affected a total of 131,581 people, approximately 70% of whom are women and children. The most impacted regions include Segou, Gao, Mopti, Bamako, and Sikasso."
OEW43-2127102024,43,21 - 27 Oct 2024,Ongoing,MLI,Mali,Dengue,Grade 3,2023-09-12,2024-01-01,2024-05-26,4605.0,614.0,4.0,"0,10%","From 1 January to 26 May 2024, Mali reported 4 605 suspected cases of dengue including 614 confirmed cases and four deaths."
OEW43-2127102024,43,21 - 27 Oct 2024,Ongoing,MLI,Mali,Measles,Ungraded,2018-02-20,2024-01-01,2024-09-04,769.0,306.0,0.0,"0,00%","From W1 to W32, 2024 the country reported 769 suspected cases of measles including 306 confirmed IgM+ cases, no case by epidemiological link, 27 compatible cases, No case pending laboratory results o Rate of no-measles febrile rashes reached with 2.5 o The incidence rate of measles is 19.33 per 1 million population."
OEW43-2127102024,43,21 - 27 Oct 2024,Ongoing,MRT,Mauritania,Influx of refugees from Mali (Sahel region),Protracted 2,2024-03-11,2024-03-14,2024-03-19,180.0,,,-%,"The humanitarian situation in the Hodh Chargui region (HEC) of Mauritania is becoming critical with the massive arrival of thousands of Malian refugees fleeing insecurity and violence. It is estimated that over 180 000 refugees and returnees are registered or awaiting registration in the Bassiknou district. According to UNHCR data, over 40% are outside the formal camp system, many with livestock, putting pressure on natural resources (such as water and grazing land) and basic social services. Both displaced populations and host communities require protection, shelter, clean water, hygiene and sanitation facilities, as well as healthcare for their well-being."
OEW43-2127102024,43,21 - 27 Oct 2024,Ongoing,MRT,Mauritania,Measles,Ungraded,2023-03-07,2024-01-01,2024-05-12,2384.0,280.0,4.0,"0,20%","Between 1 January and 12 May 2024, Mauritania reported 2 384 suspected measles cases across 49 districts, with 280 confirmed cases -81 through epidemiological links and 199 via laboratory tests. In response, a vaccination campaign is scheduled from 28 May to 6 June 2024, targeting 1 943 636 children aged nine months to 14 years. This campaign will also incorporate the administration of vitamin A and mebendazole."
OEW43-2127102024,43,21 - 27 Oct 2024,Ongoing,MUS,Mauritius,Dengue,Grade 3,2023-12-17,2023-12-17,2024-09-10,9328.0,9.0,5.0,"0,10%","The index case for the ongoing dengue outbreak in Mauritius was reported on 27 Augut 2024, as of 10 September 2024, a total of 9 328 cases have been reported."
OEW43-2127102024,43,21 - 27 Oct 2024,Ongoing,MOZ,Mozambique,Drought/food insecurity,Ungraded,2024-09-05,2024-08-20,2024-09-04,3.0,,,-,"The Mozambique authorities have launched humanitarian appeal to combat drought and food insecurity in the country. El Niño induced rainfall shortage and above average temperatures have resulted in drought in central and southern provinces of Mozambique, impacting agricultural production for vulnerable communities. As a result, around 2.8 million people are facing food insecurity (IPC 3+), including 510 151 people in IPC4 (emergency level of food insecurity) between April and September 2024. During the lean season (Oct-24 / Mar-25), the situation will further deteriorate with around 3.3 million people projected to face food insecurity, of which 390 886 in IPC4 in the affected provinces."
OEW43-2127102024,43,21 - 27 Oct 2024,Ongoing,MOZ,Mozambique,Humanitarian crisis in Cabo Delgado,Protracted 2,2020-01-01,2024-10-31,2024-10-31,,,,-,"The conflict in northern Mozambique has escalated in early 2024, causing widespread displacement and a severe humanitarian crisis. The latest IOM report identifies 709,529 IDPs and 632,408 returnees across 364 locations, with 76% of IDPs in Cabo Delgado. Health infrastructure is strained, with 18 fully damaged and 27 partially damaged facilities out of 144 in Cabo Delgado, particularly in districts like Macomia and Mocimboa da Praia. Conflict and climate events continue to impact the region's fragile health system"
OEW43-2127102024,43,21 - 27 Oct 2024,Ongoing,,"Mozambique 174 0,00% The current cholera outbreak in the country began in Niassa province on 14 September 2022. As of 23 June 2024, there have been 8,024 cumulative cases in 2024 alone, including 18 deaths (CFR 0.2%). Epi week 25 saw a 33% decrease in cases and 0 deaths, with 3 out of 11 provinces (Maputo, Nampula, Sofala) reporting active outbreaks in the past month. However, all 3 of these provinces are experiencing downward trends in recent weeks.","Mozambique 174 0,00% The current cholera outbreak in the country began in Niassa province on 14 September 2022. As of 23 June 2024, there have been 8,024 cumulative cases in 2024 alone, including 18 deaths (CFR 0.2%). Epi week 25 saw a 33% decrease in cases and 0 deaths, with 3 out of 11 provinces (Maputo, Nampula, Sofala) reporting active outbreaks in the past month. However, all 3 of these provinces are experiencing downward trends in recent weeks.","Mozambique 174 0,00% The current cholera outbreak in the country began in Niassa province on 14 September 2022. As of 23 June 2024, there have been 8,024 cumulative cases in 2024 alone, including 18 deaths (CFR 0.2%). Epi week 25 saw a 33% decrease in cases and 0 deaths, with 3 out of 11 provinces (Maputo, Nampula, Sofala) reporting active outbreaks in the past month. However, all 3 of these provinces are experiencing downward trends in recent weeks.",,,,,,,"Mozambique 174 0,00% The current cholera outbreak in the country began in Niassa province on 14 September 2022. As of 23 June 2024, there have been 8,024 cumulative cases in 2024 alone, including 18 deaths (CFR 0.2%). Epi week 25 saw a 33% decrease in cases and 0 deaths, with 3 out of 11 provinces (Maputo, Nampula, Sofala) reporting active outbreaks in the past month. However, all 3 of these provinces are experiencing downward trends in recent weeks.","Between 9 July and 21 August 2024, there have been 283 measles cases reported, with 215 in Cabo Delgado (Chiure, Montepuez, and Namuno districts) and 68 in Niassa (Sanga and Cuamba districts). The outbreak led to 18 deaths, all occurring within the communities, with 17 in Cabo Delgado and 1 in Niassa. Most cases (90%) were among children under 15 years old, with 54 cases in infants under 1 year, 75 cases in children aged 1-4, 45 cases in those aged 5-9, and 24 cases in the 10-14 age group..Namibia"
OEW43-2127102024,43,21 - 27 Oct 2024,Ongoing,,"From July to September 2024, 1.15 million people in Namibia (38% of the population) face high levels of acute food insecurity (IPC Phase 3 or above) and require urgent action to reduce food gaps and protect livelihoods; all the 14 affected areas are classified in IPC Phase 3 (Crisis). In the first projection period (October 2024 - March 2025), the food security situation is expected to worsen due to the start of the lean season, and seasonal price increases, where 1.26 million people (41 percent of the analysed population) are expected to be in IPC Phase 3 or above. Most of the areas are likely to remain classified in Crisis (IPC Phase 3).","From July to September 2024, 1.15 million people in Namibia (38% of the population) face high levels of acute food insecurity (IPC Phase 3 or above) and require urgent action to reduce food gaps and protect livelihoods; all the 14 affected areas are classified in IPC Phase 3 (Crisis). In the first projection period (October 2024 - March 2025), the food security situation is expected to worsen due to the start of the lean season, and seasonal price increases, where 1.26 million people (41 percent of the analysed population) are expected to be in IPC Phase 3 or above. Most of the areas are likely to remain classified in Crisis (IPC Phase 3).","From July to September 2024, 1.15 million people in Namibia (38% of the population) face high levels of acute food insecurity (IPC Phase 3 or above) and require urgent action to reduce food gaps and protect livelihoods; all the 14 affected areas are classified in IPC Phase 3 (Crisis). In the first projection period (October 2024 - March 2025), the food security situation is expected to worsen due to the start of the lean season, and seasonal price increases, where 1.26 million people (41 percent of the analysed population) are expected to be in IPC Phase 3 or above. Most of the areas are likely to remain classified in Crisis (IPC Phase 3).",,,,,,,"From July to September 2024, 1.15 million people in Namibia (38% of the population) face high levels of acute food insecurity (IPC Phase 3 or above) and require urgent action to reduce food gaps and protect livelihoods; all the 14 affected areas are classified in IPC Phase 3 (Crisis). In the first projection period (October 2024 - March 2025), the food security situation is expected to worsen due to the start of the lean season, and seasonal price increases, where 1.26 million people (41 percent of the analysed population) are expected to be in IPC Phase 3 or above. Most of the areas are likely to remain classified in Crisis (IPC Phase 3).",
OEW43-2127102024,43,21 - 27 Oct 2024,Ongoing,NAM,Namibia,Measles,Ungraded,2024-06-07,2024-01-01,2024-06-05,39.0,6.0,0.0,"0,00%","The Ministry of Health and Social Services (MoHSS) has reported a confirmed outbreak of Measles in Omaruru health district of Erongo Region,. Between 1 January and 5 June 2024, 39 suspected cases, including six confirmed cases, have been reported from the same health facility. All six confirmed cases have been reported among learners attending the same primary school"
OEW43-2127102024,43,21 - 27 Oct 2024,Ongoing,NER,Niger,Floods,Grade 2,2024-06-12,2024-06-10,2024-06-13,353.0,,217.0,"0,10%","As of 30 August, the heavy rains that have hit Niger since the beginning of the season (in May) across the entire national territory have resulted in the following: Four out of the eight regions in the country are affected, encompassing 18 departments, with the Maradi region being the most affected. A total of over 353 000 people have been displaced . There have been 217 deaths, including 11 due to house collapses (a total of 329 households have collapsed). and 200 injuries have been recorded."
OEW43-2127102024,43,21 - 27 Oct 2024,Ongoing,NER,Niger,Humanitarian crisis (Sahel region),Protracted 2,2015-02-01,2015-02-01,2024-04-18,4.0,4.0,0.0,"0,00%","Niger is contending with a severe humanitarian crisis due to regional instability in the Tillaberi, Maradi, Diffa, and Tahoua regions. The instability stems from conflicts spilling over from Mali, Burkina Faso, and Nigeria, compounded by the country's internal political turmoil following a military coup on 28 July 2023 -the third such coup in the Sahel in under three years. International sanctions, environmental challenges, deep-seated poverty, and frail social support have further strained the relief efforts. Despite these adversities, there has been a slight decrease in refugee and asylum seeker figures, although new arrivals from Chad, Mali, Burkina Faso, and Nigeria persist post-21 March 2024. Concurrently, Niger has seen the internally displaced population escalate dramatically, from 1.9 million in 2017 to 4.3 million individuals, which is 15% of the population in 2024, significantly amplifying the demand for humanitarian aid. Acute food insecurity currently afflicts 3.3 million residents, with an alarming 7.3 million more at risk of deteriorating conditions amid the ongoing turmoil."
OEW43-2127102024,43,21 - 27 Oct 2024,Ongoing,NER,Niger,Cholera,Grade 3,2024-09-09,2024-08-27,2024-09-12,181.0,12.0,6.0,"3,30%","181 suspected cholera cases including 6 deaths (CFR 3.3%) reported from Bouza (81 cases; 2 deaths), Birni Koni (64 cases), and Madaoua (36 cases; 4 deaths) health districts of Tahoua region in Southern Niger between 27 August and 12 September 2024. Of the 37 samples tested, 12 tested positive for Vibrio cholerae O1 Ogawa by culture at the Centre for Medical Research and Health of Niamey."
OEW43-2127102024,43,21 - 27 Oct 2024,Ongoing,NER,Niger,Dengue,Grade 3,2024-10-30,2024-10-16,2024-10-30,4.0,1.0,1.0,25%,"On 30 October 2024, WHO was notified of a confirmed dengue fever case in a 34-year-old male wood seller who presented at the National Hospital of Niamey on 16 October 2024 with fever, headache, vomiting, hiccups, cough, epigastralgia, epistaxis, myalgia, and arthralgia. Samples tested on 23 October 2024 by RT-PCR at the Center for Medical Research and Health (CERMES) of Niamey returned positive for dengue. Three suspected dengue cases from the same family as the confirmed case tested negative for Active case search and entomological investigations are ongoing."
OEW43-2127102024,43,21 - 27 Oct 2024,Ongoing,,"Niger Diphtheria Ungraded 28-Aug-23 5367 320 6,00% An outbreak of diphtheria has been confirmed in Matameye health district, Zinder region. The first case was reported on 17 July 2023. As of week number 24 of 2024, 5367","Niger Diphtheria Ungraded 28-Aug-23 5367 320 6,00% An outbreak of diphtheria has been confirmed in Matameye health district, Zinder region. The first case was reported on 17 July 2023. As of week number 24 of 2024, 5367","Niger Diphtheria Ungraded 28-Aug-23 5367 320 6,00% An outbreak of diphtheria has been confirmed in Matameye health district, Zinder region. The first case was reported on 17 July 2023. As of week number 24 of 2024, 5367",,,,,,,"Niger Diphtheria Ungraded 28-Aug-23 5367 320 6,00% An outbreak of diphtheria has been confirmed in Matameye health district, Zinder region. The first case was reported on 17 July 2023. As of week number 24 of 2024, 5367",
OEW43-2127102024,43,21 - 27 Oct 2024,Ongoing,,"suspected cases, Niger",including 320 Measles,deaths (CFR 6 %) Ungraded,,,,,,20.0,"0,50%","As of epidemiological week 32, a total of 4429 suspected cases of measles were reported, including 604 confirmed cases and 20 deaths (case fatality rate: 0.5%), across 65 health districts in epidemic areas"
OEW43-2127102024,43,21 - 27 Oct 2024,Ongoing,NER,Niger,Meningitis,Ungraded,2022-12-07,2024-01-01,2024-07-20,3268.0,1.0,256.0,"7,80%","Niger continues to notify meningitis cases. From epidemiological week 1 to week 28, 2024 , a total of 3 268 suspected cases including 1 300 confirmed cases and 256 deaths (CFR 7.3%) were notified in eight regions, namely Agadez, Diffa, Dosso, Maradi, Niamey, Tahoua, Tilaberi and Zinder. Agadez and Niamey regions are the most affected."
