NAME,WEEK,DATE,EVENT_TYPE,ISO3,COUNTRY,EVENT_NAME,GRADE,DATE_NOTIFY,DATE_START,DATE_END,CASES_TOTAL,CASES_CONFIRMED,DEATHS,CFR,DESCRIPTION
OEW43-2127102024,43,21 - 27 Oct 2024,Ongoing,,"Niger Fever (RVF) Ungraded 30-Oct-24 14-Oct-24 30-Oct-24 1 1 0,00% On 30 October 2024, WHO was notified of a confirmed Rift Valley fever case in a 25-year-old male farmer admitted on 14 October 2024 at the N'wagar health center of Tchintabaraden health district in southwest Niger with fever, jaundice, epistaxis and hematemesis. Blood samples collected and tested by RT-PCR on 14 October 2024 at the Center for Medical Research and Health (CERMES) of Niamey returned positive for Rift Valley fever. Several deaths and abortions have also been reported in the same farmer's livestock (especially among goats and camelids). Investigations are ongoing.","Niger Fever (RVF) Ungraded 30-Oct-24 14-Oct-24 30-Oct-24 1 1 0,00% On 30 October 2024, WHO was notified of a confirmed Rift Valley fever case in a 25-year-old male farmer admitted on 14 October 2024 at the N'wagar health center of Tchintabaraden health district in southwest Niger with fever, jaundice, epistaxis and hematemesis. Blood samples collected and tested by RT-PCR on 14 October 2024 at the Center for Medical Research and Health (CERMES) of Niamey returned positive for Rift Valley fever. Several deaths and abortions have also been reported in the same farmer's livestock (especially among goats and camelids). Investigations are ongoing.","Niger Fever (RVF) Ungraded 30-Oct-24 14-Oct-24 30-Oct-24 1 1 0,00% On 30 October 2024, WHO was notified of a confirmed Rift Valley fever case in a 25-year-old male farmer admitted on 14 October 2024 at the N'wagar health center of Tchintabaraden health district in southwest Niger with fever, jaundice, epistaxis and hematemesis. Blood samples collected and tested by RT-PCR on 14 October 2024 at the Center for Medical Research and Health (CERMES) of Niamey returned positive for Rift Valley fever. Several deaths and abortions have also been reported in the same farmer's livestock (especially among goats and camelids). Investigations are ongoing.",,,,,,,"Niger Fever (RVF) Ungraded 30-Oct-24 14-Oct-24 30-Oct-24 1 1 0,00% On 30 October 2024, WHO was notified of a confirmed Rift Valley fever case in a 25-year-old male farmer admitted on 14 October 2024 at the N'wagar health center of Tchintabaraden health district in southwest Niger with fever, jaundice, epistaxis and hematemesis. Blood samples collected and tested by RT-PCR on 14 October 2024 at the Center for Medical Research and Health (CERMES) of Niamey returned positive for Rift Valley fever. Several deaths and abortions have also been reported in the same farmer's livestock (especially among goats and camelids). Investigations are ongoing.",
OEW43-2127102024,43,21 - 27 Oct 2024,Ongoing,NER,Niger,Suspected heavy metal poisoning,Ungraded,2024-06-12,2024-05-27,2024-06-12,14.0,,176.0,,"A mysterious illness has been reported in Niger as of 27 May 2024 , cases present with symptoms like ascites, abdominal pain, weight loss, and vomiting. The index case began experiencing symptoms on 15 May . The patient's family of six has also been affected. All are suspected to have contracted the illness from an unknown source, potentially linked to drinking water from boreholes. Cases have been reported in four regions: Tahoua (2), Dosso (5), Maradi (6), and Tillaberry (1). No laboratory results are available. A multidisciplinary team has been deployed. Samples have been sent to CERMES, with results pending. Insecurity and population mobility are hindering the response. A lack of laboratory facilities for heavy metal testing is also a challenge. Nigeria Floods Grade 2 19-Aug-24 20-Aug-24 22-Aug-24 1 1 7 0,40%"
OEW43-2127102024,43,21 - 27 Oct 2024,Ongoing,,"Jigawa State has been heavily affected by flooding since Week 29 of 2024, impacting 14 Local Government Areas(LGAs), 45 wards, and 139 settlements. So far, 3 843 houses have been damaged, and there are 31 IDP camps across 5 LGAs, with 1 951 displaced individuals. 7 fatalities have been reported, and farmlands, highways, and some health facilities have been submerged. Immediate needs include healthcare, food, shelter, and logistical support, while an Incident Action Plan (IAP) is in place with","Jigawa State has been heavily affected by flooding since Week 29 of 2024, impacting 14 Local Government Areas(LGAs), 45 wards, and 139 settlements. So far, 3 843 houses have been damaged, and there are 31 IDP camps across 5 LGAs, with 1 951 displaced individuals. 7 fatalities have been reported, and farmlands, highways, and some health facilities have been submerged. Immediate needs include healthcare, food, shelter, and logistical support, while an Incident Action Plan (IAP) is in place with","Jigawa State has been heavily affected by flooding since Week 29 of 2024, impacting 14 Local Government Areas(LGAs), 45 wards, and 139 settlements. So far, 3 843 houses have been damaged, and there are 31 IDP camps across 5 LGAs, with 1 951 displaced individuals. 7 fatalities have been reported, and farmlands, highways, and some health facilities have been submerged. Immediate needs include healthcare, food, shelter, and logistical support, while an Incident Action Plan (IAP) is in place with",,,,,,,"Jigawa State has been heavily affected by flooding since Week 29 of 2024, impacting 14 Local Government Areas(LGAs), 45 wards, and 139 settlements. So far, 3 843 houses have been damaged, and there are 31 IDP camps across 5 LGAs, with 1 951 displaced individuals. 7 fatalities have been reported, and farmlands, highways, and some health facilities have been submerged. Immediate needs include healthcare, food, shelter, and logistical support, while an Incident Action Plan (IAP) is in place with",
OEW43-2127102024,43,21 - 27 Oct 2024,Ongoing,,support from WHO and key stakeholders.,support from WHO and key stakeholders.,support from WHO and key stakeholders.,,,,,,,support from WHO and key stakeholders.,
OEW43-2127102024,43,21 - 27 Oct 2024,Ongoing,NGA,Nigeria,Humanitarian crisis (Sahel region),Protracted 2,2016-10-10,2016-10-10,2024-03-21,8.0,8.0,,"0,00%",
OEW43-2127102024,43,21 - 27 Oct 2024,Ongoing,NGA,Nigeria,Cholera,Grade 3,,2024-01-01,2024-08-11,5951.0,,176.0,"3,00%","From 1 January to 11 August 2024, there were 5 951 suspected cholera cases reported in Nigeria, including 176 deaths (CFR: 3%). Reports came from 36 states."
OEW43-2127102024,43,21 - 27 Oct 2024,Ongoing,NGA,Nigeria,Dengue,Grade 3,2023-11-01,2023-01-01,2024-03-24,72.0,14.0,0.0,"0,00%","Nigeria is responding to Dengue outbreak that started in 2023. As of 3 March 2024, there has been 72 suspected cases reported with 14 confirmed and zero deaths since 19 December 2023."
OEW43-2127102024,43,21 - 27 Oct 2024,Ongoing,NGA,Nigeria,Lassa Fever,Ungraded,2023-01-08,2024-01-01,2024-07-21,6.0,1.0,171.0,"16,90%","Cumulatively from week 1 to 29, 2024, 163 deaths have been reported with a case fatality rate (CFR) of 17.1% which is marginally higher than the CFR for the same period in 2023 (16.9%). In total for 2024, 28 States have recorded at least one confirmed case across 125 Local Government Areas."
OEW43-2127102024,43,21 - 27 Oct 2024,Ongoing,NGA,Nigeria,Measles,Ungraded,2024-04-01,2024-01-01,2024-05-12,8935.0,4.0,,"0,00%","Between 1 January and 12 May 2024, in Nigeria, 8 935 suspected measles cases were reported, with 1 141 confirmed cases, 3 373 confirmed through epidemiological link, and 119 classified as compatible. Additionally, there were 280 IgM positive rubella cases. The measles incidence rate is 18.4 per 1 000 000 population. Notably, 302 out of"
OEW43-2127102024,43,21 - 27 Oct 2024,Ongoing,NGA,Nigeria,Meningitis,Ungraded,2024-01-29,2023-10-08,2024-06-29,2669.0,135.0,240.0,"9,00%","Between 1 October 2023 and 29 June 2024, a total of 2 669 suspected cases including 1135 confirmed cases and 240 deaths (CFR: 9 %) were reported from 22 out of 33 states."
OEW43-2127102024,43,21 - 27 Oct 2024,Ongoing,NGA,Nigeria,Mpox,Grade 3,2022-01-31,2022-01-01,2024-08-25,902.0,,9.0,"1,00%","Nigeria continues to report cases of Mpox. From January 2022 to 25 August 2024, a total of 901 cases including nine deaths were reported. In 2024, the country reported 210 cases."
OEW43-2127102024,43,21 - 27 Oct 2024,Ongoing,NGA,Nigeria,Poliomyelitis (cVDPV2),Grade 2,2018-06-01,2022-01-01,2024-08-21,174.0,174.0,0.0,"0,00%","One cVDPV2 case was reported in Sokoto this week. There were 39 cases reported in 2024, 87 cVDPV2 cases reported in 2023 and 48 cases in 2022."
OEW43-2127102024,43,21 - 27 Oct 2024,Ongoing,,"On 20 March 2024, NCDC notified of the outbreak of an unknown illness through IDSR by the Sokoto State Ministry of Health. The iIndex case presented is a 6-year-old girl from Isa LGA, who presented with symptoms including abdominal pain and distension, and vomiting on 6 February 2024. Cumulatively, from weeks 6 to week 15, a total of 196 cases with 7 deaths (CFR 3.6%) were reported. 70% are aged 0 - 10 years, followed by 11 - 20 years (20%), >30 years (6%), and 21 - 30 years (4%). 55.1% of the","On 20 March 2024, NCDC notified of the outbreak of an unknown illness through IDSR by the Sokoto State Ministry of Health. The iIndex case presented is a 6-year-old girl from Isa LGA, who presented with symptoms including abdominal pain and distension, and vomiting on 6 February 2024. Cumulatively, from weeks 6 to week 15, a total of 196 cases with 7 deaths (CFR 3.6%) were reported. 70% are aged 0 - 10 years, followed by 11 - 20 years (20%), >30 years (6%), and 21 - 30 years (4%). 55.1% of the","On 20 March 2024, NCDC notified of the outbreak of an unknown illness through IDSR by the Sokoto State Ministry of Health. The iIndex case presented is a 6-year-old girl from Isa LGA, who presented with symptoms including abdominal pain and distension, and vomiting on 6 February 2024. Cumulatively, from weeks 6 to week 15, a total of 196 cases with 7 deaths (CFR 3.6%) were reported. 70% are aged 0 - 10 years, followed by 11 - 20 years (20%), >30 years (6%), and 21 - 30 years (4%). 55.1% of the",,,,,,,"On 20 March 2024, NCDC notified of the outbreak of an unknown illness through IDSR by the Sokoto State Ministry of Health. The iIndex case presented is a 6-year-old girl from Isa LGA, who presented with symptoms including abdominal pain and distension, and vomiting on 6 February 2024. Cumulatively, from weeks 6 to week 15, a total of 196 cases with 7 deaths (CFR 3.6%) were reported. 70% are aged 0 - 10 years, followed by 11 - 20 years (20%), >30 years (6%), and 21 - 30 years (4%). 55.1% of the","cases are female. Cases initially reported from Isa LGA, Sokoto State, with reports extending to Sabon Birni LGA (7 cases) in Sokoto State"
OEW43-2127102024,43,21 - 27 Oct 2024,Ongoing,,,Marburg Virus disease (MVD) outbreak,Grade 3,2024-09-27,2024-09-27,2024-10-28,65.0,65.0,15.0,"23,10%","On 27 September 2024, the Rwandan Ministry of Health announced the confirmation of Marburg virus disease (MVD) in a few patients in health facilities in the country . As of 28 October 2024, a total of 65 confirmed cases and 15 deaths (CFR 23.1 %) are reported. Currently three cases are in isolation and receiving treatment and 47 have recovered ."
OEW43-2127102024,43,21 - 27 Oct 2024,Ongoing,RWA,Rwanda,MPox,Grade 3,2024-07-24,2024-07-24,2024-09-22,6.0,6.0,0.0,"0,00%","Rwanda confirmed its first two cases of Mpox on 24 July 2024. As of epidemiological week 39, (ending 29 September), a total of 2 789 suspected cases have been reported, including 544 new suspected cases, all tested negative. A total of six cases have been confirmed through laboratory testing. Among confirmed cases, five cases involving individuals with a history of international travel prior to symptom onset and one contact of a confirmed case. They received treatment, all cases have fully recovered and been discharged, while two new cases are currently isolated and receiving appropriate medical care and their contacts, are under close follow-up"
OEW43-2127102024,43,21 - 27 Oct 2024,Ongoing,,"Several regions of the country are experiencing floods. Management is done at the regional level in a One Health approach under the coordination of Governors. A teleconference on this subject was convened by the COUS for October 17, 2024. More information on the presentation to be made.","Several regions of the country are experiencing floods. Management is done at the regional level in a One Health approach under the coordination of Governors. A teleconference on this subject was convened by the COUS for October 17, 2024. More information on the presentation to be made.","Several regions of the country are experiencing floods. Management is done at the regional level in a One Health approach under the coordination of Governors. A teleconference on this subject was convened by the COUS for October 17, 2024. More information on the presentation to be made.",,,,,,,"Several regions of the country are experiencing floods. Management is done at the regional level in a One Health approach under the coordination of Governors. A teleconference on this subject was convened by the COUS for October 17, 2024. More information on the presentation to be made.",
OEW43-2127102024,43,21 - 27 Oct 2024,Ongoing,SEN,Senegal,Chikungunya,Ungraded,2023-06-08,2024-01-01,2024-05-26,7.0,7.0,0.0,"0,00%","Between 1 January and 26 May 2024, Senegal reported seven new Chikungunya cases. The cases ranged from eight to 30 years old, with a median age of 21 years. Matam had the highest number of cases with three, followed by Tambacounda with two, and Dakar and Kolda each with one. The last reported case had an onset of symptoms on 26 April 2024."
OEW43-2127102024,43,21 - 27 Oct 2024,Ongoing,SEN,Senegal,Crimean- Congo haemorrhagic fever (CCHF),Ungraded,2024-03-26,2024-03-22,2024-04-26,3.0,3.0,0.0,"0,00%","On 22 March 2024, the Institut Pasteur in Dakar (IPD) confirmed a case of Crimean-Congo Haemorrhagic fever (CCHF) in a 25-year-old male farmer. The patient, originally from the Guinguinéo district, probably contracted the disease while working in the Ndoffane district. Investigations are ongoing in all the areas visited by the patient. So far 11 samples collected from contacts at the Dakar hospital have tested negative. On 26 April 2024, WHO was informed of the confirmation of two additional CCHF cases in a 40-year-old male and a 25-year-old male from Pikine and Yeumbeul districts of Dakar respectively. Blood samples collected from the two male cases on 17 and 19 April 2024 respectively returned positive for CCHF on PCR on 25 April 2024. PCR testing returned negative for yellow fever, dengue, RVF, west nile, chikungunya, and zika. Both cases are alive. In-depth investigations are ongoing."
OEW43-2127102024,43,21 - 27 Oct 2024,Ongoing,SEN,Senegal,cVDPV2,Grade 2,2024-10-29,2024-09-20,2024-10-29,1.0,,,"0,00%",One cVDPV2 case was reported in Kédougou commune of South-eastern Kédougou region of Senegal with date of acute flaccid paralysis onset on 20 September 2024 and laboratory confirmation on 29 October 2024. cVDPV2 was also isolated from an environmental sample from Tambacounda city in Eastern Senegal on 22 October 2024.
OEW43-2127102024,43,21 - 27 Oct 2024,Ongoing,,"Investigations are ongoing. Senegal Dengue Grade 3 14-Nov-22 31-Jan-23 12-May-24 23 0 0,00%","Investigations are ongoing. Senegal Dengue Grade 3 14-Nov-22 31-Jan-23 12-May-24 23 0 0,00%","Investigations are ongoing. Senegal Dengue Grade 3 14-Nov-22 31-Jan-23 12-May-24 23 0 0,00%",,,,,,,"Investigations are ongoing. Senegal Dengue Grade 3 14-Nov-22 31-Jan-23 12-May-24 23 0 0,00%",
OEW43-2127102024,43,21 - 27 Oct 2024,Ongoing,,"(1 case, 4%), 2024, in and case 4 March","and Thies (1 case,",4%). The first case,,,,,,,Dakar-Ouest.,"As of 12 May 2024, Senegal has reported a total of 23 confirmed dengue cases. The cases, ranging in age from 15 to 62 years with a median age of 32 years, include nine females and 14 males. The majority of cases have been reported in the Dakar region (15 cases, 65%), followed by Louga (4 cases, 17%), Saint-Louis (2 cases, 9%), Matam"
OEW43-2127102024,43,21 - 27 Oct 2024,Ongoing,,"Between 1 January and 26 May 2024, Senegal reported 252 confirmed measles cases, with the highest numbers in Louga (56), Matam (41), and Kaffrine (33). The cases were evenly split between females (125) and males (127), ranging from 0.4 to 42 years old, with a median age of 6 years. Most cases (70%) were among children aged nine months to five years. Among these cases, 69% were unvaccinated. Twenty-three districts have reached the epidemic threshold in 2024, with the onset of symptoms of the last case on 29 April 2024 in Saint Louis..South Africa","Between 1 January and 26 May 2024, Senegal reported 252 confirmed measles cases, with the highest numbers in Louga (56), Matam (41), and Kaffrine (33). The cases were evenly split between females (125) and males (127), ranging from 0.4 to 42 years old, with a median age of 6 years. Most cases (70%) were among children aged nine months to five years. Among these cases, 69% were unvaccinated. Twenty-three districts have reached the epidemic threshold in 2024, with the onset of symptoms of the last case on 29 April 2024 in Saint Louis..Cholera","Between 1 January and 26 May 2024, Senegal reported 252 confirmed measles cases, with the highest numbers in Louga (56), Matam (41), and Kaffrine (33). The cases were evenly split between females (125) and males (127), ranging from 0.4 to 42 years old, with a median age of 6 years. Most cases (70%) were among children aged nine months to five years. Among these cases, 69% were unvaccinated. Twenty-three districts have reached the epidemic threshold in 2024, with the onset of symptoms of the last case on 29 April 2024 in Saint Louis..Grade 3",,,,,,,"Between 1 January and 26 May 2024, Senegal reported 252 confirmed measles cases, with the highest numbers in Louga (56), Matam (41), and Kaffrine (33). The cases were evenly split between females (125) and males (127), ranging from 0.4 to 42 years old, with a median age of 6 years. Most cases (70%) were among children aged nine months to five years. Among these cases, 69% were unvaccinated. Twenty-three districts have reached the epidemic threshold in 2024, with the onset of symptoms of the last case on 29 April 2024 in Saint Louis..0,00%","The cholera outbreak has been ongoing in South Africa since December 4, 2023. It started with imported cases linked to ongoing outbreaks in Southern Africa and two locally transmitted cases from Limpopo in January. As of 17 May 2024, 12 confirmed cases with no deaths have been reported. Limpopo province is most affected with 10 of the cases, Three of the cases were imported from Zimbabwe."
OEW43-2127102024,43,21 - 27 Oct 2024,Ongoing,ZAF,South Africa,Mpox,Grade 3,2024-05-15,2024-05-15,2024-09-29,25.0,25.0,3.0,"12,00%","Through IHR notification from South Africa, WHO received a report of one laboratory confirmed mpox case from Johannesburg. This case was confirmed after initial testing"
OEW43-2127102024,43,21 - 27 Oct 2024,Ongoing,SSD,South Sudan,Floods,Ungraded,2024-09-04,2024-08-29,2024-09-25,735.0,,,-,"Since May, flooding has affected more than 735,000 people across 38 counties and the Abyei Administrative Area. The floods have destroyed homes, crops and infrastructure, disrupting health and education services and heightening disease risks. IOM reports 76 230 displaced people."
OEW43-2127102024,43,21 - 27 Oct 2024,Ongoing,SSD,South Sudan,Food insecurity (Horn of Africa crisis),Grade 3,2020-12-18,2021-04-05,2024-09-30,,,,-,"According to the Famine Early Warning Network (FEWNET), Emergency (IPC Phase 4) outcomes remain widespread in the country at peak of the main rainfall season in September driven by a combination of shocks including expanding floods, deteriorating macroeconomy, extremely high food prices, continued conflict and insecurity, and high returnee burden in the northern counties. Catastrophe (IPC Phase 5) outcomes are likely persisting among some households in hard-to-reach areas of Pibor; among returnees and refugees in transit areas including in Renk, Rubkona, and Aweil East, and likely among some displaced households in the most severely flood-affected areas of Jonglei, Unity, Warrap, and in parts of Upper Nile and Northern Bahr el Ghazal"
OEW43-2127102024,43,21 - 27 Oct 2024,Ongoing,SSD,South Sudan,Humanitarian crisis,Protracted 3,2016-08-15,2016-08-15,2024-10-10,9.0,,0.0,"0,00%","The humanitarian situation in South Sudan remains concerning with increasing needs and the number of people requiring assistance. This year, it is estimated that nine million people need humanitarian assistance including 6.3 million for health needs and two million people are internally displaced persons. In 2024, the humanitarian response plan needs US $ 1.8 billion to reach six million of the most vulnerable people, however, as of August 2024, 56 %of the needed funding has been covered"
OEW43-2127102024,43,21 - 27 Oct 2024,Ongoing,SSD,South Sudan,Impact of Sudan crisis in South Sudan,Grade 3,2023-04-15,2023-05-01,2024-10-10,813.0,,0.0,,"As of 30 September 2024, at least 813 141 individuals have crossed from 18 different nationalities. Of this number, 75.8% (616 492) are South Sudanese returnees and 23.5% are Sudanese refugees. of (PoEs) are being monitored, Joda-Renk for 68% of the reported influx figures."
OEW43-2127102024,43,21 - 27 Oct 2024,Ongoing,SSD,South Sudan,Anthrax,"Currently, 21 port Grade 2",,2024-01-01,,,,3.0,"2,00%","Two new human Anthrax cases were reported in Epi week 38. The two suspected cases were detected and reported by Warrap States, however Western Bahr el Ghazal reported zero cases. Cumulatively, human cases including three deaths have been reported across South Sudan"
OEW43-2127102024,43,21 - 27 Oct 2024,Ongoing,,"The Hepatitis E outbreak in South Sudan is still active. As of 22 September 2024, in Rukoba county (Bentiu IDPs camp), Unity State ( 5 869 cases and 33 deaths) since December 2018, in Fangak county ( 693 cases, 27 deaths ) , Jonglei State since 2023; in cases and four deaths ) since June 2024 ; , in Twic county ( 32 cases ), Warrap State since February 2024. . In Western Bahr EL-Ghazal State, a total of 501 cases were reported, with 19 deaths. As of 1 September 2024, a total of 7 127 cases and 83 (CFR 1.2%) deaths are reported in the country","The Hepatitis E outbreak in South Sudan is still active. As of 22 September 2024, in Rukoba county (Bentiu IDPs camp), Unity State ( 5 869 cases and 33 deaths) since December 2018, in Fangak county ( 693 cases, 27 deaths ) , Jonglei State since 2023; in cases and four deaths ) since June 2024 ; , in Twic county ( 32 cases ), Warrap State since February 2024. . In Western Bahr EL-Ghazal State, a total of 501 cases were reported, with 19 deaths. As of 1 September 2024, a total of 7 127 cases and 83 (CFR 1.2%) deaths are reported in the country","The Hepatitis E outbreak in South Sudan is still active. As of 22 September 2024, in Rukoba county (Bentiu IDPs camp), Unity State ( 5 869 cases and 33 deaths) since December 2018, in Fangak county ( 693 cases, 27 deaths ) , Jonglei State since 2023; in cases and four deaths ) since June 2024 ; , in Twic county ( 32 cases ), Warrap State since February 2024. . In Western Bahr EL-Ghazal State, a total of 501 cases were reported, with 19 deaths. As of 1 September 2024, a total of 7 127 cases and 83 (CFR 1.2%) deaths are reported in the country",,,,,,,"The Hepatitis E outbreak in South Sudan is still active. As of 22 September 2024, in Rukoba county (Bentiu IDPs camp), Unity State ( 5 869 cases and 33 deaths) since December 2018, in Fangak county ( 693 cases, 27 deaths ) , Jonglei State since 2023; in cases and four deaths ) since June 2024 ; , in Twic county ( 32 cases ), Warrap State since February 2024. . In Western Bahr EL-Ghazal State, a total of 501 cases were reported, with 19 deaths. As of 1 September 2024, a total of 7 127 cases and 83 (CFR 1.2%) deaths are reported in the country",
OEW43-2127102024,43,21 - 27 Oct 2024,Ongoing,SSD,South Sudan,Measles,Ungraded,2022-02-23,2024-01-01,2024-10-04,3200.0,977.0,41.0,"1,30%","In 2024, as of 4 October 2024, 3 200 suspected measles cases were reported with 184 (5.75%) lab- confirmed and 793 Epi-linked cases. A total of 41 measles related deaths were reported with case fatality ratio of 1.3%. 13 suspected cases were reported between week 37 and 38 with 10 confirmed from 5 villages in Ezo County"
OEW43-2127102024,43,21 - 27 Oct 2024,Ongoing,SSD,South Sudan,Poliomyelitis (cVDPV2),Grade 2,2024-02-26,2023-01-01,2024-09-22,11.0,11.0,0.0,"0,00%","The Ministry of Health declared the cVDPV2 outbreak as a public health emergency on 22 December 2023, following confirmation of the disease in Yambio. The total number of laboratory-confirmed cVDPV2 isolates from AFP cases are 11. Cases are reported from Yambio in Western Equatoria, Juba in Central Equatoria, Ayod in Jonglei, Baliet, Luakpiny/Nasir, and Longechuk in Upper Nile, and Tambura in Western Equatoria state"
OEW43-2127102024,43,21 - 27 Oct 2024,Ongoing,SSD,South Sudan,Suspected food poisoning,Ungraded,,2024-07-04,2024-10-10,23.0,,23.0,"100,00%","Twenty-three (23) human deaths were reported across Aweil East and Aweil South counties, northwestern Bahr el Ghazel state of South Sudan between 4 July and 15 August 2024. The most affected age-groups are 18 years and above (n=9; 39%) and 5-11 years (n=7; 30%) and females account for 61% (14 deaths) of the reported deaths. Samples ( blood and food consumed ) arrived at Uganda Government Analytic Laboratories (UGAL) in Uganda for General toxicology analysis"
