NAME,WEEK,DATE,EVENT_TYPE,ISO3,COUNTRY,EVENT_NAME,GRADE,DATE_NOTIFY,DATE_START,DATE_END,CASES_TOTAL,CASES_CONFIRMED,DEATHS,CFR,DESCRIPTION
OEW43-2127102024,43,21 - 27 Oct 2024,New,SSD,South Sudan,Cholera,Grade 3,2024-10-11,2024-10-25,2024-10-25,33.0,6.0,,"0,00%","South Sudan Ministry of Health has officially declared a cholera outbreak in Renk County, Upper Nile State. The outbreak is exacerbated by ongoing population movements-"
OEW43-2127102024,43,21 - 27 Oct 2024,Ongoing,DZA,Algeria,Diphtheria,Ungraded,2024-08-28,2024-10-01,2024-10-04,115.0,115.0,28.0,"24,30%","An outbreak of diphtheria has been recorded in Tinzaouatine, In Guezam, Timiaouine, Bordj Badji Mokhtar which started in 28 August 2024. As at 30 September, 115 cases with 28 deaths have been recorded. 27 (96.4%) of the deaths were reported from Tinzaouatine only"
OEW43-2127102024,43,21 - 27 Oct 2024,Ongoing,DZA,Algeria,Malaria,Ungraded,2024-08-28,2024-10-01,2024-10-04,421.0,421.0,12.0,"2,90%",Dozens of deaths have been reported in southern Algeria due to outbreaks of malaria with cases imported from endemic countries. The spread is linked to the region's proximity to African countries with high migration and recent floods that worsened the situation
OEW43-2127102024,43,21 - 27 Oct 2024,Ongoing,,"Crisis (IPC Phase 3) outcomes are expected in Angola's drought-affected southern and eastern provinces (Cunene, Cuando Cubango, Moxico, and Huila). Households in these areas have low food stocks and reduced agricultural labor opportunities which have led to a significant decrease in purchasing power among poor households at a time when they are increasingly reliant on markets to meet their food needs. An estimated 1.0 to 1.5 million people in Angola will likely need humanitarian food assistance by January 2025, primarily in south and east Angola, which have experienced repeated droughts, particularly in the provinces of Cunene, Cuando Cubango, Moxico, and parts of Namibe and Huila. Crisis (IPC Phase 3) outcomes are likely in these.","Crisis (IPC Phase 3) outcomes are expected in Angola's drought-affected southern and eastern provinces (Cunene, Cuando Cubango, Moxico, and Huila). Households in these areas have low food stocks and reduced agricultural labor opportunities which have led to a significant decrease in purchasing power among poor households at a time when they are increasingly reliant on markets to meet their food needs. An estimated 1.0 to 1.5 million people in Angola will likely need humanitarian food assistance by January 2025, primarily in south and east Angola, which have experienced repeated droughts, particularly in the provinces of Cunene, Cuando Cubango, Moxico, and parts of Namibe and Huila. Crisis (IPC Phase 3) outcomes are likely in these.","Crisis (IPC Phase 3) outcomes are expected in Angola's drought-affected southern and eastern provinces (Cunene, Cuando Cubango, Moxico, and Huila). Households in these areas have low food stocks and reduced agricultural labor opportunities which have led to a significant decrease in purchasing power among poor households at a time when they are increasingly reliant on markets to meet their food needs. An estimated 1.0 to 1.5 million people in Angola will likely need humanitarian food assistance by January 2025, primarily in south and east Angola, which have experienced repeated droughts, particularly in the provinces of Cunene, Cuando Cubango, Moxico, and parts of Namibe and Huila. Crisis (IPC Phase 3) outcomes are likely in these.",,,,,,,"Crisis (IPC Phase 3) outcomes are expected in Angola's drought-affected southern and eastern provinces (Cunene, Cuando Cubango, Moxico, and Huila). Households in these areas have low food stocks and reduced agricultural labor opportunities which have led to a significant decrease in purchasing power among poor households at a time when they are increasingly reliant on markets to meet their food needs. An estimated 1.0 to 1.5 million people in Angola will likely need humanitarian food assistance by January 2025, primarily in south and east Angola, which have experienced repeated droughts, particularly in the provinces of Cunene, Cuando Cubango, Moxico, and parts of Namibe and Huila. Crisis (IPC Phase 3) outcomes are likely in these.",
OEW43-2127102024,43,21 - 27 Oct 2024,Ongoing,AGO,Angola,Food Poisoning,Ungraded,2024-09-11,2024-09-12,2024-09-12,111.0,48.0,0.0,"0,00%","The incident occurred earlier this week, when dozens of residents of Camena village sought care at Doctor Walter Strang Hospital. The suspicion is that the contamination occurred through the consumption of corn (protected with pesticide) used in the preparation of food for a funeral event. A total of 111 people, between 2 and 80 years, sought medical attention. Of these, 48 were discharged, 36 were transferred to other health units and the others are still under observation. There were no fatalities."
OEW43-2127102024,43,21 - 27 Oct 2024,Ongoing,AGO,Angola,Poliomyelitis (cVDPV2),Grade 2,2024-05-15,2024-05-15,2024-09-04,13.0,13.0,0.0,"0,00% of","On 3 May, 2024, Angolan health authorities announced the detection of polio in Chitato Municipality, Lunda Norte province, which borders the Democratic Republic Congo. Currently a total of 10 laboratory confirmed poliovirus were notified in the provinces of Luanda, Huambo, Lunda Norte and Moxico. Of these, four were detected in children under five and six in the environment."
OEW43-2127102024,43,21 - 27 Oct 2024,Ongoing,BEN,Benin,Measles,Ungraded,2024-07-03,2024-01-01,2024-06-23,728.0,321.0,0.0,"0,00%","A measles outbreak has been ongoing in Benin, from week 1 through week 25, 2024 (ending 23 June), with a total of 728 suspected cases of measles, including 288 confirmed IgM+ cases, 33 clinically compatible cases are reported with the incidence rate of 24.9 per 1 million population"
OEW43-2127102024,43,21 - 27 Oct 2024,Ongoing,,"2023 marked the third consecutive year of severe drought in Botswana, with conditions showing no signs of improvement in 2024 because of El Niño. On 24 May 2024, the Rural Development Secretariat under the Ministry of Local Government and Rural Development issued a report urging support due to the devastating impact of drought on food security drivers, nutrition, water supplies, and food production.","2023 marked the third consecutive year of severe drought in Botswana, with conditions showing no signs of improvement in 2024 because of El Niño. On 24 May 2024, the Rural Development Secretariat under the Ministry of Local Government and Rural Development issued a report urging support due to the devastating impact of drought on food security drivers, nutrition, water supplies, and food production.","2023 marked the third consecutive year of severe drought in Botswana, with conditions showing no signs of improvement in 2024 because of El Niño. On 24 May 2024, the Rural Development Secretariat under the Ministry of Local Government and Rural Development issued a report urging support due to the devastating impact of drought on food security drivers, nutrition, water supplies, and food production.",,,,,,,"2023 marked the third consecutive year of severe drought in Botswana, with conditions showing no signs of improvement in 2024 because of El Niño. On 24 May 2024, the Rural Development Secretariat under the Ministry of Local Government and Rural Development issued a report urging support due to the devastating impact of drought on food security drivers, nutrition, water supplies, and food production.",
OEW43-2127102024,43,21 - 27 Oct 2024,Ongoing,BFA,Burkina Faso,Humanitarian crisis (Sahel Region),Protracted 2,2019-01-01,2019-01-01,2024-04-18,5.0,5.0,,-,"Since 2015, the security situation in the Sahel and Eastern Burkina Faso has gradually deteriorated due to attacks by armed groups. Access to healthcare services remains a major challenge for the affected population. As of February 2024, 5.5 million people needed humanitarian assistance, 3.2 million of which are children and over 2.1 million IDPs registered, and 5 478 schools closed."
OEW43-2127102024,43,21 - 27 Oct 2024,Ongoing,BFA,Burkina Faso,Hepatitis E,Ungraded,2024-06-06,2024-01-04,2024-06-01,93.0,8.0,3.0,"3,20%","From 4 January to 1 June 2024, a total of 93 suspected cases of hepatitis E were reported from Kaya health district of the North central region. Eight out of 63 samples tested positive for hepatitis E by PCR. The median age of the cases is 22 and women represent 47.4% of the cases. Fourty-six (48.5%) of the 93 suspected cases are internally displaced persons."
OEW43-2127102024,43,21 - 27 Oct 2024,Ongoing,BFA,Burkina Faso,Measles,Ungraded,2024-02-06,2024-01-14,2024-05-28,9904.0,484.0,46.0,"0,50%","Burkina Faso is experiencing a decrease in measles cases. Between week 1 and week 21 of 2024, a total of 9 904 suspected measles cases, resulting in 46 deaths, were recorded. This downward trend is observed in all nine health districts that conducted the anticipated reactive campaign. Currently only four health districts have active outbreaks of measles."
OEW43-2127102024,43,21 - 27 Oct 2024,Ongoing,BDI,Burundi,Cholera,Grade 3,2023-01-01,2022-12-14,2024-06-01,1890.0,,11.0,"0,60%","Burundi faces cholera outbreaks almost every year in some areas. The ongoing cholera outbreak was officially declared on 1 January 2023. As of 1 June 2024, a total of 1 890 cases, 11 deaths (CFR 0.6%), have been reported since the start of the outbreak."
OEW43-2127102024,43,21 - 27 Oct 2024,Ongoing,BDI,Burundi,Measles,Ungraded,2024-02-15,2023-01-01,2024-02-12,1670.0,1.0,22.0,"1,30%",
OEW43-2127102024,43,21 - 27 Oct 2024,Ongoing,BDI,Burundi,Mpox,Grade 3,2024-07-25,2024-07-25,2024-07-25,3.0,3.0,0.0,"0,00%","On 25 July 2024, the Ministry of Health of Burundi declared an outbreak of Mpox following confirmation of three cases by the National Reference Laboratory. These cases were identified on 22 July at Kamenge University Hospital, Kamenge Military Hospital, and Isare Health District. They presented with symptoms including fever, joint pain,"
OEW43-2127102024,43,21 - 27 Oct 2024,Ongoing,,"Heavy rainfall in Cameroon's Far North Region since mid-August has affected 120 000 people, caused 3700 houses to collapse, and destroyed 2000 hectares of crops. With continued severe weather expected, 350 000 people are at risk from flooding, according to UNOSAT.","Heavy rainfall in Cameroon's Far North Region since mid-August has affected 120 000 people, caused 3700 houses to collapse, and destroyed 2000 hectares of crops. With continued severe weather expected, 350 000 people are at risk from flooding, according to UNOSAT.","Heavy rainfall in Cameroon's Far North Region since mid-August has affected 120 000 people, caused 3700 houses to collapse, and destroyed 2000 hectares of crops. With continued severe weather expected, 350 000 people are at risk from flooding, according to UNOSAT.",,,,,,,"Heavy rainfall in Cameroon's Far North Region since mid-August has affected 120 000 people, caused 3700 houses to collapse, and destroyed 2000 hectares of crops. With continued severe weather expected, 350 000 people are at risk from flooding, according to UNOSAT.",
OEW43-2127102024,43,21 - 27 Oct 2024,Ongoing,CMR,Cameroon,Humanitarian crisis (Noth- West & South-West ),Protracted 2,2016-10-01,2018-06-27,2024-05-07,3.0,,,-,"In the North-West and South-West regions, the unstable security situation and persistent violence are exacerbating humanitarian needs. Affected people continue to flee their homes to neighbouring villages and communities. By May 2024, the following observations were made: 3.4M people in need, 2.3M people targeted, 1M IDPs, 658k Returnees and 489K Refugees and Asylum Seekers."
OEW43-2127102024,43,21 - 27 Oct 2024,Ongoing,CMR,Cameroon,Humanitarian crisis (Sahel Region),Protracted 2,2013-12-31,2017-06-27,2024-02-13,,,,-,"The Far North region of Cameroon is still facing humanitarian crisis. The region bordering Nigeria and Chad and Lake Chad remains the most affected. Between August and September 2023, nearly 6 000 newly displaced people were registered in Mokolo district following repeated attacks by non-state armed groups. More than 2 200 new asylum seekers/refugees were registered for the same period at Gourenguel transit site, in Mokolo district of Mayo-Tsanaga department."
OEW43-2127102024,43,21 - 27 Oct 2024,Ongoing,CMR,Cameroon,Measles,Ungraded,2019-04-02,2024-01-01,2024-08-05,1359.0,232.0,49.0,"3,60%","From Week 1 to Week 13 (ending 31 March 2024), 645 suspected measles cases, including 104 deaths (CFR 16%), were reported in Cameroon. A cumulative total of 232 cases were confirmed, including 129 IgM positive, 88 epidemiologically linked, and 15 clinically compatible. In 2023, 6 088 confirmed measles cases and at least 75 related deaths were reported in Cameroon."
OEW43-2127102024,43,21 - 27 Oct 2024,Ongoing,CMR,Cameroon,Mpox,Grade 3,2022-02-24,2024-01-01,2024-04-04,15.0,2.0,1.0,"6,70%","From 1 January to 4 April 2024, 15 suspected cases of Mpox including 2 laboratory-confirmed and 1 death have been reported. From 1 January to 28 December 2023, 113 suspected cases of Mpox, including 27 laboratory-confirmed and no death were reported. In 2022, 18 confirmed cases and three deaths were reported in the country."
OEW43-2127102024,43,21 - 27 Oct 2024,Ongoing,CMR,Cameroon,Yellow Fever,Ungraded,2023-11-20,2023-01-23,2024-07-14,11.0,5.0,0.0,"0,00%","From week 1 to week 28 of 2024, Cameroon reported 11 plaque reduction neutralization test (PRNT) positive yellow fever cases across seven regions. Among these PRNT positive cases, five have been classified as confirmed cases in four regions: Adamawa, Centre, Littoral, and Nord Regions. Additionally, 11 cases are currently awaiting PRNT results."
OEW43-2127102024,43,21 - 27 Oct 2024,Ongoing,,Cape Verde,Dengue,Grade 3,2023-11-06,2023-11-06,2024-03-24,992.0,543.0,0.0,"0,00%","On 6 November 2023, the Ministry of Health Surveillance Service reported two confirmed cases of Dengue through Polymerase Chain Reaction testing and one borderline case in Praia City, Santiago Island, Cabo Verde. The same day three more suspected cases were reported from the Central Hospital. As of 11 March 2024, a total of 992 suspected cases, including 543 confirmed cases and no deaths, were reported."
OEW43-2127102024,43,21 - 27 Oct 2024,Ongoing,CAF,Central African Republic,Humanitarian crisis,Protracted 2,2013-12-11,2013-12-11,2024-06-05,6.0,,,-,"The Central African Republic has been facing a humanitarian crisis for more than a decade following military-political conflicts. Of the country's 6.1 million inhabitants, 2.8 million will need humanitarian assistance in 2024. More than 522 000 people are currently internally displaced, 2.5 million suffer from food insecurity, and 756 000 are CAR refugees."
OEW43-2127102024,43,21 - 27 Oct 2024,Ongoing,CAF,Central African Republic,Impact of Sudan crisis in CAR,Grade 3,2023-05-01,2023-05-01,2024-07-31,,,,,"CAR is the least affected among the four AFRO countries regarding the ongoing Sudan conflict As of 06 May 2024, there were 71, 000 forcibly displaced people from Sudan who arrived in CAR since 15 April 2023. Out of this number, 6 158 are returnees and 23 286 Sudanese refugees\asylum seekers."
OEW43-2127102024,43,21 - 27 Oct 2024,Ongoing,CAF,Central African Republic,Dengue,Grade 3,2024-09-10,2024-07-13,2024-09-07,16.0,16.0,0.0,"0,00%","On 10 September 2024, WHO was informed of a confirmed dengue outbreak in Central African Republic. The first case was confirmed on 13 July 2024 in a 29-year-old woman from SICA I commune of Bangui. From 13 July to 7 September 2024, a total of 13 cases (7 females and 6 males) were laboratory-confirmed for dengue serotype 2 (DEN 2) at Institut Pasteur of Bangui. The 13 confirmed cases were from Bangui 1, Bangui 2 and Bimbo health districts. Three cases were evacuated and diagnosed out of the country. Investigations are ongoing."
OEW43-2127102024,43,21 - 27 Oct 2024,Ongoing,CAF,Central African Republic,Hepatitis E,Ungraded,2024-06-13,2024-04-14,2024-07-06,49.0,6.0,3.0,"12,20%","As of July 6, 2024, 49 suspected cases were recorded including six confirmed cases and three deaths (CFR 6.0%). Of nine samples analyzed at the viral hepatitis laboratory of the Pasteur Institute in Bangui, six were positive for acute hepatitis E virus infection. Seven (7) new samples are being analyzed at the Pasteur Institute in Bangui."
OEW43-2127102024,43,21 - 27 Oct 2024,Ongoing,,Central African Republic At the end of,"Measles epi-week 24, 2024,",Ungraded the country,,,,,,,"0,10% responding to",
OEW43-2127102024,43,21 - 27 Oct 2024,Ongoing,CAF,Central African Republic,Poliomyelitis (cVDPV2),Grade 2,2019-05-24,2019-05-24,2024-09-01,45.0,45.0,0.0,"0,00%",A total of 14 AFP cases were reported in the country in 2023. Six AFP cases were reported in 2022. There were no new case reported in the country as of week 35 of 2024. last date of detection is 07 October 2023.
OEW43-2127102024,43,21 - 27 Oct 2024,Ongoing,CAF,Central African Republic,Yellow Fever,Ungraded,2023-06-12,2023-01-01,2024-04-21,11.0,5.0,0.0,"0,00%","Chad has recorded one new probable yellow fever case, which tested positive using the plaque reduction neutralization test (PRNT) in week 15, in the Vakaga health district, bringing the total number of probable cases in 2024 to six. Other probable cases for the year have been reported in the Mbaïki and Kémo health districts. In 2023, five confirmed cases of yellow fever were recorded for the following districts: Sangha-Mbaéré (1), Berbérati (1), Bambari (2), and Bossembélé (1). The number of confirmed cases this year has been reviewed."
OEW43-2127102024,43,21 - 27 Oct 2024,Ongoing,,"Since late July, floods have impacted all 23 provinces of Chad, affecting 964 068 people, causing 145 deaths, and destroying 70 000 homes, with 58 804 people affected in N'Djaména alone. Over 5 000 displaced people are sheltering in schools, and 749 households still need relocation. The Government, with support from humanitarian agencies, launched a USD 64 million response plan, but only USD 7 million has been secured, leaving a USD 57 million funding gap. The risk of a cholera outbreak remains high due to limited access to water, sanitation, and hygiene services.","Since late July, floods have impacted all 23 provinces of Chad, affecting 964 068 people, causing 145 deaths, and destroying 70 000 homes, with 58 804 people affected in N'Djaména alone. Over 5 000 displaced people are sheltering in schools, and 749 households still need relocation. The Government, with support from humanitarian agencies, launched a USD 64 million response plan, but only USD 7 million has been secured, leaving a USD 57 million funding gap. The risk of a cholera outbreak remains high due to limited access to water, sanitation, and hygiene services.","Since late July, floods have impacted all 23 provinces of Chad, affecting 964 068 people, causing 145 deaths, and destroying 70 000 homes, with 58 804 people affected in N'Djaména alone. Over 5 000 displaced people are sheltering in schools, and 749 households still need relocation. The Government, with support from humanitarian agencies, launched a USD 64 million response plan, but only USD 7 million has been secured, leaving a USD 57 million funding gap. The risk of a cholera outbreak remains high due to limited access to water, sanitation, and hygiene services.",,,,,,,"Since late July, floods have impacted all 23 provinces of Chad, affecting 964 068 people, causing 145 deaths, and destroying 70 000 homes, with 58 804 people affected in N'Djaména alone. Over 5 000 displaced people are sheltering in schools, and 749 households still need relocation. The Government, with support from humanitarian agencies, launched a USD 64 million response plan, but only USD 7 million has been secured, leaving a USD 57 million funding gap. The risk of a cholera outbreak remains high due to limited access to water, sanitation, and hygiene services.",
OEW43-2127102024,43,21 - 27 Oct 2024,Ongoing,TCD,Chad,Humanitarian crisis (Sahel region),Protracted 2,2022-02-11,2016-03-01,2024-06-28,2.0,,,-,"Since the beginning of the conflict in Sudan on 15 April 2023 and as of 28 June 2024, Chad have registered 617,013 Sudanese refugees and 128,726 Chadian returnees from Sudan. 63 per cent of the refugees and 66 per cent of the returnees are children under 18. The refugees are arriving in the provinces of Ouaddaï, Sila, Wadi Fira, and Ennedi Est. According to the Chadian Government, 910,000 refugees and returnees could arrive in Chad by the end of 2024. Chad is already hosting approximately 410,000 Sudanese refugees from the previous Darfur crisis in the same provinces"
OEW43-2127102024,43,21 - 27 Oct 2024,Ongoing,TCD,Chad,Impact of Sudan crisis in Chad,Grade 3,2023-04-15,2023-04-15,2024-05-10,,,,-,"Chad is the AFRO country most affected by the armed conflict in Sudan, hosting about 1 million refugees. These Sudanese refugees are mainly hosted in the refugee's camps across Ennedi Est, Wadi Fira, Ouaddai and Sila provinces. From 15 April 2023 to 3 May 2024, about 588 825 Sudanese refugees have been listed including 96 181 that have crossed the border since January 2024. Most new arrivals are women and children (88%), and 14% are persons with special needs,"
OEW43-2127102024,43,21 - 27 Oct 2024,Ongoing,TCD,Chad,Hepatitis E,Ungraded,2024-02-17,2024-01-02,2024-08-25,3446.0,177.0,11.0,"0,40%","As of 25 August 2024, a total of 3 446 suspected cases including 11 deaths (CFR 0.4%) were reported from 11 refugee camps and sites in eight health districts of four provinces (Ouaddaï, Sila, Wadi-fira and Ennedi-Est provinces). A total of 177 cases were laboratory-confirmed by RT-PCR. Fifty-eight cases were recorded among pregnant"
OEW43-2127102024,43,21 - 27 Oct 2024,Ongoing,TCD,Chad,Measles,Ungraded,2018-05-24,2024-01-01,2024-05-05,5631.0,,20.0,"0,40%","From 1 January to 5 May 2024, 5 631 suspected measles cases, including 20 deaths, were recorded in the health districts of Moissala, Guelo, Dono Manga, Kouloudia, Arada, N'Djamena Centre, N'Djamena East, Gagal, Gore, N'Djamena North, Amtiman, Pala, Kouno, Massakory, and Koukou Angarana. Between Week 1 and Week 18 of 2024, 182 suspected cases were recorded in the crisis-affected provinces of the East, with no deaths reported."
OEW43-2127102024,43,21 - 27 Oct 2024,Ongoing,TCD,Chad,Poliomyelitis (cVDPV2),Grade 2,2019-10-18,2019-09-09,2024-08-28,222.0,222.0,0.0,"0,00%","Eight cases were reported in 2024. In 2023, a total of 55 cVDPV2 cases were reported. In 2022, 44 cVDPV2 cases were reported. In 2020, 106 cVDPV2 cases were reported from three different outbreaks. Nine cases were reported in 2019. The last date of detection was 13 July 2024."
OEW43-2127102024,43,21 - 27 Oct 2024,Ongoing,COM,Comoros,Cholera,Grade 3,2024-02-02,2024-02-02,2024-06-25,10142.0,,147.0,"1,40%","The cholera outbreak has been ongoing in Comoros since the first case was reported on 2 February 2024. As of 30 June 2024, a cumulative total of 10 142 cases had been reported, with the majority of cases reported from Ndzuwani (8 942 cases), followed by Ngazidja (625 cases) and Mwali (575 cases); 147 deaths (CFR 1.4%) were also reported."
OEW43-2127102024,43,21 - 27 Oct 2024,Ongoing,COG,Congo,Food Poisoning,Ungraded,2024-09-17,2024-09-17,2024-09-24,26.0,26.0,6.0,"23,10%","On September 7, 2024, a case of suspected food poisoning was reported in the Nsah area of the Plateaux Department, Congo. After consuming yams gathered from the forest, 26 individuals from 14 households developed symptoms of vomiting and abdominal pain. Six people, including two women and four male children, have died. The presence of dead chickens that consumed leftover yams suggests the food was toxic. Authorities, alongside WHO consultants, are continuing the investigation."
OEW43-2127102024,43,21 - 27 Oct 2024,Ongoing,COG,Congo,Measles,Ungraded,2024-05-15,2024-01-01,2024-08-18,372.0,84.0,4.0,"1,10%","From week 1 to week 33 (ending 18 August 2024), 372 suspected cases were reported including 4 deaths (CFR 1.1%). A total of 272 samples were tested at the National Public Health Laboratory of which 84 returned positive for measles."
OEW43-2127102024,43,21 - 27 Oct 2024,Ongoing,COG,Congo,Mpox,Grade 3,2022-05-23,2024-01-01,2024-09-10,166.0,21.0,0.0,"0,00%","For the week ending 11 August 2024, the country reported six suspected cases, including two new confirmed cases. During the period from 26 August to 1 September 2024, 10 additional suspected cases were reported across several districts: Bacongo (1), Abala (1), Lumumba (3), Mvou-Mvou (1), Itoumbi (2), and Talangai (2). This brings the total number of suspected cases to 166, along with 13 probable cases. Out of 114 samples collected, 91 have been tested, with 21 cases confirmed between epidemiological weeks 2 and 35."
OEW43-2127102024,43,21 - 27 Oct 2024,Ongoing,COG,Congo,Poliomyelitis (cVDPV1),Grade 2,2023-03-21,2023-03-01,2024-08-28,1.0,1.0,,"0,00%","The last circulating vaccine-derived poliovirus type 1 (cVDPV1) case was detected on 15 October 2022. As of 28 August 2024, only one case was reported."
OEW43-2127102024,43,21 - 27 Oct 2024,Ongoing,,"An outbreak of Dengue fever is ongoing in Ivory Coast. A total of 4 050 cases have been reported from 1 January 2023 to 11 May 2024, with 325 confirmed cases and 2","An outbreak of Dengue fever is ongoing in Ivory Coast. A total of 4 050 cases have been reported from 1 January 2023 to 11 May 2024, with 325 confirmed cases and 2","An outbreak of Dengue fever is ongoing in Ivory Coast. A total of 4 050 cases have been reported from 1 January 2023 to 11 May 2024, with 325 confirmed cases and 2",,,,,,,"An outbreak of Dengue fever is ongoing in Ivory Coast. A total of 4 050 cases have been reported from 1 January 2023 to 11 May 2024, with 325 confirmed cases and 2",
OEW43-2127102024,43,21 - 27 Oct 2024,Ongoing,,deaths (CFR 0.0%).,deaths (CFR 0.0%).,deaths (CFR 0.0%).,,,,,,,deaths (CFR 0.0%).,
